number,value,datetime_start,datetime_complete,duration,params_batch_size,params_drop_out_rate,params_epochs,params_latent_dim,params_learning_rate,params_lstm_units,params_optimizer,user_attrs_relative_deterioration,user_attrs_test_r2,state
110,0.005815086260261866,2024-10-16 14:54:35.446996,2024-10-16 15:15:35.810867,0 days 00:21:00.363871,8.0,0.2,50.0,32,0.00032536516962872354,224,adam,0.3222665518918316,0.9295077230072305,COMPLETE
111,0.00902863711778279,2024-10-16 14:54:36.960321,2024-10-16 15:15:59.600118,0 days 00:21:22.639797,8.0,0.2,50.0,32,0.00025893972766428925,224,adam,0.13794381078259288,0.890552064047063,COMPLETE
112,0.007121327266615054,2024-10-16 14:55:04.839838,2024-10-16 15:16:38.530807,0 days 00:21:33.690969,8.0,0.2,50.0,32,0.00024992616057348515,224,adam,0.2670661105531355,0.913673064892457,COMPLETE
113,0.005644032399028533,2024-10-16 14:55:25.537609,2024-10-16 15:16:30.356098,0 days 00:21:04.818489,8.0,0.2,50.0,32,0.00026478163683664994,224,adam,0.3770124351287301,0.9315812909006498,COMPLETE
