number,values_0,values_1,datetime_start,datetime_complete,duration,params_alpha,params_batch_size,params_drop_out_rate,params_encoder_neurons_layer_1,params_epochs,params_lambda,params_latent_dim,params_learning_rate,params_num_layers_decoder,params_num_layers_encoder,params_optimizer,user_attrs_encoder_decoder_config,user_attrs_first_layer_neurons,user_attrs_neurons_per_layer_decoder,user_attrs_neurons_per_layer_encoder,user_attrs_r2_feature_1,user_attrs_r2_feature_2,user_attrs_relative_deterioration,state
0,,,2024-12-23 11:13:46.460189,2024-12-23 11:13:46.487236,0 days 00:00:00.027047,0.05708680920486231,,0.4,144,,2.6393763237885727e-05,,0.0004457575582734679,3,4,adadelta,,,,,,,,FAIL
1,,,2024-12-23 11:13:46.460225,2024-12-23 11:13:46.499914,0 days 00:00:00.039689,0.02910593171796299,,0.4,224,,1.01416663422372e-05,,1.1050196626972956e-05,3,5,adam,,,,,,,,FAIL
2,,,2024-12-23 11:13:46.460229,2024-12-23 11:13:46.523898,0 days 00:00:00.063669,0.05008058899810231,,0.2,16,,1.718910745728176e-06,,6.521489859020083e-05,4,3,adam,,,,,,,,FAIL
3,,,2024-12-23 11:13:46.460402,2024-12-23 11:13:46.529979,0 days 00:00:00.069577,0.026715480430176654,,0.2,232,,3.4591569704131838e-06,,4.400566355160314e-05,4,3,adadelta,,,,,,,,FAIL
4,,,2024-12-23 11:13:46.460226,2024-12-23 11:13:46.540214,0 days 00:00:00.079988,0.013074285720607075,,0.2,184,,1.4886954169772281e-05,,0.00026975052576098355,4,2,adadelta,,,,,,,,FAIL
5,,,2024-12-23 11:13:46.460764,2024-12-23 11:13:46.572553,0 days 00:00:00.111789,0.14345532305064967,,0.1,120,,2.041525673157884e-06,,0.0027308638978053544,5,3,sgd,,,,,,,,FAIL
6,-0.22726223596943118,0.07428269181165148,2024-12-23 11:14:19.182916,2024-12-23 11:14:22.558139,0 days 00:00:03.375223,0.030776610348766085,128.0,0.2,200,100.0,7.262439154846835e-05,576.0,0.0005132279309436478,1,1,adadelta,"{'neurons_per_layer_encoder': [200], 'neurons_per_layer_decoder': [200]}",200.0,[200],[200],[-0.22726223596943118],[0.07428269181165148],0.5245723659697674,COMPLETE
7,0.01931111552482412,-0.006044990232372038,2024-12-23 11:14:19.183779,2024-12-23 11:14:24.454781,0 days 00:00:05.271002,0.16973051666106723,120.0,0.30000000000000004,24,100.0,2.985251517970855e-06,184.0,0.0016117156865995208,5,3,adam,"{'neurons_per_layer_encoder': [24, 48, 96], 'neurons_per_layer_decoder': [96, 48, 24, 12, 8]}",24.0,"[96, 48, 24, 12, 8]","[24, 48, 96]",[0.01931111552482412],[-0.006044990232372038],-0.23098888599822714,COMPLETE
8,0.23608429824811872,0.1219486319295936,2024-12-23 11:14:19.213563,2024-12-23 11:14:24.855597,0 days 00:00:05.642034,0.06539685947253385,56.0,0.2,224,100.0,0.0001056689413270099,424.0,0.009234899149045331,5,1,adam,"{'neurons_per_layer_encoder': [224], 'neurons_per_layer_decoder': [224, 112, 56, 28, 14]}",224.0,"[224, 112, 56, 28, 14]",[224],[0.23608429824811872],[0.1219486319295936],-0.5398107530248123,COMPLETE
9,-1.1441089927276682,-0.11156787787598499,2024-12-23 11:14:19.239446,2024-12-23 11:14:22.867178,0 days 00:00:03.627732,0.03833675296647855,72.0,0.1,224,100.0,0.0009747901801373987,2392.0,0.00021720991503654908,2,3,adadelta,"{'neurons_per_layer_encoder': [224, 448, 896], 'neurons_per_layer_decoder': [896, 448]}",224.0,"[896, 448]","[224, 448, 896]",[-1.1441089927276682],[-0.11156787787598499],0.9756274493858123,COMPLETE
10,-0.5963313070376894,-0.056635587047421776,2024-12-23 11:14:19.312732,2024-12-23 11:14:26.974166,0 days 00:00:07.661434,0.04063513609865566,72.0,0.4,208,100.0,0.0007926713999264576,1080.0,3.349773989886411e-05,3,3,adadelta,"{'neurons_per_layer_encoder': [208, 416, 832], 'neurons_per_layer_decoder': [832, 416, 208]}",208.0,"[832, 416, 208]","[208, 416, 832]",[-0.5963313070376894],[-0.056635587047421776],0.9736043299151396,COMPLETE
11,-1.6664816979380586,-0.08710216959380257,2024-12-23 11:14:19.323399,2024-12-23 11:14:20.506028,0 days 00:00:01.182629,0.028948390617920598,72.0,0.4,32,100.0,0.0008813749883122028,88.0,0.00015380374022699948,3,2,sgd,"{'neurons_per_layer_encoder': [32, 64], 'neurons_per_layer_decoder': [64, 32, 16]}",32.0,"[64, 32, 16]","[32, 64]",[-1.6664816979380586],[-0.08710216959380257],0.6915556939919577,COMPLETE
12,0.24012735935608798,0.2014968299273039,2024-12-23 11:14:20.512377,2024-12-23 11:14:26.092367,0 days 00:00:05.579990,0.18688020596483526,48.0,0.2,184,100.0,0.000571384630422059,488.0,0.002341672540265333,1,2,adadelta,"{'neurons_per_layer_encoder': [184, 368], 'neurons_per_layer_decoder': [368]}",184.0,[368],"[184, 368]",[0.24012735935608798],[0.2014968299273039],0.9231218304551155,COMPLETE
13,-0.8106609588292977,-0.053689162197311235,2024-12-23 11:14:22.564643,2024-12-23 11:14:25.357241,0 days 00:00:02.792598,0.03939612483264336,112.0,0.1,72,100.0,9.509626187945929e-06,128.0,1.1494529856752882e-05,4,1,adadelta,"{'neurons_per_layer_encoder': [72], 'neurons_per_layer_decoder': [72, 36, 18, 9]}",72.0,"[72, 36, 18, 9]",[72],[-0.8106609588292977],[-0.053689162197311235],-0.3321348323418939,COMPLETE
14,-1.0957441149387344,-0.0029772625215938042,2024-12-23 11:14:22.875988,2024-12-23 11:14:26.844515,0 days 00:00:03.968527,0.12927335180316205,96.0,0.30000000000000004,192,100.0,5.718319970551606e-06,3592.0,0.0001288322991408727,5,4,sgd,"{'neurons_per_layer_encoder': [192, 384, 768, 1536], 'neurons_per_layer_decoder': [1536, 768, 384, 192, 96]}",192.0,"[1536, 768, 384, 192, 96]","[192, 384, 768, 1536]",[-1.0957441149387344],[-0.0029772625215938042],0.44053137764721445,COMPLETE
15,-1.2208397494142846,-0.09257738946215488,2024-12-23 11:14:24.464416,2024-12-23 11:14:27.755542,0 days 00:00:03.291126,0.015552110742113592,96.0,0.2,136,100.0,0.00028060469563533276,680.0,0.0003780880436900859,2,3,adadelta,"{'neurons_per_layer_encoder': [136, 272, 544], 'neurons_per_layer_decoder': [544, 272]}",136.0,"[544, 272]","[136, 272, 544]",[-1.2208397494142846],[-0.09257738946215488],0.8651281407197203,COMPLETE
16,-1.2288619406575498,-0.26465727900570135,2024-12-23 11:14:24.864180,2024-12-23 11:14:26.667783,0 days 00:00:01.803603,0.02739194912142231,32.0,0.2,32,100.0,7.037582241554211e-05,136.0,0.0014503903029037982,2,3,sgd,"{'neurons_per_layer_encoder': [32, 64, 128], 'neurons_per_layer_decoder': [128, 64]}",32.0,"[128, 64]","[32, 64, 128]",[-1.2288619406575498],[-0.26465727900570135],0.3542222851029512,COMPLETE
17,0.5523077673197463,0.09320121507514179,2024-12-23 11:14:25.363267,2024-12-23 11:14:33.282694,0 days 00:00:07.919427,0.18422024483939453,80.0,0.30000000000000004,16,100.0,1.0328625684949147e-05,344.0,0.0034495016487518224,4,4,adam,"{'neurons_per_layer_encoder': [16, 32, 64, 128], 'neurons_per_layer_decoder': [128, 64, 32, 16]}",16.0,"[128, 64, 32, 16]","[16, 32, 64, 128]",[0.5523077673197463],[0.09320121507514179],-0.10575664369193924,COMPLETE
18,-1.4335419242637872,-0.010491542983540825,2024-12-23 11:14:26.099580,2024-12-23 11:14:49.740027,0 days 00:00:23.640447,0.014660715991020104,40.0,0.2,224,100.0,1.850061338249583e-05,7320.0,4.243868569917286e-05,2,5,sgd,"{'neurons_per_layer_encoder': [224, 448, 896, 1792, 3584], 'neurons_per_layer_decoder': [3584, 1792]}",224.0,"[3584, 1792]","[224, 448, 896, 1792, 3584]",[-1.4335419242637872],[-0.010491542983540825],0.7703807006187041,COMPLETE
19,0.20808552506367795,0.07892840592474237,2024-12-23 11:14:26.675443,2024-12-23 11:14:48.058610,0 days 00:00:21.383167,0.07921838143688627,64.0,0.4,104,100.0,0.00020945404394930725,952.0,0.0002510985177716174,2,4,adam,"{'neurons_per_layer_encoder': [104, 208, 416, 832], 'neurons_per_layer_decoder': [832, 416]}",104.0,"[832, 416]","[104, 208, 416, 832]",[0.20808552506367795],[0.07892840592474237],0.9257652728991478,COMPLETE
20,-0.21136131664640612,-0.22670587764600536,2024-12-23 11:14:26.850848,2024-12-23 11:15:31.765258,0 days 00:01:04.914410,0.05191524938025553,104.0,0.2,184,100.0,0.00025582966510064264,3688.0,4.588168339173301e-05,5,5,adadelta,"{'neurons_per_layer_encoder': [184, 368, 736, 1472, 2944], 'neurons_per_layer_decoder': [2944, 1472, 736, 368, 184]}",184.0,"[2944, 1472, 736, 368, 184]","[184, 368, 736, 1472, 2944]",[-0.21136131664640612],[-0.22670587764600536],0.9811770475746117,COMPLETE
21,0.4930780662350702,0.35534841154127983,2024-12-23 11:14:26.984417,2024-12-23 11:15:46.203535,0 days 00:01:19.219118,0.010288612062056071,32.0,0.1,136,100.0,1.0265163036576093e-06,6088.0,0.009781163198996395,1,5,adadelta,"{'neurons_per_layer_encoder': [136, 272, 544, 1088, 2176], 'neurons_per_layer_decoder': [2176]}",136.0,[2176],"[136, 272, 544, 1088, 2176]",[0.4930780662350702],[0.35534841154127983],0.20310303204184943,COMPLETE
22,-1.1981112181963116,-0.16439270582047394,2024-12-23 11:14:27.762457,2024-12-23 11:15:15.017760,0 days 00:00:47.255303,0.09333838791105604,40.0,0.1,144,100.0,0.00019699327954271313,6840.0,0.008916600607547141,1,5,adam,"{'neurons_per_layer_encoder': [144, 288, 576, 1152, 2304], 'neurons_per_layer_decoder': [2304]}",144.0,[2304],"[144, 288, 576, 1152, 2304]",[-1.1981112181963116],[-0.16439270582047394],0.8466226413673288,COMPLETE
23,0.5156211483938344,0.053897796419998256,2024-12-23 11:14:33.309248,2024-12-23 11:15:47.740292,0 days 00:01:14.431044,0.09533203223036221,40.0,0.30000000000000004,136,100.0,1.098775564238878e-06,6392.0,0.0069916709700686966,4,5,adam,"{'neurons_per_layer_encoder': [136, 272, 544, 1088, 2176], 'neurons_per_layer_decoder': [2176, 1088, 544, 272]}",136.0,"[2176, 1088, 544, 272]","[136, 272, 544, 1088, 2176]",[0.5156211483938344],[0.053897796419998256],0.4225017653492128,COMPLETE
24,0.13130223480600312,0.05587335114409686,2024-12-23 11:14:48.143117,2024-12-23 11:16:29.395966,0 days 00:01:41.252849,0.19938211690815993,40.0,0.30000000000000004,152,100.0,1.798193984610832e-05,7240.0,0.008365279724574775,4,5,adam,"{'neurons_per_layer_encoder': [152, 304, 608, 1216, 2432], 'neurons_per_layer_decoder': [2432, 1216, 608, 304]}",152.0,"[2432, 1216, 608, 304]","[152, 304, 608, 1216, 2432]",[0.13130223480600312],[0.05587335114409686],0.26684320733119404,COMPLETE
25,0.42585768823199577,-0.034622454544515735,2024-12-23 11:14:49.757504,2024-12-23 11:15:44.313121,0 days 00:00:54.555617,0.1941739882172666,88.0,0.30000000000000004,160,100.0,1.230709377184978e-06,3016.0,0.00937105356765499,4,5,adam,"{'neurons_per_layer_encoder': [160, 320, 640, 1280, 2560], 'neurons_per_layer_decoder': [2560, 1280, 640, 320]}",160.0,"[2560, 1280, 640, 320]","[160, 320, 640, 1280, 2560]",[0.42585768823199577],[-0.034622454544515735],0.4618040020946249,COMPLETE
26,0.23940637450122626,0.04610272429355222,2024-12-23 11:15:15.064006,2024-12-23 11:15:36.613487,0 days 00:00:21.549481,0.154599260873337,96.0,0.30000000000000004,168,100.0,1.6688629181399158e-06,408.0,0.0028708720224070606,4,2,adam,"{'neurons_per_layer_encoder': [168, 336], 'neurons_per_layer_decoder': [336, 168, 84, 42]}",168.0,"[336, 168, 84, 42]","[168, 336]",[0.23940637450122626],[0.04610272429355222],-1.073093579564695,COMPLETE
27,0.40432774317872844,0.12055047474733327,2024-12-23 11:15:31.842561,2024-12-23 11:15:49.505851,0 days 00:00:17.663290,0.1961860370806878,56.0,0.30000000000000004,256,100.0,1.993440081039042e-06,584.0,0.002911278916614527,4,2,adam,"{'neurons_per_layer_encoder': [256, 512], 'neurons_per_layer_decoder': [512, 256, 128, 64]}",256.0,"[512, 256, 128, 64]","[256, 512]",[0.40432774317872844],[0.12055047474733327],-0.7503358564521306,COMPLETE
28,0.1745351261721253,0.05462024801235321,2024-12-23 11:15:36.626109,2024-12-23 11:16:17.931119,0 days 00:00:41.305010,0.10933000678368747,48.0,0.30000000000000004,256,100.0,2.6454482386144736e-05,2392.0,0.0039430509661953,4,4,adam,"{'neurons_per_layer_encoder': [256, 512, 1024, 2048], 'neurons_per_layer_decoder': [2048, 1024, 512, 256]}",256.0,"[2048, 1024, 512, 256]","[256, 512, 1024, 2048]",[0.1745351261721253],[0.05462024801235321],0.4166475296535934,COMPLETE
29,-0.523189177997957,0.07944128434818454,2024-12-23 11:15:44.323631,2024-12-23 11:16:01.547357,0 days 00:00:17.223726,0.12134861052128737,56.0,0.30000000000000004,256,100.0,2.0762306351698386e-05,2312.0,0.0028606291748154047,4,4,adam,"{'neurons_per_layer_encoder': [256, 512, 1024, 2048], 'neurons_per_layer_decoder': [2048, 1024, 512, 256]}",256.0,"[2048, 1024, 512, 256]","[256, 512, 1024, 2048]",[-0.523189177997957],[0.07944128434818454],0.723756143198475,COMPLETE
30,-1.3617070421404645,-0.05296859476912452,2024-12-23 11:15:46.222614,2024-12-23 11:15:55.596149,0 days 00:00:09.373535,0.010048561813101526,32.0,0.1,104,100.0,3.2141647901945288e-06,1752.0,0.004616879210098824,1,4,adadelta,"{'neurons_per_layer_encoder': [104, 208, 416, 832], 'neurons_per_layer_decoder': [832]}",104.0,[832],"[104, 208, 416, 832]",[-1.3617070421404645],[-0.05296859476912452],0.32864943920954093,COMPLETE
31,0.3014300970914252,0.08775185905511251,2024-12-23 11:15:47.751266,2024-12-23 11:16:06.660229,0 days 00:00:18.908963,0.011110959835386385,56.0,0.1,96,100.0,2.898873860872594e-06,1672.0,0.003370588128413944,1,4,adadelta,"{'neurons_per_layer_encoder': [96, 192, 384, 768], 'neurons_per_layer_decoder': [768]}",96.0,[768],"[96, 192, 384, 768]",[0.3014300970914252],[0.08775185905511251],0.09292274398422067,COMPLETE
32,0.15447669595790836,0.25054312215870955,2024-12-23 11:15:49.517188,2024-12-23 11:16:12.731198,0 days 00:00:23.214010,0.010168221729385533,32.0,0.1,88,100.0,2.8673529490044988e-06,1640.0,0.004128429763250266,1,4,adadelta,"{'neurons_per_layer_encoder': [88, 176, 352, 704], 'neurons_per_layer_decoder': [704]}",88.0,[704],"[88, 176, 352, 704]",[0.15447669595790836],[0.25054312215870955],0.06567856787378294,COMPLETE
33,0.2767873812981797,0.07969565735769191,2024-12-23 11:15:55.605262,2024-12-23 11:16:47.137822,0 days 00:00:51.532560,0.019608844238871014,56.0,0.1,248,100.0,2.4123320302622445e-06,4808.0,0.004174620321060115,3,4,adadelta,"{'neurons_per_layer_encoder': [248, 496, 992, 1984], 'neurons_per_layer_decoder': [1984, 992, 496]}",248.0,"[1984, 992, 496]","[248, 496, 992, 1984]",[0.2767873812981797],[0.07969565735769191],0.30816692697498616,COMPLETE
34,-0.05775571017793246,-0.8897638734870563,2024-12-23 11:16:01.572417,2024-12-23 11:16:15.313515,0 days 00:00:13.741098,0.01696630628651106,48.0,0.1,72,100.0,2.4551737085526277e-06,1384.0,0.0007110780570776558,3,4,adadelta,"{'neurons_per_layer_encoder': [72, 144, 288, 576], 'neurons_per_layer_decoder': [576, 288, 144]}",72.0,"[576, 288, 144]","[72, 144, 288, 576]",[-0.05775571017793246],[-0.8897638734870563],0.11427245401159662,COMPLETE
35,0.0025261866790413645,-0.29627881991893656,2024-12-23 11:16:06.670030,2024-12-23 11:16:34.828128,0 days 00:00:28.158098,0.019994552232122913,32.0,0.1,64,100.0,1.7513749693345168e-06,2728.0,0.0008295800732856918,3,5,adadelta,"{'neurons_per_layer_encoder': [64, 128, 256, 512, 1024], 'neurons_per_layer_decoder': [1024, 512, 256]}",64.0,"[1024, 512, 256]","[64, 128, 256, 512, 1024]",[0.0025261866790413645],[-0.29627881991893656],0.1876603227946814,COMPLETE
36,-0.4600378211317393,-0.07779007667801552,2024-12-23 11:16:12.744402,2024-12-23 11:16:35.708951,0 days 00:00:22.964549,0.020487518673368513,48.0,0.1,48,100.0,7.052302497391621e-06,1928.0,0.0013407004619963706,3,5,adadelta,"{'neurons_per_layer_encoder': [48, 96, 192, 384, 768], 'neurons_per_layer_decoder': [768, 384, 192]}",48.0,"[768, 384, 192]","[48, 96, 192, 384, 768]",[-0.4600378211317393],[-0.07779007667801552],0.40712175495220804,COMPLETE
37,-0.02026820680692243,-0.01756606414348516,2024-12-23 11:16:15.339534,2024-12-23 11:16:33.698302,0 days 00:00:18.358768,0.020761341076383135,48.0,0.4,56,100.0,7.008942575855391e-06,2104.0,0.005238993789101665,3,5,sgd,"{'neurons_per_layer_encoder': [56, 112, 224, 448, 896], 'neurons_per_layer_decoder': [896, 448, 224]}",56.0,"[896, 448, 224]","[56, 112, 224, 448, 896]",[-0.02026820680692243],[-0.01756606414348516],0.546760088916588,COMPLETE
38,-0.9015160231138366,-0.8182496515608448,2024-12-23 11:16:17.970036,2024-12-23 11:16:27.755055,0 days 00:00:09.785019,0.022802535539324473,32.0,0.4,56,100.0,5.868211845102942e-06,2152.0,0.0009999223902870309,3,5,sgd,"{'neurons_per_layer_encoder': [56, 112, 224, 448, 896], 'neurons_per_layer_decoder': [896, 448, 224]}",56.0,"[896, 448, 224]","[56, 112, 224, 448, 896]",[-0.9015160231138366],[-0.8182496515608448],0.36203322749173056,COMPLETE
39,0.1592186546977542,-0.21561984872083362,2024-12-23 11:16:27.772519,2024-12-23 11:16:59.303149,0 days 00:00:31.530630,0.05562369737269762,80.0,0.1,120,100.0,1.0555219367039713e-06,4760.0,0.005848115943979373,2,5,adadelta,"{'neurons_per_layer_encoder': [120, 240, 480, 960, 1920], 'neurons_per_layer_decoder': [1920, 960]}",120.0,"[1920, 960]","[120, 240, 480, 960, 1920]",[0.1592186546977542],[-0.21561984872083362],-0.15613627204317546,COMPLETE
40,-0.08935281934786499,-0.06667496204997048,2024-12-23 11:16:29.424889,2024-12-23 11:16:53.535841,0 days 00:00:24.110952,0.019220255962954087,128.0,0.1,120,100.0,1.633153848745007e-06,5016.0,0.005125647101249562,2,5,adadelta,"{'neurons_per_layer_encoder': [120, 240, 480, 960, 1920], 'neurons_per_layer_decoder': [1920, 960]}",120.0,"[1920, 960]","[120, 240, 480, 960, 1920]",[-0.08935281934786499],[-0.06667496204997048],0.012962568615674698,COMPLETE
41,-1.1056408053570603,-0.17106189381869275,2024-12-23 11:16:33.708166,2024-12-23 11:16:43.930300,0 days 00:00:10.222134,0.054896614820312176,64.0,0.1,8,100.0,1.6175013402773357e-06,216.0,0.0019343102302077852,2,5,adadelta,"{'neurons_per_layer_encoder': [8, 16, 32, 64, 128], 'neurons_per_layer_decoder': [128, 64]}",8.0,"[128, 64]","[8, 16, 32, 64, 128]",[-1.1056408053570603],[-0.17106189381869275],0.12923262432126825,COMPLETE
42,-1.5022616798188997,-0.16763640244367983,2024-12-23 11:16:34.838289,2024-12-23 11:16:41.416528,0 days 00:00:06.578239,0.012316623390175554,48.0,0.2,120,100.0,1.0682039834890838e-06,328.0,0.002127301525878443,1,2,adadelta,"{'neurons_per_layer_encoder': [120, 240], 'neurons_per_layer_decoder': [240]}",120.0,[240],"[120, 240]",[-1.5022616798188997],[-0.16763640244367983],0.17110584622700922,COMPLETE
43,-0.3819590112973228,0.3217823488471522,2024-12-23 11:16:35.727579,2024-12-23 11:16:49.020011,0 days 00:00:13.292432,0.012919220445710141,40.0,0.2,120,100.0,1.0751914235181826e-06,344.0,0.0024597152726784205,1,2,adadelta,"{'neurons_per_layer_encoder': [120, 240], 'neurons_per_layer_decoder': [240]}",120.0,[240],"[120, 240]",[-0.3819590112973228],[0.3217823488471522],0.033991213995572096,COMPLETE
44,-0.4729075170209749,0.02795193432667742,2024-12-23 11:16:41.425082,2024-12-23 11:16:51.283234,0 days 00:00:09.858152,0.06230208676697891,128.0,0.2,120,100.0,1.8737155691888733e-06,224.0,0.005520059117730692,2,1,adadelta,"{'neurons_per_layer_encoder': [120], 'neurons_per_layer_decoder': [120, 60]}",120.0,"[120, 60]",[120],[-0.4729075170209749],[0.02795193432667742],-0.013888502786192473,COMPLETE
45,-0.7217794146913452,-0.4986181689407865,2024-12-23 11:16:43.938428,2024-12-23 11:16:49.407267,0 days 00:00:05.468839,0.03285298370822985,40.0,0.2,176,100.0,4.512825005141665e-06,264.0,0.0059283202532652785,1,1,adadelta,"{'neurons_per_layer_encoder': [176], 'neurons_per_layer_decoder': [176]}",176.0,[176],[176],[-0.7217794146913452],[-0.4986181689407865],0.14765589654812175,COMPLETE
46,-1.0482007317816562,-0.11718670410798526,2024-12-23 11:16:47.164319,2024-12-23 11:16:51.119939,0 days 00:00:03.955620,0.07013916694139746,120.0,0.2,176,100.0,6.971180478620157e-05,248.0,1.0894624602743529e-05,1,1,adadelta,"{'neurons_per_layer_encoder': [176], 'neurons_per_layer_decoder': [176]}",176.0,[176],[176],[-1.0482007317816562],[-0.11718670410798526],0.35810009742126014,COMPLETE
47,0.05163332162842671,-0.03501552236775818,2024-12-23 11:16:49.028937,2024-12-23 11:16:56.258125,0 days 00:00:07.229188,0.05125259734516239,120.0,0.1,88,100.0,3.7772059785973246e-06,96.0,0.006133708044940158,1,1,adadelta,"{'neurons_per_layer_encoder': [88], 'neurons_per_layer_decoder': [88]}",88.0,[88],[88],[0.05163332162842671],[-0.03501552236775818],0.007169662822149565,COMPLETE
48,-0.282769067709179,-0.07210877692761763,2024-12-23 11:16:49.415047,2024-12-23 11:17:00.463767,0 days 00:00:11.048720,0.024830796802885004,120.0,0.1,208,100.0,1.0810437271264155e-05,1384.0,0.006525866631834774,1,3,adadelta,"{'neurons_per_layer_encoder': [208, 416, 832], 'neurons_per_layer_decoder': [832]}",208.0,[832],"[208, 416, 832]",[-0.282769067709179],[-0.07210877692761763],0.16408955384014856,COMPLETE
49,-0.11621346508192953,-0.44845218852939595,2024-12-23 11:16:51.127937,2024-12-23 11:16:57.259783,0 days 00:00:06.131846,0.025749155461225224,128.0,0.1,208,100.0,4.174706910261308e-05,1416.0,8.032535508392487e-05,2,3,sgd,"{'neurons_per_layer_encoder': [208, 416, 832], 'neurons_per_layer_decoder': [832, 416]}",208.0,"[832, 416]","[208, 416, 832]",[-0.11621346508192953],[-0.44845218852939595],0.6784006682812777,COMPLETE
50,-0.16527628577871578,-0.3530871231664716,2024-12-23 11:16:51.322078,2024-12-23 11:16:59.789364,0 days 00:00:08.467286,0.03084738329880337,80.0,0.1,208,100.0,3.4733829321448316e-06,1448.0,2.2441848934402126e-05,1,3,sgd,"{'neurons_per_layer_encoder': [208, 416, 832], 'neurons_per_layer_decoder': [832]}",208.0,[832],"[208, 416, 832]",[-0.16527628577871578],[-0.3530871231664716],0.10782337263509471,COMPLETE
51,-0.7045561810935081,-0.05638201730693848,2024-12-23 11:16:53.545757,2024-12-23 11:16:59.625844,0 days 00:00:06.080087,0.026134536863010403,80.0,0.1,208,100.0,4.7749055862269325e-05,1464.0,1.9592997183560122e-05,1,3,sgd,"{'neurons_per_layer_encoder': [208, 416, 832], 'neurons_per_layer_decoder': [832]}",208.0,[832],"[208, 416, 832]",[-0.7045561810935081],[-0.05638201730693848],0.6956831728758505,COMPLETE
