number,values_0,values_1,datetime_start,datetime_complete,duration,params_alpha,params_batch_size,params_drop_out_rate,params_encoder_neurons_layer_1,params_epochs,params_lambda,params_latent_dim,params_learning_rate,params_num_layers_decoder,params_num_layers_encoder,params_optimizer,user_attrs_encoder_decoder_config,user_attrs_first_layer_neurons,user_attrs_neurons_per_layer_decoder,user_attrs_neurons_per_layer_encoder,user_attrs_r2_feature_1,user_attrs_r2_feature_2,user_attrs_relative_deterioration,state
102,-1.4133193672739979,0.005585896342003904,2024-12-23 11:18:08.388381,2024-12-23 11:18:11.029065,0 days 00:00:02.640684,0.018258958690431593,48.0,0.30000000000000004,160,100.0,8.116733796859546e-05,696.0,3.5044541633152634e-05,4,3,sgd,"{'neurons_per_layer_encoder': [160, 320, 640], 'neurons_per_layer_decoder': [640, 320, 160, 80]}",160.0,"[640, 320, 160, 80]","[160, 320, 640]",[-1.4133193672739979],[0.005585896342003904],0.702936176975136,COMPLETE
103,-0.12768902451258413,0.03339663344832067,2024-12-23 11:18:08.778609,2024-12-23 11:18:12.393939,0 days 00:00:03.615330,0.01614033855290884,40.0,0.30000000000000004,136,100.0,1.633941172536374e-06,616.0,0.0003079976128786774,4,3,sgd,"{'neurons_per_layer_encoder': [136, 272, 544], 'neurons_per_layer_decoder': [544, 272, 136, 68]}",136.0,"[544, 272, 136, 68]","[136, 272, 544]",[-0.12768902451258413],[0.03339663344832067],0.3568878167610132,COMPLETE
104,-0.06687957095560448,0.10155629428282942,2024-12-23 11:18:09.245420,2024-12-23 11:18:18.435215,0 days 00:00:09.189795,0.01125618362803948,40.0,0.30000000000000004,160,100.0,1.6674583295987922e-06,696.0,3.312166539179958e-05,4,3,adam,"{'neurons_per_layer_encoder': [160, 320, 640], 'neurons_per_layer_decoder': [640, 320, 160, 80]}",160.0,"[640, 320, 160, 80]","[160, 320, 640]",[-0.06687957095560448],[0.10155629428282942],0.33803717395114047,COMPLETE
105,0.6858674387820725,0.07584509886643143,2024-12-23 11:18:10.454777,2024-12-23 11:18:20.538294,0 days 00:00:10.083517,0.022615566082524262,40.0,0.4,160,100.0,0.0003091741866249802,712.0,0.00030311527934569405,4,3,adam,"{'neurons_per_layer_encoder': [160, 320, 640], 'neurons_per_layer_decoder': [640, 320, 160, 80]}",160.0,"[640, 320, 160, 80]","[160, 320, 640]",[0.6858674387820725],[0.07584509886643143],0.9573357346005067,COMPLETE
106,0.44081261269246075,0.2777777492930249,2024-12-23 11:18:10.622107,2024-12-23 11:18:17.539986,0 days 00:00:06.917879,0.010905599061971178,40.0,0.4,128,100.0,8.22915113316078e-05,600.0,0.0002861234762713401,4,2,adam,"{'neurons_per_layer_encoder': [128, 256], 'neurons_per_layer_decoder': [256, 128, 64, 32]}",128.0,"[256, 128, 64, 32]","[128, 256]",[0.44081261269246075],[0.2777777492930249],0.7464421951045159,COMPLETE
107,0.5463153817729143,0.19060494547591578,2024-12-23 11:18:11.038110,2024-12-23 11:18:18.152555,0 days 00:00:07.114445,0.010825252081792299,40.0,0.4,128,100.0,0.0003469823566507504,616.0,0.00109635165793889,4,2,adam,"{'neurons_per_layer_encoder': [128, 256], 'neurons_per_layer_decoder': [256, 128, 64, 32]}",128.0,"[256, 128, 64, 32]","[128, 256]",[0.5463153817729143],[0.19060494547591578],0.8772392820357201,COMPLETE
108,0.292425783129899,0.0636586564376469,2024-12-23 11:18:12.401907,2024-12-23 11:18:18.995626,0 days 00:00:06.593719,0.023241405057294932,40.0,0.4,48,100.0,0.0002248310133544788,152.0,0.0010010172419700138,4,2,adam,"{'neurons_per_layer_encoder': [48, 96], 'neurons_per_layer_decoder': [96, 48, 24, 12]}",48.0,"[96, 48, 24, 12]","[48, 96]",[0.292425783129899],[0.0636586564376469],0.6221916839509063,COMPLETE
109,0.654832473463998,0.143899585991065,2024-12-23 11:18:13.368703,2024-12-23 11:18:20.960081,0 days 00:00:07.591378,0.010947466218780432,40.0,0.4,184,100.0,1.8134044718430992e-06,888.0,0.001324430382543968,4,2,adam,"{'neurons_per_layer_encoder': [184, 368], 'neurons_per_layer_decoder': [368, 184, 92, 46]}",184.0,"[368, 184, 92, 46]","[184, 368]",[0.654832473463998],[0.143899585991065],-0.150401073030203,COMPLETE
110,0.6454898120374712,0.2340416770858882,2024-12-23 11:18:17.547748,2024-12-23 11:18:24.649723,0 days 00:00:07.101975,0.01102876003352617,40.0,0.4,128,100.0,2.5041327941005822e-05,360.0,0.0012690741214988245,4,2,adam,"{'neurons_per_layer_encoder': [128, 256], 'neurons_per_layer_decoder': [256, 128, 64, 32]}",128.0,"[256, 128, 64, 32]","[128, 256]",[0.6454898120374712],[0.2340416770858882],0.4260544339014671,COMPLETE
111,0.3426513786679046,0.2791273523786295,2024-12-23 11:18:18.160099,2024-12-23 11:18:27.023657,0 days 00:00:08.863558,0.0667805379311959,40.0,0.4,216,100.0,0.00032233426039647947,1000.0,8.679205712625061e-05,4,2,adam,"{'neurons_per_layer_encoder': [216, 432], 'neurons_per_layer_decoder': [432, 216, 108, 54]}",216.0,"[432, 216, 108, 54]","[216, 432]",[0.3426513786679046],[0.2791273523786295],0.9411136652790922,COMPLETE
112,0.355233496014427,0.10005697582559425,2024-12-23 11:18:18.444761,2024-12-23 11:18:25.218029,0 days 00:00:06.773268,0.014329541370456486,40.0,0.4,128,100.0,5.387763552673989e-05,568.0,9.081622853113787e-05,4,2,adam,"{'neurons_per_layer_encoder': [128, 256], 'neurons_per_layer_decoder': [256, 128, 64, 32]}",128.0,"[256, 128, 64, 32]","[128, 256]",[0.355233496014427],[0.10005697582559425],0.6580771329024996,COMPLETE
113,0.4028116652236132,0.37170051865491927,2024-12-23 11:18:19.003114,2024-12-23 11:18:26.263299,0 days 00:00:07.260185,0.11518922516789827,32.0,0.4,216,100.0,3.4169426987378524e-05,936.0,8.583198140639849e-05,2,2,adam,"{'neurons_per_layer_encoder': [216, 432], 'neurons_per_layer_decoder': [432, 216]}",216.0,"[432, 216]","[216, 432]",[0.4028116652236132],[0.37170051865491927],0.6656041731859954,COMPLETE
114,0.5883759861557831,0.14864557407082746,2024-12-23 11:18:20.546892,2024-12-23 11:18:27.767704,0 days 00:00:07.220812,0.014328884201603078,32.0,0.4,200,100.0,1.93686991159766e-06,872.0,8.760181877464584e-05,2,2,adam,"{'neurons_per_layer_encoder': [200, 400], 'neurons_per_layer_decoder': [400, 200]}",200.0,"[400, 200]","[200, 400]",[0.5883759861557831],[0.14864557407082746],0.2963554464784784,COMPLETE
115,0.4306373342547597,0.10052986468402125,2024-12-23 11:18:20.970549,2024-12-23 11:18:28.560272,0 days 00:00:07.589723,0.014254763850117912,32.0,0.4,200,100.0,2.6529622014829136e-05,856.0,8.634437844680579e-05,3,2,adam,"{'neurons_per_layer_encoder': [200, 400], 'neurons_per_layer_decoder': [400, 200, 100]}",200.0,"[400, 200, 100]","[200, 400]",[0.4306373342547597],[0.10052986468402125],0.5727531261689843,COMPLETE
116,0.5025502357833767,0.30919529539602897,2024-12-23 11:18:24.658754,2024-12-23 11:18:32.192008,0 days 00:00:07.533254,0.01267149784220041,32.0,0.4,216,100.0,2.7719823651538873e-05,968.0,0.0016083947750403036,3,2,adam,"{'neurons_per_layer_encoder': [216, 432], 'neurons_per_layer_decoder': [432, 216, 108]}",216.0,"[432, 216, 108]","[216, 432]",[0.5025502357833767],[0.30919529539602897],0.4108768345682146,COMPLETE
117,0.5156445887267809,0.376982745562886,2024-12-23 11:18:25.225468,2024-12-23 11:18:32.870752,0 days 00:00:07.645284,0.01187769955112299,32.0,0.4,200,100.0,2.4915606541424563e-05,824.0,0.0001359330063279046,3,2,adam,"{'neurons_per_layer_encoder': [200, 400], 'neurons_per_layer_decoder': [400, 200, 100]}",200.0,"[400, 200, 100]","[200, 400]",[0.5156445887267809],[0.376982745562886],0.6182296773836182,COMPLETE
118,0.4385499864631568,0.07043011300872704,2024-12-23 11:18:26.272025,2024-12-23 11:18:31.946935,0 days 00:00:05.674910,0.012586853485871416,32.0,0.4,96,100.0,2.617906144674032e-06,344.0,0.00014602784043607706,3,2,adam,"{'neurons_per_layer_encoder': [96, 192], 'neurons_per_layer_decoder': [192, 96, 48]}",96.0,"[192, 96, 48]","[96, 192]",[0.4385499864631568],[0.07043011300872704],0.19155874848220958,COMPLETE
119,0.6377229827425113,0.2689022130150358,2024-12-23 11:18:27.032810,2024-12-23 11:18:32.649400,0 days 00:00:05.616590,0.01218928215055762,32.0,0.4,96,100.0,1.882401886151069e-06,360.0,0.0016155677048250632,3,2,adam,"{'neurons_per_layer_encoder': [96, 192], 'neurons_per_layer_decoder': [192, 96, 48]}",96.0,"[192, 96, 48]","[96, 192]",[0.6377229827425113],[0.2689022130150358],-0.3940402530993493,COMPLETE
120,0.6776537335167101,0.32099282011275243,2024-12-23 11:18:27.775557,2024-12-23 11:18:33.319356,0 days 00:00:05.543799,0.011954842923715526,32.0,0.2,96,100.0,2.652720617892545e-06,360.0,0.001531905813249859,3,2,adam,"{'neurons_per_layer_encoder': [96, 192], 'neurons_per_layer_decoder': [192, 96, 48]}",96.0,"[192, 96, 48]","[96, 192]",[0.6776537335167101],[0.32099282011275243],-0.7154589873390157,COMPLETE
121,0.09758592697182811,-0.020829653492584477,2024-12-23 11:18:28.568021,2024-12-23 11:18:34.738319,0 days 00:00:06.170298,0.012757798509345093,56.0,0.2,248,100.0,2.557744145124591e-06,552.0,0.0015240834863613198,3,2,adam,"{'neurons_per_layer_encoder': [248, 496], 'neurons_per_layer_decoder': [496, 248, 124]}",248.0,"[496, 248, 124]","[248, 496]",[0.09758592697182811],[-0.020829653492584477],-1.8582361304281814,COMPLETE
122,0.5919517050183035,0.2029514183250244,2024-12-23 11:18:31.956352,2024-12-23 11:18:37.284465,0 days 00:00:05.328113,0.012095656069546231,32.0,0.2,120,100.0,2.054611457252296e-06,504.0,0.0018231391114342697,3,2,adam,"{'neurons_per_layer_encoder': [120, 240], 'neurons_per_layer_decoder': [240, 120, 60]}",120.0,"[240, 120, 60]","[120, 240]",[0.5919517050183035],[0.2029514183250244],-1.5370896396191747,COMPLETE
123,0.5120405306124214,0.30148363046756066,2024-12-23 11:18:32.202204,2024-12-23 11:18:37.841009,0 days 00:00:05.638805,0.011934065759379681,40.0,0.2,120,100.0,1.865367915785448e-06,504.0,0.00016671086285467476,3,2,adam,"{'neurons_per_layer_encoder': [120, 240], 'neurons_per_layer_decoder': [240, 120, 60]}",120.0,"[240, 120, 60]","[120, 240]",[0.5120405306124214],[0.30148363046756066],0.08639075198098214,COMPLETE
124,0.49749331158739696,0.19897319351982545,2024-12-23 11:18:32.657782,2024-12-23 11:18:38.132709,0 days 00:00:05.474927,0.012137718148542467,40.0,0.2,144,100.0,1.926801284835972e-06,376.0,6.645897464406961e-05,3,2,adam,"{'neurons_per_layer_encoder': [144, 288], 'neurons_per_layer_decoder': [288, 144, 72]}",144.0,"[288, 144, 72]","[144, 288]",[0.49749331158739696],[0.19897319351982545],0.23038929651124498,COMPLETE
125,-0.9202498005558439,-0.09513481622859188,2024-12-23 11:18:32.878485,2024-12-23 11:18:35.318728,0 days 00:00:02.440243,0.011782663273333523,96.0,0.2,120,100.0,3.0143716484110113e-06,504.0,6.46027980068559e-05,2,2,adam,"{'neurons_per_layer_encoder': [120, 240], 'neurons_per_layer_decoder': [240, 120]}",120.0,"[240, 120]","[120, 240]",[-0.9202498005558439],[-0.09513481622859188],-0.18183830823171712,COMPLETE
126,0.677915224435548,0.4228183747868062,2024-12-23 11:18:33.326675,2024-12-23 11:18:37.487452,0 days 00:00:04.160777,0.011864133136921046,32.0,0.2,80,100.0,2.9664234791679944e-06,120.0,0.001954051422755959,3,1,adam,"{'neurons_per_layer_encoder': [80], 'neurons_per_layer_decoder': [80, 40, 20]}",80.0,"[80, 40, 20]",[80],[0.677915224435548],[0.4228183747868062],-0.5297978023539519,COMPLETE
127,0.680668897968396,0.42519531626059337,2024-12-23 11:18:34.746016,2024-12-23 11:18:38.650479,0 days 00:00:03.904463,0.01200941953995174,32.0,0.2,72,100.0,2.9561506057149704e-06,112.0,0.002204745424664391,3,1,adam,"{'neurons_per_layer_encoder': [72], 'neurons_per_layer_decoder': [72, 36, 18]}",72.0,"[72, 36, 18]",[72],[0.680668897968396],[0.42519531626059337],-0.7411479572001789,COMPLETE
128,0.7273977334926499,0.34231588833797555,2024-12-23 11:18:35.325999,2024-12-23 11:18:39.052493,0 days 00:00:03.726494,0.01121841066902087,32.0,0.2,72,100.0,2.1471890958005506e-06,112.0,0.0012720143649125185,3,1,adam,"{'neurons_per_layer_encoder': [72], 'neurons_per_layer_decoder': [72, 36, 18]}",72.0,"[72, 36, 18]",[72],[0.7273977334926499],[0.34231588833797555],-0.4151693930208628,COMPLETE
129,0.5328828041178691,0.20003427128373452,2024-12-23 11:18:37.292670,2024-12-23 11:18:41.746028,0 days 00:00:04.453358,0.010816588909140626,32.0,0.2,80,100.0,2.2680340832960603e-06,376.0,0.0012925962590537967,3,2,adam,"{'neurons_per_layer_encoder': [80, 160], 'neurons_per_layer_decoder': [160, 80, 40]}",80.0,"[160, 80, 40]","[80, 160]",[0.5328828041178691],[0.20003427128373452],-1.0545662763296721,COMPLETE
130,-1.869350294660983,-0.19750168300251447,2024-12-23 11:18:37.495604,2024-12-23 11:18:38.812010,0 days 00:00:01.316406,0.011118053128458861,32.0,0.2,72,100.0,0.00016099923264075456,112.0,0.0012597089686672252,3,1,sgd,"{'neurons_per_layer_encoder': [72], 'neurons_per_layer_decoder': [72, 36, 18]}",72.0,"[72, 36, 18]",[72],[-1.869350294660983],[-0.19750168300251447],0.29010212349052816,COMPLETE
131,-1.0407490332004605,-0.05817834677573286,2024-12-23 11:18:37.849060,2024-12-23 11:18:39.168502,0 days 00:00:01.319442,0.04621839470357584,128.0,0.2,72,100.0,8.315747747210766e-06,112.0,0.0032453146728593446,3,1,sgd,"{'neurons_per_layer_encoder': [72], 'neurons_per_layer_decoder': [72, 36, 18]}",72.0,"[72, 36, 18]",[72],[-1.0407490332004605],[-0.05817834677573286],0.3203264555824607,COMPLETE
132,0.2574043182866246,-0.0015113845197318732,2024-12-23 11:18:38.139951,2024-12-23 11:18:41.180093,0 days 00:00:03.040142,0.04813774729707291,32.0,0.2,72,100.0,0.00015911957272093905,112.0,0.001925218958898928,3,1,sgd,"{'neurons_per_layer_encoder': [72], 'neurons_per_layer_decoder': [72, 36, 18]}",72.0,"[72, 36, 18]",[72],[0.2574043182866246],[-0.0015113845197318732],0.5518197774637762,COMPLETE
133,-0.16809817166782537,-0.2960897995901106,2024-12-23 11:18:38.657705,2024-12-23 11:18:40.587530,0 days 00:00:01.929825,0.03446965361009449,32.0,0.2,72,100.0,0.0008072566030639084,112.0,0.0025124340626867287,3,1,sgd,"{'neurons_per_layer_encoder': [72], 'neurons_per_layer_decoder': [72, 36, 18]}",72.0,"[72, 36, 18]",[72],[-0.16809817166782537],[-0.2960897995901106],0.737791478505644,COMPLETE
134,-0.7518108507223089,-0.1018561466078538,2024-12-23 11:18:38.818771,2024-12-23 11:18:40.968595,0 days 00:00:02.149824,0.049987851559990346,32.0,0.2,80,100.0,4.979300482101146e-06,120.0,0.0025450994058230153,3,1,adadelta,"{'neurons_per_layer_encoder': [80], 'neurons_per_layer_decoder': [80, 40, 20]}",80.0,"[80, 40, 20]",[80],[-0.7518108507223089],[-0.1018561466078538],0.27755593783153487,COMPLETE
135,-0.6835402980445555,-0.08705759161483106,2024-12-23 11:18:39.059682,2024-12-23 11:18:42.296362,0 days 00:00:03.236680,0.010683772366408741,32.0,0.2,64,100.0,2.2707878637995543e-06,120.0,0.0007878559408711375,3,1,adadelta,"{'neurons_per_layer_encoder': [64], 'neurons_per_layer_decoder': [64, 32, 16]}",64.0,"[64, 32, 16]",[64],[-0.6835402980445555],[-0.08705759161483106],0.045653018571198176,COMPLETE
136,-0.6334198397172066,-0.08175271523889838,2024-12-23 11:18:39.176038,2024-12-23 11:18:42.063363,0 days 00:00:02.887325,0.010050570483303425,32.0,0.2,64,100.0,0.00043272645721360425,120.0,0.0011991479218170535,3,1,adadelta,"{'neurons_per_layer_encoder': [64], 'neurons_per_layer_decoder': [64, 32, 16]}",64.0,"[64, 32, 16]",[64],[-0.6334198397172066],[-0.08175271523889838],0.5591169711872809,COMPLETE
137,-1.1821469649868774,-0.1364441823534499,2024-12-23 11:18:40.594164,2024-12-23 11:18:42.721096,0 days 00:00:02.126932,0.010515876220136961,32.0,0.2,64,100.0,1.1739428549983297e-06,120.0,0.0012817887035900487,3,1,adadelta,"{'neurons_per_layer_encoder': [64], 'neurons_per_layer_decoder': [64, 32, 16]}",64.0,"[64, 32, 16]",[64],[-1.1821469649868774],[-0.1364441823534499],0.19981108046509574,COMPLETE
138,0.004636526258115059,-0.028911196130333883,2024-12-23 11:18:40.976649,2024-12-23 11:18:44.308267,0 days 00:00:03.331618,0.010075701419680535,112.0,0.2,56,100.0,0.0004452713224818423,96.0,0.0008374593010904359,3,1,adadelta,"{'neurons_per_layer_encoder': [56], 'neurons_per_layer_decoder': [56, 28, 14]}",56.0,"[56, 28, 14]",[56],[0.004636526258115059],[-0.028911196130333883],0.6526887099065647,COMPLETE
139,-1.5718305923909344,-0.18480640481617616,2024-12-23 11:18:41.188404,2024-12-23 11:18:43.241483,0 days 00:00:02.053079,0.0583708869960673,112.0,0.2,56,100.0,0.0004553894670655464,96.0,0.0008222868916017488,3,1,adadelta,"{'neurons_per_layer_encoder': [56], 'neurons_per_layer_decoder': [56, 28, 14]}",56.0,"[56, 28, 14]",[56],[-1.5718305923909344],[-0.18480640481617616],0.5118010619181321,COMPLETE
140,-0.9624851034864519,0.007875137549117284,2024-12-23 11:18:41.754998,2024-12-23 11:18:43.708763,0 days 00:00:01.953765,0.010125965182910115,112.0,0.2,64,100.0,3.02821998235922e-06,104.0,0.0008248220072708167,3,1,adadelta,"{'neurons_per_layer_encoder': [64], 'neurons_per_layer_decoder': [64, 32, 16]}",64.0,"[64, 32, 16]",[64],[-0.9624851034864519],[0.007875137549117284],0.2766914232308263,COMPLETE
141,0.43730577685762617,0.10702563356292694,2024-12-23 11:18:42.071057,2024-12-23 11:18:45.365810,0 days 00:00:03.294753,0.17963756349366186,104.0,0.2,56,100.0,1.1748381744343828e-06,96.0,0.0008304463644540207,3,1,adam,"{'neurons_per_layer_encoder': [56], 'neurons_per_layer_decoder': [56, 28, 14]}",56.0,"[56, 28, 14]",[56],[0.43730577685762617],[0.10702563356292694],-0.42560175996237704,COMPLETE
142,0.371853889400816,0.17696177230240806,2024-12-23 11:18:42.303702,2024-12-23 11:18:45.601060,0 days 00:00:03.297358,0.12786679782269045,96.0,0.1,56,100.0,3.038405976368607e-06,96.0,0.0010043396134455569,3,1,adam,"{'neurons_per_layer_encoder': [56], 'neurons_per_layer_decoder': [56, 28, 14]}",56.0,"[56, 28, 14]",[56],[0.371853889400816],[0.17696177230240806],-1.572168059368972,COMPLETE
143,0.31532446743091014,0.12919537230212053,2024-12-23 11:18:42.728008,2024-12-23 11:18:46.091567,0 days 00:00:03.363559,0.021285263519122962,104.0,0.1,56,100.0,3.017476342121468e-06,96.0,0.001036258054836561,3,1,adam,"{'neurons_per_layer_encoder': [56], 'neurons_per_layer_decoder': [56, 28, 14]}",56.0,"[56, 28, 14]",[56],[0.31532446743091014],[0.12919537230212053],-1.495576139492148,COMPLETE
144,0.49999683071709344,0.40705908032590543,2024-12-23 11:18:43.248575,2024-12-23 11:18:46.715529,0 days 00:00:03.466954,0.011216644282480202,32.0,0.1,48,100.0,2.6785927524907955e-06,104.0,0.0009857061282255446,3,1,adam,"{'neurons_per_layer_encoder': [48], 'neurons_per_layer_decoder': [48, 24, 12]}",48.0,"[48, 24, 12]",[48],[0.49999683071709344],[0.40705908032590543],-0.9358813428876889,COMPLETE
145,0.12195811083390662,0.01387603690304029,2024-12-23 11:18:43.716146,2024-12-23 11:18:47.498678,0 days 00:00:03.782532,0.028842576690014773,120.0,0.1,88,100.0,1.4860519721950627e-06,160.0,0.0009898812307183155,3,1,adam,"{'neurons_per_layer_encoder': [88], 'neurons_per_layer_decoder': [88, 44, 22]}",88.0,"[88, 44, 22]",[88],[0.12195811083390662],[0.01387603690304029],-1.5189903471626012,COMPLETE
146,0.37384794289985734,0.05664406264918731,2024-12-23 11:18:44.316804,2024-12-23 11:18:54.841916,0 days 00:00:10.525112,0.07404737116411651,104.0,0.1,48,100.0,1.4764042092801965e-06,1304.0,0.0017087301923879384,3,5,adam,"{'neurons_per_layer_encoder': [48, 96, 192, 384, 768], 'neurons_per_layer_decoder': [768, 384, 192]}",48.0,"[768, 384, 192]","[48, 96, 192, 384, 768]",[0.37384794289985734],[0.05664406264918731],-1.6138579881756172,COMPLETE
147,0.31832013690639827,-0.26226949066626903,2024-12-23 11:18:45.372518,2024-12-23 11:18:57.409625,0 days 00:00:12.037107,0.01310542151990449,96.0,0.1,80,100.0,1.483613822523526e-06,1320.0,0.007546315679571605,3,5,adam,"{'neurons_per_layer_encoder': [80, 160, 320, 640, 1280], 'neurons_per_layer_decoder': [1280, 640, 320]}",80.0,"[1280, 640, 320]","[80, 160, 320, 640, 1280]",[0.31832013690639827],[-0.26226949066626903],-0.6184037379655762,COMPLETE
148,0.4793758128490323,0.22003001156281987,2024-12-23 11:18:45.609389,2024-12-23 11:18:53.980865,0 days 00:00:08.371476,0.15698758482346584,120.0,0.1,88,100.0,1.4688581993540106e-06,1432.0,0.0016797142991101185,3,5,adam,"{'neurons_per_layer_encoder': [88, 176, 352, 704, 1408], 'neurons_per_layer_decoder': [1408, 704, 352]}",88.0,"[1408, 704, 352]","[88, 176, 352, 704, 1408]",[0.4793758128490323],[0.22003001156281987],-0.17790476805736877,COMPLETE
149,-0.06968723287511036,-0.5408493520977908,2024-12-23 11:18:46.100191,2024-12-23 11:18:54.163074,0 days 00:00:08.062883,0.01314367686465123,120.0,0.1,88,100.0,1.4692494715528972e-06,1432.0,0.002160271154193878,3,5,adam,"{'neurons_per_layer_encoder': [88, 176, 352, 704, 1408], 'neurons_per_layer_decoder': [1408, 704, 352]}",88.0,"[1408, 704, 352]","[88, 176, 352, 704, 1408]",[-0.06968723287511036],[-0.5408493520977908],-1.1216083480480987,COMPLETE
150,0.36070094076674286,0.10583582460447705,2024-12-23 11:18:46.723422,2024-12-23 11:18:54.147281,0 days 00:00:07.423859,0.15018088592397036,120.0,0.1,88,100.0,1.5048512519537941e-06,144.0,0.0018116471683852142,3,1,adam,"{'neurons_per_layer_encoder': [88], 'neurons_per_layer_decoder': [88, 44, 22]}",88.0,"[88, 44, 22]",[88],[0.36070094076674286],[0.10583582460447705],-1.4365494910302676,COMPLETE
151,0.6134360260706675,0.1335402006260924,2024-12-23 11:18:47.509516,2024-12-23 11:18:55.263670,0 days 00:00:07.754154,0.0751777852475927,32.0,0.2,80,100.0,5.938598837026863e-05,200.0,0.0014478846392969116,3,1,adam,"{'neurons_per_layer_encoder': [80], 'neurons_per_layer_decoder': [80, 40, 20]}",80.0,"[80, 40, 20]",[80],[0.6134360260706675],[0.1335402006260924],-0.2878648792305889,COMPLETE
152,0.6037336685199033,0.4771944562919306,2024-12-23 11:18:53.991572,2024-12-23 11:18:58.742791,0 days 00:00:04.751219,0.07684264740854284,32.0,0.2,80,100.0,3.8784913691579e-06,136.0,0.0021270950650907694,3,1,adam,"{'neurons_per_layer_encoder': [80], 'neurons_per_layer_decoder': [80, 40, 20]}",80.0,"[80, 40, 20]",[80],[0.6037336685199033],[0.4771944562919306],-0.49271309594304546,COMPLETE
153,0.6675687562042969,0.2041731579505216,2024-12-23 11:18:54.158164,2024-12-23 11:18:58.421123,0 days 00:00:04.262959,0.011295519916437279,32.0,0.2,48,100.0,3.7284763070617827e-06,72.0,0.0021667730460591694,3,1,adam,"{'neurons_per_layer_encoder': [48], 'neurons_per_layer_decoder': [48, 24, 12]}",48.0,"[48, 24, 12]",[48],[0.6675687562042969],[0.2041731579505216],-0.6020775770536222,COMPLETE
