number,values_0,values_1,datetime_start,datetime_complete,duration,params_alpha,params_batch_size,params_drop_out_rate,params_encoder_neurons_layer_1,params_epochs,params_lambda,params_latent_dim,params_learning_rate,params_num_layers_decoder,params_num_layers_encoder,params_optimizer,user_attrs_encoder_decoder_config,user_attrs_first_layer_neurons,user_attrs_neurons_per_layer_decoder,user_attrs_neurons_per_layer_encoder,user_attrs_r2_feature_1,user_attrs_r2_feature_2,user_attrs_relative_deterioration,state
520,0.27199784514312664,-0.3773033528156795,2024-12-23 11:35:54.348423,2024-12-23 11:36:03.423252,0 days 00:00:09.074829,0.02311288785964631,56.0,0.1,220,100.0,0.0001468128603345374,904.0,0.00022945673450790023,4,3,adam,"{'neurons_per_layer_encoder': [220, 440, 880], 'neurons_per_layer_decoder': [880, 440, 220, 110]}",220.0,"[880, 440, 220, 110]","[220, 440, 880]",[0.27199784514312664],[-0.3773033528156795],0.8841091915454203,COMPLETE
521,-1.1027054955759743,-0.24385386184682978,2024-12-23 11:35:55.024281,2024-12-23 11:35:58.045861,0 days 00:00:03.021580,0.033734397426433006,40.0,0.1,220,100.0,0.0001406242515503229,904.0,0.00018320417509211755,4,3,sgd,"{'neurons_per_layer_encoder': [220, 440, 880], 'neurons_per_layer_decoder': [880, 440, 220, 110]}",220.0,"[880, 440, 220, 110]","[220, 440, 880]",[-1.1027054955759743],[-0.24385386184682978],0.8519138115193136,COMPLETE
522,-1.2843981743170403,0.032761345275096776,2024-12-23 11:35:55.051036,2024-12-23 11:35:57.860700,0 days 00:00:02.809664,0.03392803833763713,112.0,0.1,220,100.0,0.00014032783683482316,904.0,0.0002572154648186816,4,3,sgd,"{'neurons_per_layer_encoder': [220, 440, 880], 'neurons_per_layer_decoder': [880, 440, 220, 110]}",220.0,"[880, 440, 220, 110]","[220, 440, 880]",[-1.2843981743170403],[0.032761345275096776],0.8724534507586266,COMPLETE
523,0.2981885272337913,-0.21134304068594068,2024-12-23 11:35:55.114361,2024-12-23 11:36:04.856295,0 days 00:00:09.741934,0.02303963119880616,56.0,0.1,232,100.0,0.0001414193359678668,952.0,0.0002611562125218928,4,3,adam,"{'neurons_per_layer_encoder': [232, 464, 928], 'neurons_per_layer_decoder': [928, 464, 232, 116]}",232.0,"[928, 464, 232, 116]","[232, 464, 928]",[0.2981885272337913],[-0.21134304068594068],0.8924268711554729,COMPLETE
524,0.3822614687887643,0.013299735956232572,2024-12-23 11:35:57.870214,2024-12-23 11:36:06.421646,0 days 00:00:08.551432,0.027832972106318327,40.0,0.1,76,100.0,0.0001385740307612495,568.0,0.00023244648344389625,4,3,adam,"{'neurons_per_layer_encoder': [76, 152, 304], 'neurons_per_layer_decoder': [304, 152, 76, 38]}",76.0,"[304, 152, 76, 38]","[76, 152, 304]",[0.3822614687887643],[0.013299735956232572],0.7876924224036397,COMPLETE
525,0.1879177713177944,-0.1031586214247251,2024-12-23 11:35:58.054885,2024-12-23 11:36:06.314729,0 days 00:00:08.259844,0.028390910924784372,64.0,0.1,196,100.0,0.00014624303833173013,824.0,0.00025750783249831266,4,3,adam,"{'neurons_per_layer_encoder': [196, 392, 784], 'neurons_per_layer_decoder': [784, 392, 196, 98]}",196.0,"[784, 392, 196, 98]","[196, 392, 784]",[0.1879177713177944],[-0.1031586214247251],0.8774173763826524,COMPLETE
526,0.20162066959914138,0.08028954063456162,2024-12-23 11:35:58.725135,2024-12-23 11:36:06.003867,0 days 00:00:07.278732,0.022898576140575486,88.0,0.1,88,100.0,0.00011280950772585361,792.0,0.0002512458550118558,4,3,adam,"{'neurons_per_layer_encoder': [88, 176, 352], 'neurons_per_layer_decoder': [352, 176, 88, 44]}",88.0,"[352, 176, 88, 44]","[88, 176, 352]",[0.20162066959914138],[0.08028954063456162],0.7490454771345161,COMPLETE
527,0.4338464405979686,-0.1486519790506069,2024-12-23 11:36:00.167207,2024-12-23 11:36:09.677519,0 days 00:00:09.510312,0.023234221089563117,48.0,0.1,196,100.0,0.00011805941669235181,824.0,0.0002837040119628462,4,3,adam,"{'neurons_per_layer_encoder': [196, 392, 784], 'neurons_per_layer_decoder': [784, 392, 196, 98]}",196.0,"[784, 392, 196, 98]","[196, 392, 784]",[0.4338464405979686],[-0.1486519790506069],0.8608800531490295,COMPLETE
528,-1.1878069045932662,0.027984488833835974,2024-12-23 11:36:03.432865,2024-12-23 11:36:07.240954,0 days 00:00:03.808089,0.022835162381908483,48.0,0.1,16,100.0,0.00011152021625959274,134.0,0.0002437564373317336,4,3,adam,"{'neurons_per_layer_encoder': [16, 32, 64], 'neurons_per_layer_decoder': [64, 32, 16, 8]}",16.0,"[64, 32, 16, 8]","[16, 32, 64]",[-1.1878069045932662],[0.027984488833835974],0.24008811305934974,COMPLETE
529,-0.29144546571627505,0.06416112588032363,2024-12-23 11:36:04.865261,2024-12-23 11:36:09.503321,0 days 00:00:04.638060,0.02255998855214828,64.0,0.30000000000000004,16,100.0,9.52942526543042e-05,134.0,0.00019333500442235912,3,3,adam,"{'neurons_per_layer_encoder': [16, 32, 64], 'neurons_per_layer_decoder': [64, 32, 16]}",16.0,"[64, 32, 16]","[16, 32, 64]",[-0.29144546571627505],[0.06416112588032363],0.34991715732002027,COMPLETE
530,0.1906807898136651,0.07204266629369571,2024-12-23 11:36:06.012154,2024-12-23 11:36:10.547267,0 days 00:00:04.535113,0.022109183706420794,64.0,0.30000000000000004,44,100.0,0.00018580349754846945,408.0,0.00019924893803368492,3,3,adam,"{'neurons_per_layer_encoder': [44, 88, 176], 'neurons_per_layer_decoder': [176, 88, 44]}",44.0,"[176, 88, 44]","[44, 88, 176]",[0.1906807898136651],[0.07204266629369571],0.7504937266041375,COMPLETE
531,0.4242343340110245,0.17510340408329728,2024-12-23 11:36:06.322174,2024-12-23 11:36:11.464543,0 days 00:00:05.142369,0.02177164174035204,48.0,0.1,76,100.0,9.1118818283099e-05,520.0,0.00019400606941216293,3,3,adam,"{'neurons_per_layer_encoder': [76, 152, 304], 'neurons_per_layer_decoder': [304, 152, 76]}",76.0,"[304, 152, 76]","[76, 152, 304]",[0.4242343340110245],[0.17510340408329728],0.7015069321151417,COMPLETE
532,0.03645840945467871,0.15143112399004266,2024-12-23 11:36:06.430467,2024-12-23 11:36:11.676693,0 days 00:00:05.246226,0.021966854939885157,48.0,0.30000000000000004,88,100.0,9.414555136759838e-05,600.0,0.008584017107707951,3,3,adam,"{'neurons_per_layer_encoder': [88, 176, 352], 'neurons_per_layer_decoder': [352, 176, 88]}",88.0,"[352, 176, 88]","[88, 176, 352]",[0.03645840945467871],[0.15143112399004266],-0.7314530056878469,COMPLETE
533,0.5264082779686411,0.12381721359433129,2024-12-23 11:36:09.510429,2024-12-23 11:36:14.398034,0 days 00:00:04.887605,0.021711739881577628,48.0,0.4,76,100.0,0.00017700360053776582,504.0,0.0002858367449940748,3,3,adam,"{'neurons_per_layer_encoder': [76, 152, 304], 'neurons_per_layer_decoder': [304, 152, 76]}",76.0,"[304, 152, 76]","[76, 152, 304]",[0.5264082779686411],[0.12381721359433129],0.8580678292275492,COMPLETE
534,-1.2697603643323894,-0.04721127266407388,2024-12-23 11:36:09.686526,2024-12-23 11:36:12.916174,0 days 00:00:03.229648,0.025110392472638066,40.0,0.4,88,100.0,0.00017820902025073406,648.0,0.0003087472091807508,3,3,adadelta,"{'neurons_per_layer_encoder': [88, 176, 352], 'neurons_per_layer_decoder': [352, 176, 88]}",88.0,"[352, 176, 88]","[88, 176, 352]",[-1.2697603643323894],[-0.04721127266407388],0.7659515217799298,COMPLETE
535,-0.7496087562409213,-0.1928378515916218,2024-12-23 11:36:10.555558,2024-12-23 11:36:14.029807,0 days 00:00:03.474249,0.025337681904894393,40.0,0.4,76,100.0,0.0001284304998451116,520.0,0.00019328663822435423,5,3,adadelta,"{'neurons_per_layer_encoder': [76, 152, 304], 'neurons_per_layer_decoder': [304, 152, 76, 38, 19]}",76.0,"[304, 152, 76, 38, 19]","[76, 152, 304]",[-0.7496087562409213],[-0.1928378515916218],0.7032534718925023,COMPLETE
536,-0.3111906124952719,-0.09357896032619006,2024-12-23 11:36:11.683458,2024-12-23 11:36:16.767682,0 days 00:00:05.084224,0.023802290584262604,40.0,0.4,88,100.0,0.00012545689175081436,776.0,0.00027742500860446564,5,3,adadelta,"{'neurons_per_layer_encoder': [88, 176, 352], 'neurons_per_layer_decoder': [352, 176, 88, 44, 22]}",88.0,"[352, 176, 88, 44, 22]","[88, 176, 352]",[-0.3111906124952719],[-0.09357896032619006],0.7711052984606644,COMPLETE
537,-0.89145321823124,-0.06914954780978899,2024-12-23 11:36:12.922522,2024-12-23 11:36:16.021883,0 days 00:00:03.099361,0.023985324344655477,40.0,0.1,28,100.0,0.00012857539545392115,248.0,0.00018043118257495022,5,3,adam,"{'neurons_per_layer_encoder': [28, 56, 112], 'neurons_per_layer_decoder': [112, 56, 28, 14, 8]}",28.0,"[112, 56, 28, 14, 8]","[28, 56, 112]",[-0.89145321823124],[-0.06914954780978899],0.34933252158350225,COMPLETE
538,0.3125795292479039,-0.19633700322376169,2024-12-23 11:36:14.036257,2024-12-23 11:36:17.810818,0 days 00:00:03.774561,0.023925739136204743,104.0,0.1,112,100.0,1.627234554325016e-05,872.0,0.0044391841001503955,5,3,adam,"{'neurons_per_layer_encoder': [112, 224, 448], 'neurons_per_layer_decoder': [448, 224, 112, 56, 28]}",112.0,"[448, 224, 112, 56, 28]","[112, 224, 448]",[0.3125795292479039],[-0.19633700322376169],-0.07654411370692787,COMPLETE
539,0.07122804254403536,-0.3429731645027352,2024-12-23 11:36:16.028244,2024-12-23 11:36:20.769345,0 days 00:00:04.741101,0.023902948245612697,40.0,0.1,212,100.0,0.0008555478221222748,872.0,1.6400756742079094e-05,5,3,sgd,"{'neurons_per_layer_encoder': [212, 424, 848], 'neurons_per_layer_decoder': [848, 424, 212, 106, 53]}",212.0,"[848, 424, 212, 106, 53]","[212, 424, 848]",[0.07122804254403536],[-0.3429731645027352],0.9798814681788545,COMPLETE
540,-0.6217571307817036,-0.1815148440767942,2024-12-23 11:36:16.775347,2024-12-23 11:36:18.901459,0 days 00:00:02.126112,0.03755832751616288,128.0,0.1,124,100.0,0.0004756286704376417,760.0,1.705722266896826e-05,4,3,sgd,"{'neurons_per_layer_encoder': [124, 248, 496], 'neurons_per_layer_decoder': [496, 248, 124, 62]}",124.0,"[496, 248, 124, 62]","[124, 248, 496]",[-0.6217571307817036],[-0.1815148440767942],0.9312713365239553,COMPLETE
541,0.3471716251597591,0.1577112552780202,2024-12-23 11:36:18.907165,2024-12-23 11:36:25.955769,0 days 00:00:07.048604,0.026686966508460353,40.0,0.1,156,100.0,0.00015944822952193094,664.0,0.00021578007446563822,5,3,adam,"{'neurons_per_layer_encoder': [156, 312, 624], 'neurons_per_layer_decoder': [624, 312, 156, 78, 39]}",156.0,"[624, 312, 156, 78, 39]","[156, 312, 624]",[0.3471716251597591],[0.1577112552780202],0.903481787953129,COMPLETE
542,0.7207986091518742,0.4319798114386182,2024-12-23 11:36:20.775019,2024-12-23 11:36:26.250356,0 days 00:00:05.475337,0.030627968059960178,40.0,0.1,80,100.0,0.00010728054552574814,472.0,0.00022839939387287283,4,3,adam,"{'neurons_per_layer_encoder': [80, 160, 320], 'neurons_per_layer_decoder': [320, 160, 80, 40]}",80.0,"[320, 160, 80, 40]","[80, 160, 320]",[0.7207986091518742],[0.4319798114386182],0.8584819547370256,COMPLETE
543,0.38295581086949193,0.21730455904191248,2024-12-23 11:36:26.254914,2024-12-23 11:36:31.099407,0 days 00:00:04.844493,0.025666919013790958,32.0,0.30000000000000004,80,100.0,0.0001343953111711658,456.0,0.00014723948224593954,4,3,adam,"{'neurons_per_layer_encoder': [80, 160, 320], 'neurons_per_layer_decoder': [320, 160, 80, 40]}",80.0,"[320, 160, 80, 40]","[80, 160, 320]",[0.38295581086949193],[0.21730455904191248],0.8287862512595777,COMPLETE
544,0.5844117766388108,0.21482330545118988,2024-12-23 11:36:31.103920,2024-12-23 11:36:35.758206,0 days 00:00:04.654286,0.02707945358599497,40.0,0.30000000000000004,72,100.0,0.0001096401228722315,472.0,0.0003914397216859016,4,3,adam,"{'neurons_per_layer_encoder': [72, 144, 288], 'neurons_per_layer_decoder': [288, 144, 72, 36]}",72.0,"[288, 144, 72, 36]","[72, 144, 288]",[0.5844117766388108],[0.21482330545118988],0.8174189255623803,COMPLETE
545,-0.21543772247305415,0.45690272967345424,2024-12-23 11:36:35.762264,2024-12-23 11:36:40.496174,0 days 00:00:04.733910,0.03009639443016649,40.0,0.1,76,100.0,0.00015345538767786384,440.0,6.379109359859554e-05,4,3,adam,"{'neurons_per_layer_encoder': [76, 152, 304], 'neurons_per_layer_decoder': [304, 152, 76, 38]}",76.0,"[304, 152, 76, 38]","[76, 152, 304]",[-0.21543772247305415],[0.45690272967345424],0.8115788878697867,COMPLETE
