number,values_0,values_1,datetime_start,datetime_complete,duration,params_alpha,params_batch_size,params_drop_out_rate,params_encoder_neurons_layer_1,params_epochs,params_lambda,params_latent_dim,params_learning_rate,params_num_layers_decoder,params_num_layers_encoder,params_optimizer,user_attrs_encoder_decoder_config,user_attrs_first_layer_neurons,user_attrs_neurons_per_layer_decoder,user_attrs_neurons_per_layer_encoder,user_attrs_r2_feature_1,user_attrs_r2_feature_2,user_attrs_relative_deterioration,state
366,0.46466317889764175,0.19434907149620684,2024-12-23 11:33:12.038589,2024-12-23 11:33:15.748253,0 days 00:00:03.709664,0.03199897644308646,40.0,0.2,84,100.0,1.9983817578517602e-06,172.0,0.0005724657255144058,4,1,adam,"{'neurons_per_layer_encoder': [84], 'neurons_per_layer_decoder': [84, 42, 21, 10]}",84.0,"[84, 42, 21, 10]",[84],[0.46466317889764175],[0.19434907149620684],-0.1942634794907577,COMPLETE
367,0.503882958420627,0.4107632444634256,2024-12-23 11:33:12.043055,2024-12-23 11:33:16.328413,0 days 00:00:04.285358,0.02736978418553603,40.0,0.2,228,100.0,1.9231414194781627e-06,444.0,0.0005459350409223684,4,1,adam,"{'neurons_per_layer_encoder': [228], 'neurons_per_layer_decoder': [228, 114, 57, 28]}",228.0,"[228, 114, 57, 28]",[228],[0.503882958420627],[0.4107632444634256],-0.252829667225607,COMPLETE
368,0.5775075577032432,0.12149790208379885,2024-12-23 11:33:12.043260,2024-12-23 11:33:15.682345,0 days 00:00:03.639085,0.024193356247341175,40.0,0.2,72,100.0,1.9173851730125687e-06,111.0,0.0005514303298733188,4,1,adam,"{'neurons_per_layer_encoder': [72], 'neurons_per_layer_decoder': [72, 36, 18, 9]}",72.0,"[72, 36, 18, 9]",[72],[0.5775075577032432],[0.12149790208379885],-0.17036438312256344,COMPLETE
369,-0.0878305753391142,0.3606548208465301,2024-12-23 11:33:12.039802,2024-12-23 11:33:15.171795,0 days 00:00:03.131993,0.02383982644745191,40.0,0.2,84,100.0,2.4556379636161733e-06,188.0,3.136848080096573e-05,2,1,adam,"{'neurons_per_layer_encoder': [84], 'neurons_per_layer_decoder': [84, 42]}",84.0,"[84, 42]",[84],[-0.0878305753391142],[0.3606548208465301],0.2355573109167977,COMPLETE
370,0.39972396893116935,0.12682276791927427,2024-12-23 11:33:12.043440,2024-12-23 11:33:15.740097,0 days 00:00:03.696657,0.03231734826926752,40.0,0.2,84,100.0,1.9041779121543527e-06,108.0,0.00011405965761531271,4,1,adam,"{'neurons_per_layer_encoder': [84], 'neurons_per_layer_decoder': [84, 42, 21, 10]}",84.0,"[84, 42, 21, 10]",[84],[0.39972396893116935],[0.12682276791927427],0.07815351637226776,COMPLETE
371,0.6816499860281853,0.35383703430650515,2024-12-23 11:33:12.043657,2024-12-23 11:33:14.921192,0 days 00:00:02.877535,0.023962193705814268,40.0,0.2,84,100.0,1.921856054867441e-06,188.0,0.0005708009099938305,1,1,adam,"{'neurons_per_layer_encoder': [84], 'neurons_per_layer_decoder': [84]}",84.0,[84],[84],[0.6816499860281853],[0.35383703430650515],-0.4414037075105864,COMPLETE
372,0.5363149725318863,0.2150654985531365,2024-12-23 11:33:14.928113,2024-12-23 11:33:32.220064,0 days 00:00:17.291951,0.02389224204735642,40.0,0.2,84,100.0,1.4631841492188947e-06,3032.0,0.00011122541705225092,1,5,adam,"{'neurons_per_layer_encoder': [84, 168, 336, 672, 1344], 'neurons_per_layer_decoder': [1344]}",84.0,[1344],"[84, 168, 336, 672, 1344]",[0.5363149725318863],[0.2150654985531365],0.26870396218627246,COMPLETE
373,0.5314926248124968,0.1082787247710073,2024-12-23 11:33:15.180200,2024-12-23 11:33:30.630573,0 days 00:00:15.450373,0.027873212465462392,48.0,0.2,68,100.0,1.9447480540481282e-06,1608.0,0.0005599533753855488,1,5,adam,"{'neurons_per_layer_encoder': [68, 136, 272, 544, 1088], 'neurons_per_layer_decoder': [1088]}",68.0,[1088],"[68, 136, 272, 544, 1088]",[0.5314926248124968],[0.1082787247710073],-0.5361608973889641,COMPLETE
374,0.4186117192942391,0.08660521520302644,2024-12-23 11:33:15.689673,2024-12-23 11:33:30.808396,0 days 00:00:15.118723,0.03351967324317915,48.0,0.2,68,100.0,1.555590254566231e-06,1640.0,0.0005855503470398338,1,5,adam,"{'neurons_per_layer_encoder': [68, 136, 272, 544, 1088], 'neurons_per_layer_decoder': [1088]}",68.0,[1088],"[68, 136, 272, 544, 1088]",[0.4186117192942391],[0.08660521520302644],-0.5862456248658916,COMPLETE
375,0.45267606740463706,-0.026535843190995,2024-12-23 11:33:15.753373,2024-12-23 11:33:30.912540,0 days 00:00:15.159167,0.023672811082198722,48.0,0.2,68,100.0,2.357724419967557e-06,1624.0,0.000712748015342311,1,5,adam,"{'neurons_per_layer_encoder': [68, 136, 272, 544, 1088], 'neurons_per_layer_decoder': [1088]}",68.0,[1088],"[68, 136, 272, 544, 1088]",[0.45267606740463706],[-0.026535843190995],-0.678144191460045,COMPLETE
376,0.5061548930520103,0.16610977420536133,2024-12-23 11:33:15.758022,2024-12-23 11:33:24.463125,0 days 00:00:08.705103,0.02364334881757478,48.0,0.2,228,100.0,1.4573350566139501e-06,476.0,0.0006251328618484806,1,1,adam,"{'neurons_per_layer_encoder': [228], 'neurons_per_layer_decoder': [228]}",228.0,[228],[228],[0.5061548930520103],[0.16610977420536133],-1.4108764461437684,COMPLETE
377,0.46688713392730397,0.24752022106306615,2024-12-23 11:33:16.335906,2024-12-23 11:33:32.464981,0 days 00:00:16.129075,0.0236751891098674,48.0,0.2,72,100.0,2.4898781169204465e-06,1592.0,0.0006994018012074329,1,5,adam,"{'neurons_per_layer_encoder': [72, 144, 288, 576, 1152], 'neurons_per_layer_decoder': [1152]}",72.0,[1152],"[72, 144, 288, 576, 1152]",[0.46688713392730397],[0.24752022106306615],-0.20891424076561188,COMPLETE
378,-0.42269201514832955,-0.2678162435238878,2024-12-23 11:33:24.995808,2024-12-23 11:33:34.904788,0 days 00:00:09.908980,0.023588036664959622,40.0,0.2,68,100.0,2.4635274859609795e-06,1528.0,0.00044029346028048833,1,5,adam,"{'neurons_per_layer_encoder': [68, 136, 272, 544, 1088], 'neurons_per_layer_decoder': [1088]}",68.0,[1088],"[68, 136, 272, 544, 1088]",[-0.42269201514832955],[-0.2678162435238878],-0.3622501770508837,COMPLETE
379,0.28299262376035583,-0.19248008147328188,2024-12-23 11:33:30.638201,2024-12-23 11:33:41.126679,0 days 00:00:10.488478,0.023100721682581194,40.0,0.2,56,100.0,2.486144109848625e-06,1480.0,0.00041697970066702466,1,5,adadelta,"{'neurons_per_layer_encoder': [56, 112, 224, 448, 896], 'neurons_per_layer_decoder': [896]}",56.0,[896],"[56, 112, 224, 448, 896]",[0.28299262376035583],[-0.19248008147328188],0.27490523901877323,COMPLETE
380,-1.2620536850051383,-0.0679154442320622,2024-12-23 11:33:30.817736,2024-12-23 11:33:33.402625,0 days 00:00:02.584889,0.023357418423208473,40.0,0.2,56,100.0,2.4633485957496546e-06,109.0,0.00043818567877012383,1,1,adadelta,"{'neurons_per_layer_encoder': [56], 'neurons_per_layer_decoder': [56]}",56.0,[56],[56],[-1.2620536850051383],[-0.0679154442320622],0.4355123542603283,COMPLETE
381,-1.5905816933440957,0.17539902486299297,2024-12-23 11:33:30.925001,2024-12-23 11:33:33.691049,0 days 00:00:02.766048,0.025935265785014497,40.0,0.2,76,100.0,2.5331296623388286e-06,147.0,0.00043570013224333355,1,1,adadelta,"{'neurons_per_layer_encoder': [76], 'neurons_per_layer_decoder': [76]}",76.0,[76],[76],[-1.5905816933440957],[0.17539902486299297],-0.06793892903886807,COMPLETE
382,-1.3056378007062537,-0.1800034564978974,2024-12-23 11:33:32.230698,2024-12-23 11:33:34.305429,0 days 00:00:02.074731,0.09179375947117235,40.0,0.2,76,100.0,2.527323011529289e-06,147.0,0.00045382292441678834,1,1,adadelta,"{'neurons_per_layer_encoder': [76], 'neurons_per_layer_decoder': [76]}",76.0,[76],[76],[-1.3056378007062537],[-0.1800034564978974],0.22433604810156219,COMPLETE
383,-0.1316981029198121,-0.08001310125243877,2024-12-23 11:33:32.473195,2024-12-23 11:33:36.212320,0 days 00:00:03.739125,0.09072733491205284,40.0,0.2,56,100.0,0.0007795222420935519,109.0,0.0004089533386232644,1,1,adadelta,"{'neurons_per_layer_encoder': [56], 'neurons_per_layer_decoder': [56]}",56.0,[56],[56],[-0.1316981029198121],[-0.08001310125243877],0.6402755301923343,COMPLETE
384,0.12782407777065496,0.06275106075595915,2024-12-23 11:33:33.413652,2024-12-23 11:33:36.935034,0 days 00:00:03.521382,0.020753588340510692,128.0,0.2,76,100.0,3.340601314297641e-06,147.0,0.0004955621758960541,1,1,adam,"{'neurons_per_layer_encoder': [76], 'neurons_per_layer_decoder': [76]}",76.0,[76],[76],[0.12782407777065496],[0.06275106075595915],-1.577466957511561,COMPLETE
385,0.6437807121794374,0.29492228709773716,2024-12-23 11:33:33.702314,2024-12-23 11:33:37.318484,0 days 00:00:03.616170,0.021338687897318288,40.0,0.2,80,100.0,3.19448095650345e-05,120.0,0.0007644255990562236,1,1,adam,"{'neurons_per_layer_encoder': [80], 'neurons_per_layer_decoder': [80]}",80.0,[80],[80],[0.6437807121794374],[0.29492228709773716],-0.31612995565055513,COMPLETE
386,0.6533588795657628,0.14973178315180347,2024-12-23 11:33:34.311249,2024-12-23 11:33:37.822857,0 days 00:00:03.511608,0.0208247275021875,40.0,0.2,80,100.0,0.00011840482623917997,120.0,5.490594931779947e-05,1,1,adam,"{'neurons_per_layer_encoder': [80], 'neurons_per_layer_decoder': [80]}",80.0,[80],[80],[0.6533588795657628],[0.14973178315180347],0.2649281075917882,COMPLETE
387,-0.787033426702991,-0.1523140125839082,2024-12-23 11:33:34.914333,2024-12-23 11:33:36.228330,0 days 00:00:01.313997,0.02059196076789849,40.0,0.2,164,100.0,3.2388214530925117e-06,316.0,0.0007762709445172856,1,1,sgd,"{'neurons_per_layer_encoder': [164], 'neurons_per_layer_decoder': [164]}",164.0,[164],[164],[-0.787033426702991],[-0.1523140125839082],-0.1028821532452947,COMPLETE
388,0.07050693521176099,0.0966505335080432,2024-12-23 11:33:36.220410,2024-12-23 11:33:39.468364,0 days 00:00:03.247954,0.020990632183333153,128.0,0.2,80,100.0,3.33945960082243e-06,120.0,0.0007237467379498744,1,1,adam,"{'neurons_per_layer_encoder': [80], 'neurons_per_layer_decoder': [80]}",80.0,[80],[80],[0.07050693521176099],[0.0966505335080432],-1.3788835298367916,COMPLETE
389,0.5653617185054314,0.42241677986063686,2024-12-23 11:33:36.237656,2024-12-23 11:33:39.605532,0 days 00:00:03.367876,0.02106484295174417,40.0,0.2,80,100.0,3.3825783131172976e-06,120.0,0.000663663520951777,1,1,adam,"{'neurons_per_layer_encoder': [80], 'neurons_per_layer_decoder': [80]}",80.0,[80],[80],[0.5653617185054314],[0.42241677986063686],-0.41760138054412416,COMPLETE
390,-0.5391061451139809,0.06580827374344622,2024-12-23 11:33:36.942983,2024-12-23 11:33:38.638146,0 days 00:00:01.695163,0.022224496817752838,40.0,0.2,80,100.0,1.693450910872453e-06,120.0,5.430695641741425e-05,1,1,adam,"{'neurons_per_layer_encoder': [80], 'neurons_per_layer_decoder': [80]}",80.0,[80],[80],[-0.5391061451139809],[0.06580827374344622],-0.45038007237394023,COMPLETE
391,0.4940323822562034,0.1948305300452755,2024-12-23 11:33:37.327299,2024-12-23 11:33:40.788662,0 days 00:00:03.461363,0.02564225169838033,40.0,0.2,92,100.0,2.9240097797205835e-06,212.0,0.0006454441926593723,1,1,adam,"{'neurons_per_layer_encoder': [92], 'neurons_per_layer_decoder': [92]}",92.0,[92],[92],[0.4940323822562034],[0.1948305300452755],-0.8348719522811776,COMPLETE
392,0.6427110839672769,0.25251037310324476,2024-12-23 11:33:37.830070,2024-12-23 11:33:41.239190,0 days 00:00:03.409120,0.02530318245108342,40.0,0.2,92,100.0,2.999764089734976e-06,212.0,0.0006477033785475124,1,1,adam,"{'neurons_per_layer_encoder': [92], 'neurons_per_layer_decoder': [92]}",92.0,[92],[92],[0.6427110839672769],[0.25251037310324476],-0.5576913293095951,COMPLETE
393,0.5783092891324579,0.4231908621449202,2024-12-23 11:33:38.644792,2024-12-23 11:33:44.966929,0 days 00:00:06.322137,0.025663025535864026,32.0,0.2,88,100.0,2.8591291305606527e-06,664.0,0.0006632035018427305,1,3,adam,"{'neurons_per_layer_encoder': [88, 176, 352], 'neurons_per_layer_decoder': [352]}",88.0,[352],"[88, 176, 352]",[0.5783092891324579],[0.4231908621449202],-0.40064111762740495,COMPLETE
394,0.5114955596898038,0.3087926064481603,2024-12-23 11:33:39.476230,2024-12-23 11:33:48.103865,0 days 00:00:08.627635,0.02246265430494231,32.0,0.2,196,100.0,2.8815705616162655e-06,1464.0,0.0006647031721246762,1,3,adam,"{'neurons_per_layer_encoder': [196, 392, 784], 'neurons_per_layer_decoder': [784]}",196.0,[784],"[196, 392, 784]",[0.5114955596898038],[0.3087926064481603],-0.6154001413242048,COMPLETE
395,0.4201457277063898,0.3099515250934356,2024-12-23 11:33:39.613666,2024-12-23 11:33:44.511916,0 days 00:00:04.898250,0.025189452963653602,32.0,0.2,40,100.0,2.871528907450616e-06,360.0,0.0006168311635272435,1,3,adam,"{'neurons_per_layer_encoder': [40, 80, 160], 'neurons_per_layer_decoder': [160]}",40.0,[160],"[40, 80, 160]",[0.4201457277063898],[0.3099515250934356],-0.5031133361201454,COMPLETE
396,-2.2950476825815374,-0.05274784637397456,2024-12-23 11:33:40.795691,2024-12-23 11:33:42.859276,0 days 00:00:02.063585,0.02284405993291913,32.0,0.2,72,100.0,0.00017011343390549948,632.0,0.0008096396745641552,1,3,sgd,"{'neurons_per_layer_encoder': [72, 144, 288], 'neurons_per_layer_decoder': [288]}",72.0,[288],"[72, 144, 288]",[-2.2950476825815374],[-0.05274784637397456],0.5226166339091199,COMPLETE
397,0.0456038743037267,0.011815388084074452,2024-12-23 11:33:41.137110,2024-12-23 11:33:47.137464,0 days 00:00:06.000354,0.16961628442772794,32.0,0.2,116,100.0,2.110998976165843e-06,792.0,0.0006101610101192271,1,3,sgd,"{'neurons_per_layer_encoder': [116, 232, 464], 'neurons_per_layer_decoder': [464]}",116.0,[464],"[116, 232, 464]",[0.0456038743037267],[0.011815388084074452],0.22894778840332197,COMPLETE
398,-1.0337620198592279,0.18674340624939623,2024-12-23 11:33:41.247142,2024-12-23 11:33:42.805972,0 days 00:00:01.558830,0.022381040394348507,32.0,0.2,36,100.0,0.00016927912798737115,55.0,0.0008162268693192534,1,1,sgd,"{'neurons_per_layer_encoder': [36], 'neurons_per_layer_decoder': [36]}",36.0,[36],[36],[-1.0337620198592279],[0.18674340624939623],0.15963928593932436,COMPLETE
399,0.6691165837398745,0.44729875824962817,2024-12-23 11:33:42.811944,2024-12-23 11:33:49.115675,0 days 00:00:06.303731,0.019550702309446215,32.0,0.2,116,100.0,2.1094408689946044e-06,776.0,0.0010175785966871531,1,3,adam,"{'neurons_per_layer_encoder': [116, 232, 464], 'neurons_per_layer_decoder': [464]}",116.0,[464],"[116, 232, 464]",[0.6691165837398745],[0.44729875824962817],-0.5140944987982836,COMPLETE
400,0.6784901565933017,0.25980017412220835,2024-12-23 11:33:42.869009,2024-12-23 11:33:50.370452,0 days 00:00:07.501443,0.10706705577615526,32.0,0.2,72,100.0,2.12878528756181e-06,536.0,0.0009930947274941822,5,3,adam,"{'neurons_per_layer_encoder': [72, 144, 288], 'neurons_per_layer_decoder': [288, 144, 72, 36, 18]}",72.0,"[288, 144, 72, 36, 18]","[72, 144, 288]",[0.6784901565933017],[0.25980017412220835],-0.3162007392761445,COMPLETE
401,0.6735214413114077,0.22438053432374439,2024-12-23 11:33:44.761347,2024-12-23 11:33:48.589169,0 days 00:00:03.827822,0.1664559944936496,32.0,0.2,72,100.0,2.2307529306662444e-06,111.0,0.0005259522080971888,1,1,adam,"{'neurons_per_layer_encoder': [72], 'neurons_per_layer_decoder': [72]}",72.0,[72],[72],[0.6735214413114077],[0.22438053432374439],-0.40099375250555147,COMPLETE
402,0.5767083218805464,0.17886212220971276,2024-12-23 11:33:44.975465,2024-12-23 11:33:49.900310,0 days 00:00:04.924845,0.018347843171007933,40.0,0.2,72,100.0,2.0962487525048013e-06,111.0,0.0009852215858154201,5,1,adam,"{'neurons_per_layer_encoder': [72], 'neurons_per_layer_decoder': [72, 36, 18, 9, 8]}",72.0,"[72, 36, 18, 9, 8]",[72],[0.5767083218805464],[0.17886212220971276],-0.06328340899304957,COMPLETE
403,0.5860120875732691,0.264242179426304,2024-12-23 11:33:47.145777,2024-12-23 11:33:50.292717,0 days 00:00:03.146940,0.1053583184159478,40.0,0.2,72,100.0,2.157175403511017e-06,111.0,0.0010121647625972808,1,1,adam,"{'neurons_per_layer_encoder': [72], 'neurons_per_layer_decoder': [72]}",72.0,[72],[72],[0.5860120875732691],[0.264242179426304],-0.5841630316813223,COMPLETE
404,0.6708000009143493,0.28225756314530115,2024-12-23 11:33:48.113539,2024-12-23 11:33:51.144447,0 days 00:00:03.030908,0.019696902680365985,40.0,0.2,12,100.0,2.2038917570570276e-06,13.0,0.001021273582895879,1,1,adam,"{'neurons_per_layer_encoder': [12], 'neurons_per_layer_decoder': [12]}",12.0,[12],[12],[0.6708000009143493],[0.28225756314530115],-0.10311363065059316,COMPLETE
405,0.6287484011581528,0.5355817663394935,2024-12-23 11:33:48.595916,2024-12-23 11:33:51.464385,0 days 00:00:02.868469,0.01820528606788819,40.0,0.2,68,100.0,1.7873297757798702e-06,122.0,0.0009971748960042194,1,1,adam,"{'neurons_per_layer_encoder': [68], 'neurons_per_layer_decoder': [68]}",68.0,[68],[68],[0.6287484011581528],[0.5355817663394935],-0.35644728090033484,COMPLETE
406,0.2003990469661796,0.14530326888097123,2024-12-23 11:33:49.124060,2024-12-23 11:33:53.060637,0 days 00:00:03.936577,0.019611910733549533,48.0,0.2,72,100.0,5.1007930432800665e-05,111.0,0.0009497100873302993,5,1,adam,"{'neurons_per_layer_encoder': [72], 'neurons_per_layer_decoder': [72, 36, 18, 9, 8]}",72.0,"[72, 36, 18, 9, 8]",[72],[0.2003990469661796],[0.14530326888097123],-0.02426061103964497,COMPLETE
407,0.5744046290090299,0.23856699433732254,2024-12-23 11:33:49.906844,2024-12-23 11:33:52.668450,0 days 00:00:02.761606,0.019822676744083577,48.0,0.2,68,100.0,2.3942931587679054e-05,122.0,0.001259839074647014,1,1,adam,"{'neurons_per_layer_encoder': [68], 'neurons_per_layer_decoder': [68]}",68.0,[68],[68],[0.5744046290090299],[0.23856699433732254],-0.8822378244090726,COMPLETE
408,0.5652345877723479,0.2249565397554404,2024-12-23 11:33:50.299184,2024-12-23 11:33:53.159250,0 days 00:00:02.860066,0.019224345323484326,48.0,0.2,68,100.0,1.7886526726906844e-06,122.0,0.0012387029810804117,1,1,adam,"{'neurons_per_layer_encoder': [68], 'neurons_per_layer_decoder': [68]}",68.0,[68],[68],[0.5652345877723479],[0.2249565397554404],-1.2725431904436997,COMPLETE
409,0.44614336015872436,0.1700527848767096,2024-12-23 11:33:50.383841,2024-12-23 11:33:53.049651,0 days 00:00:02.665810,0.019855779559001155,48.0,0.2,12,100.0,1.8079445020550857e-06,13.0,0.0012761671100382885,1,1,adam,"{'neurons_per_layer_encoder': [12], 'neurons_per_layer_decoder': [12]}",12.0,[12],[12],[0.44614336015872436],[0.1700527848767096],-0.539819192514749,COMPLETE
410,0.5797594234356982,0.29889031246058906,2024-12-23 11:33:51.152683,2024-12-23 11:33:53.893777,0 days 00:00:02.741094,0.01986830979555059,48.0,0.2,64,100.0,1.579406777582893e-06,134.0,0.001680708941381471,1,1,adam,"{'neurons_per_layer_encoder': [64], 'neurons_per_layer_decoder': [64]}",64.0,[64],[64],[0.5797594234356982],[0.29889031246058906],-1.1908798040176325,COMPLETE
411,0.38053424523920965,0.07030792582999545,2024-12-23 11:33:51.471258,2024-12-23 11:33:54.628139,0 days 00:00:03.156881,0.027017215753484435,48.0,0.2,180,100.0,0.0006071006842617555,380.0,0.0005258468847108926,1,1,adam,"{'neurons_per_layer_encoder': [180], 'neurons_per_layer_decoder': [180]}",180.0,[180],[180],[0.38053424523920965],[0.07030792582999545],0.5525871630969765,COMPLETE
412,0.4687636098889819,0.27278577541131954,2024-12-23 11:33:52.675349,2024-12-23 11:33:55.460553,0 days 00:00:02.785204,0.027451755547090624,40.0,0.2,76,100.0,0.0005658347965445119,163.0,2.121921523558761e-05,1,1,adam,"{'neurons_per_layer_encoder': [76], 'neurons_per_layer_decoder': [76]}",76.0,[76],[76],[0.4687636098889819],[0.27278577541131954],0.7133153782451076,COMPLETE
413,0.6385898272358183,0.22862020840664676,2024-12-23 11:33:53.055897,2024-12-23 11:33:55.806330,0 days 00:00:02.750433,0.0293784654357402,40.0,0.2,60,100.0,0.00040460936411979145,130.0,0.0005081106521874404,1,1,adam,"{'neurons_per_layer_encoder': [60], 'neurons_per_layer_decoder': [60]}",60.0,[60],[60],[0.6385898272358183],[0.22862020840664676],0.4631251190616637,COMPLETE
414,0.7073517209230447,0.37190472911478256,2024-12-23 11:33:53.068328,2024-12-23 11:33:55.818933,0 days 00:00:02.750605,0.02717878577031748,40.0,0.2,60,100.0,7.73758358032587e-05,130.0,0.0005037114825882503,1,1,adam,"{'neurons_per_layer_encoder': [60], 'neurons_per_layer_decoder': [60]}",60.0,[60],[60],[0.7073517209230447],[0.37190472911478256],0.15572296253985574,COMPLETE
415,0.06664402191373298,-0.04139006689102209,2024-12-23 11:33:53.167452,2024-12-23 11:33:55.916842,0 days 00:00:02.749390,0.024299744866181288,40.0,0.2,60,100.0,1.601570492172274e-06,130.0,1.6193166152693586e-05,1,1,adam,"{'neurons_per_layer_encoder': [60], 'neurons_per_layer_decoder': [60]}",60.0,[60],[60],[0.06664402191373298],[-0.04139006689102209],0.35571075965132154,COMPLETE
416,0.08397599227658015,0.2601191734365279,2024-12-23 11:33:53.900552,2024-12-23 11:33:57.428401,0 days 00:00:03.527849,0.024547822128904783,40.0,0.2,220,100.0,0.0003352693486104164,484.0,2.237816283005701e-05,1,1,adam,"{'neurons_per_layer_encoder': [220], 'neurons_per_layer_decoder': [220]}",220.0,[220],[220],[0.08397599227658015],[0.2601191734365279],0.740303129004013,COMPLETE
417,-1.6432900842628744,-0.09728356298607332,2024-12-23 11:33:54.635147,2024-12-23 11:33:55.667602,0 days 00:00:01.032455,0.028640993148986084,112.0,0.2,88,100.0,2.3380959086034285e-06,176.0,0.0007531548730688604,1,1,sgd,"{'neurons_per_layer_encoder': [88], 'neurons_per_layer_decoder': [88]}",88.0,[88],[88],[-1.6432900842628744],[-0.09728356298607332],0.40420576702817496,COMPLETE
418,-1.1921802548229294,-0.138193366311804,2024-12-23 11:33:55.469771,2024-12-23 11:33:56.495963,0 days 00:00:01.026192,0.02984008555916044,40.0,0.2,88,100.0,1.085516481521213e-05,176.0,0.0002814367422566492,1,1,sgd,"{'neurons_per_layer_encoder': [88], 'neurons_per_layer_decoder': [88]}",88.0,[88],[88],[-1.1921802548229294],[-0.138193366311804],0.164781067579844,COMPLETE
419,0.5964611628362684,0.5006621738756154,2024-12-23 11:33:55.673865,2024-12-23 11:34:00.991976,0 days 00:00:05.318111,0.024491078481203108,40.0,0.2,140,100.0,2.5974319223737646e-06,324.0,0.0005146484849149097,1,1,adam,"{'neurons_per_layer_encoder': [140], 'neurons_per_layer_decoder': [140]}",140.0,[140],[140],[0.5964611628362684],[0.5006621738756154],-0.26985235992543544,COMPLETE
