number,values_0,values_1,datetime_start,datetime_complete,duration,params_alpha,params_batch_size,params_drop_out_rate,params_encoder_neurons_layer_1,params_epochs,params_lambda,params_latent_dim,params_learning_rate,params_num_layers_decoder,params_num_layers_encoder,params_optimizer,user_attrs_encoder_decoder_config,user_attrs_first_layer_neurons,user_attrs_neurons_per_layer_decoder,user_attrs_neurons_per_layer_encoder,user_attrs_r2_feature_1,user_attrs_r2_feature_2,user_attrs_relative_deterioration,state
260,-0.8049074262150788,-0.03685913080532632,2024-12-23 11:27:53.583392,2024-12-23 11:27:56.735127,0 days 00:00:03.151735,0.022940563021118233,40.0,0.2,80,100.0,3.649108802361275e-06,1080.0,0.0005780379622108657,1,4,sgd,"{'neurons_per_layer_encoder': [80, 160, 320, 640], 'neurons_per_layer_decoder': [640]}",80.0,[640],"[80, 160, 320, 640]",[-0.8049074262150788],[-0.03685913080532632],0.09749285408533973,COMPLETE
261,-0.8717967726897105,-0.019037008528366872,2024-12-23 11:27:53.642428,2024-12-23 11:27:56.565143,0 days 00:00:02.922715,0.022569040979963477,104.0,0.2,92,100.0,2.074817472891269e-05,1048.0,0.0005726388371603551,1,4,sgd,"{'neurons_per_layer_encoder': [92, 184, 368, 736], 'neurons_per_layer_decoder': [736]}",92.0,[736],"[92, 184, 368, 736]",[-0.8717967726897105],[-0.019037008528366872],0.4322627505112683,COMPLETE
262,-1.0795338633470908,-0.04401204479659171,2024-12-23 11:27:54.682088,2024-12-23 11:27:57.724860,0 days 00:00:03.042772,0.025552614934317666,40.0,0.2,80,100.0,3.62558865790424e-06,1048.0,0.0006083874898210522,1,4,sgd,"{'neurons_per_layer_encoder': [80, 160, 320, 640], 'neurons_per_layer_decoder': [640]}",80.0,[640],"[80, 160, 320, 640]",[-1.0795338633470908],[-0.04401204479659171],0.13568317948787037,COMPLETE
263,0.0529708347073945,-0.32952406482413243,2024-12-23 11:27:55.569152,2024-12-23 11:28:01.885549,0 days 00:00:06.316397,0.02331442891642313,104.0,0.2,88,100.0,1.975798821000763e-06,1048.0,0.0005774624033760568,1,4,sgd,"{'neurons_per_layer_encoder': [88, 176, 352, 704], 'neurons_per_layer_decoder': [704]}",88.0,[704],"[88, 176, 352, 704]",[0.0529708347073945],[-0.32952406482413243],0.21912339486046908,COMPLETE
264,-0.13864189088571477,0.03574876176002861,2024-12-23 11:27:56.572608,2024-12-23 11:28:05.930402,0 days 00:00:09.357794,0.025097723299729806,48.0,0.2,192,100.0,5.3439578330952675e-05,1624.0,0.0004493097907476771,1,4,sgd,"{'neurons_per_layer_encoder': [192, 384, 768, 1536], 'neurons_per_layer_decoder': [1536]}",192.0,[1536],"[192, 384, 768, 1536]",[-0.13864189088571477],[0.03574876176002861],0.8106377502091145,COMPLETE
265,0.37734522962390793,0.007726948809473111,2024-12-23 11:27:56.742560,2024-12-23 11:28:05.539511,0 days 00:00:08.796951,0.025199987066118916,56.0,0.2,88,100.0,2.0650245188453833e-06,1016.0,0.0003351643608872858,1,4,adam,"{'neurons_per_layer_encoder': [88, 176, 352, 704], 'neurons_per_layer_decoder': [704]}",88.0,[704],"[88, 176, 352, 704]",[0.37734522962390793],[0.007726948809473111],-0.5816096703872188,COMPLETE
266,0.5928045727069275,0.6448719756398129,2024-12-23 11:27:57.294649,2024-12-23 11:28:06.436709,0 days 00:00:09.142060,0.023646935579753236,40.0,0.2,64,100.0,0.00018572880307367992,936.0,0.0006050713435173954,1,4,adam,"{'neurons_per_layer_encoder': [64, 128, 256, 512], 'neurons_per_layer_decoder': [512]}",64.0,[512],"[64, 128, 256, 512]",[0.5928045727069275],[0.6448719756398129],0.9165118965324549,COMPLETE
267,0.27854389766412535,0.22430585506324485,2024-12-23 11:27:57.701432,2024-12-23 11:28:09.642676,0 days 00:00:11.941244,0.02516849745595489,56.0,0.2,156,100.0,2.8029437438520515e-06,2280.0,0.0004323147948699876,1,4,adam,"{'neurons_per_layer_encoder': [156, 312, 624, 1248], 'neurons_per_layer_decoder': [1248]}",156.0,[1248],"[156, 312, 624, 1248]",[0.27854389766412535],[0.22430585506324485],-0.4338407030372318,COMPLETE
268,0.4255162746643829,0.37462285283306396,2024-12-23 11:27:57.733181,2024-12-23 11:28:05.484551,0 days 00:00:07.751370,0.021426962015617803,48.0,0.2,40,100.0,0.00018265487254782013,664.0,0.0004329676382659017,1,4,adam,"{'neurons_per_layer_encoder': [40, 80, 160, 320], 'neurons_per_layer_decoder': [320]}",40.0,[320],"[40, 80, 160, 320]",[0.4255162746643829],[0.37462285283306396],0.8210711700604737,COMPLETE
269,0.6761419084522415,0.33447678116030577,2024-12-23 11:28:01.893791,2024-12-23 11:28:07.418163,0 days 00:00:05.524372,0.02146184672559016,48.0,0.2,12,100.0,2.0280147948639795e-06,68.0,0.000751245688651637,1,3,adam,"{'neurons_per_layer_encoder': [12, 24, 48], 'neurons_per_layer_decoder': [48]}",12.0,[48],"[12, 24, 48]",[0.6761419084522415],[0.33447678116030577],0.02888728765698488,COMPLETE
270,0.5703210231365053,0.13941034555829057,2024-12-23 11:28:05.491309,2024-12-23 11:28:11.543906,0 days 00:00:06.052597,0.024145053802803906,40.0,0.2,64,100.0,0.0003713808057502266,568.0,0.0003496714123833189,1,3,adam,"{'neurons_per_layer_encoder': [64, 128, 256], 'neurons_per_layer_decoder': [256]}",64.0,[256],"[64, 128, 256]",[0.5703210231365053],[0.13941034555829057],0.8656398249902243,COMPLETE
271,0.44498967511813503,0.08302723034967352,2024-12-23 11:28:05.550068,2024-12-23 11:28:11.052928,0 days 00:00:05.502860,0.023686882966760813,48.0,0.2,64,100.0,2.9722015147926907e-05,568.0,0.0007474811190137993,1,3,adam,"{'neurons_per_layer_encoder': [64, 128, 256], 'neurons_per_layer_decoder': [256]}",64.0,[256],"[64, 128, 256]",[0.44498967511813503],[0.08302723034967352],0.0001324863333774367,COMPLETE
272,0.3900022551428639,0.07643333036570688,2024-12-23 11:28:05.938130,2024-12-23 11:28:10.938798,0 days 00:00:05.000668,0.023748279607049894,112.0,0.2,60,100.0,2.9194822561321907e-06,296.0,0.000756067191182374,1,3,adam,"{'neurons_per_layer_encoder': [60, 120, 240], 'neurons_per_layer_decoder': [240]}",60.0,[240],"[60, 120, 240]",[0.3900022551428639],[0.07643333036570688],-0.5562994865401533,COMPLETE
273,0.5209746267905986,0.43645718737871664,2024-12-23 11:28:06.447339,2024-12-23 11:28:14.981670,0 days 00:00:08.534331,0.018321505144003006,40.0,0.2,68,100.0,1.8545160504309375e-06,984.0,0.0007360666942084696,1,4,adam,"{'neurons_per_layer_encoder': [68, 136, 272, 544], 'neurons_per_layer_decoder': [544]}",68.0,[544],"[68, 136, 272, 544]",[0.5209746267905986],[0.43645718737871664],-0.14812133863047258,COMPLETE
274,0.6099316652132769,0.49645225443568963,2024-12-23 11:28:07.425734,2024-12-23 11:28:16.105634,0 days 00:00:08.679900,0.021206047468320065,40.0,0.2,64,100.0,1.7211162475237858e-06,904.0,0.0008440268759167529,1,4,adam,"{'neurons_per_layer_encoder': [64, 128, 256, 512], 'neurons_per_layer_decoder': [512]}",64.0,[512],"[64, 128, 256, 512]",[0.6099316652132769],[0.49645225443568963],0.016364284013128057,COMPLETE
275,0.4999843920687277,0.263079377757105,2024-12-23 11:28:09.650509,2024-12-23 11:28:17.589697,0 days 00:00:07.939188,0.018807454554326624,40.0,0.2,64,100.0,1.7988808520967183e-06,904.0,0.0008513149642603598,1,4,adam,"{'neurons_per_layer_encoder': [64, 128, 256, 512], 'neurons_per_layer_decoder': [512]}",64.0,[512],"[64, 128, 256, 512]",[0.4999843920687277],[0.263079377757105],-0.438837979576056,COMPLETE
276,0.6084562716942696,0.35280072871898804,2024-12-23 11:28:10.946325,2024-12-23 11:28:19.188331,0 days 00:00:08.242006,0.02122053538135985,40.0,0.2,64,100.0,1.7474910957169941e-06,936.0,0.0008535567287101571,1,4,adam,"{'neurons_per_layer_encoder': [64, 128, 256, 512], 'neurons_per_layer_decoder': [512]}",64.0,[512],"[64, 128, 256, 512]",[0.6084562716942696],[0.35280072871898804],-0.08288702649545165,COMPLETE
277,0.5304575216477772,0.5323890563300495,2024-12-23 11:28:11.061825,2024-12-23 11:28:19.534372,0 days 00:00:08.472547,0.018237890984372455,40.0,0.2,68,100.0,1.779191861677496e-06,936.0,4.0440664061533944e-05,1,4,adam,"{'neurons_per_layer_encoder': [68, 136, 272, 544], 'neurons_per_layer_decoder': [544]}",68.0,[544],"[68, 136, 272, 544]",[0.5304575216477772],[0.5323890563300495],0.3233310773797732,COMPLETE
278,0.41385431870078915,0.11324097957968271,2024-12-23 11:28:11.552019,2024-12-23 11:28:20.415734,0 days 00:00:08.863715,0.01867495935716991,40.0,0.2,76,100.0,1.8864511952559324e-06,1112.0,0.000838494081881739,1,4,adam,"{'neurons_per_layer_encoder': [76, 152, 304, 608], 'neurons_per_layer_decoder': [608]}",76.0,[608],"[76, 152, 304, 608]",[0.41385431870078915],[0.11324097957968271],-0.8528769037670332,COMPLETE
279,0.5895186426634371,0.2006659137174286,2024-12-23 11:28:14.991204,2024-12-23 11:28:24.052639,0 days 00:00:09.061435,0.020932208239594515,40.0,0.2,76,100.0,1.6137905619129923e-06,936.0,0.0007826701208273387,1,4,adam,"{'neurons_per_layer_encoder': [76, 152, 304, 608], 'neurons_per_layer_decoder': [608]}",76.0,[608],"[76, 152, 304, 608]",[0.5895186426634371],[0.2006659137174286],-0.3553421621485939,COMPLETE
280,0.6862617627675033,0.2974430975116824,2024-12-23 11:28:16.114264,2024-12-23 11:28:25.017254,0 days 00:00:08.902990,0.02150028326526217,40.0,0.2,76,100.0,3.282454861819718e-06,936.0,0.0008530093271093579,1,4,adam,"{'neurons_per_layer_encoder': [76, 152, 304, 608], 'neurons_per_layer_decoder': [608]}",76.0,[608],"[76, 152, 304, 608]",[0.6862617627675033],[0.2974430975116824],0.015899834333404687,COMPLETE
281,0.5044305100203829,0.13451358754269716,2024-12-23 11:28:17.597640,2024-12-23 11:28:26.156579,0 days 00:00:08.558939,0.02140420723172795,40.0,0.2,76,100.0,3.335852119760321e-06,920.0,0.0009381259378785869,1,4,adam,"{'neurons_per_layer_encoder': [76, 152, 304, 608], 'neurons_per_layer_decoder': [608]}",76.0,[608],"[76, 152, 304, 608]",[0.5044305100203829],[0.13451358754269716],-0.38850678749023654,COMPLETE
282,0.5264455315791601,0.29189403365349786,2024-12-23 11:28:19.197659,2024-12-23 11:28:27.801635,0 days 00:00:08.603976,0.021109549490157146,40.0,0.2,76,100.0,3.319670644596848e-06,1112.0,0.0008665791926810253,1,4,adam,"{'neurons_per_layer_encoder': [76, 152, 304, 608], 'neurons_per_layer_decoder': [608]}",76.0,[608],"[76, 152, 304, 608]",[0.5264455315791601],[0.29189403365349786],-0.14622496757378717,COMPLETE
283,0.5960443708905027,0.3769154234178206,2024-12-23 11:28:19.542355,2024-12-23 11:28:28.811998,0 days 00:00:09.269643,0.020872482601319634,40.0,0.2,76,100.0,3.501094148542363e-06,1096.0,0.0008368322416572414,1,4,adam,"{'neurons_per_layer_encoder': [76, 152, 304, 608], 'neurons_per_layer_decoder': [608]}",76.0,[608],"[76, 152, 304, 608]",[0.5960443708905027],[0.3769154234178206],-0.02893835091983809,COMPLETE
284,0.4580775487232238,0.3302764529193606,2024-12-23 11:28:20.423931,2024-12-23 11:28:29.704985,0 days 00:00:09.281054,0.020855594572772182,40.0,0.2,76,100.0,3.3910945012580387e-06,1000.0,0.00088057504374508,1,4,adam,"{'neurons_per_layer_encoder': [76, 152, 304, 608], 'neurons_per_layer_decoder': [608]}",76.0,[608],"[76, 152, 304, 608]",[0.4580775487232238],[0.3302764529193606],-0.27069435297721506,COMPLETE
285,0.5946231413492035,0.28592039149009485,2024-12-23 11:28:24.060050,2024-12-23 11:28:34.115361,0 days 00:00:10.055311,0.021806274898248514,40.0,0.2,88,100.0,3.4569740163064306e-06,1000.0,0.0006572039891443697,1,4,adam,"{'neurons_per_layer_encoder': [88, 176, 352, 704], 'neurons_per_layer_decoder': [704]}",88.0,[704],"[88, 176, 352, 704]",[0.5946231413492035],[0.28592039149009485],-0.06004642793231096,COMPLETE
286,0.5641936285906465,0.2207420527727444,2024-12-23 11:28:25.426364,2024-12-23 11:28:35.791816,0 days 00:00:10.365452,0.02170732577524123,40.0,0.2,88,100.0,3.3904685014881743e-06,1144.0,0.0006178844089749622,1,4,adam,"{'neurons_per_layer_encoder': [88, 176, 352, 704], 'neurons_per_layer_decoder': [704]}",88.0,[704],"[88, 176, 352, 704]",[0.5641936285906465],[0.2207420527727444],-0.10364041034386208,COMPLETE
287,0.49935244488526864,0.3723893911032814,2024-12-23 11:28:26.164325,2024-12-23 11:28:36.407546,0 days 00:00:10.243221,0.021826517165479696,40.0,0.2,88,100.0,2.1339317077688805e-06,1128.0,0.0006868508728776153,1,4,adam,"{'neurons_per_layer_encoder': [88, 176, 352, 704], 'neurons_per_layer_decoder': [704]}",88.0,[704],"[88, 176, 352, 704]",[0.49935244488526864],[0.3723893911032814],-0.14021988370739744,COMPLETE
288,0.375048080352836,0.12997166698539142,2024-12-23 11:28:27.809869,2024-12-23 11:28:36.836281,0 days 00:00:09.026412,0.022062271768526022,40.0,0.2,84,100.0,2.1412168511146863e-06,1160.0,0.0006707235252038222,1,4,adam,"{'neurons_per_layer_encoder': [84, 168, 336, 672], 'neurons_per_layer_decoder': [672]}",84.0,[672],"[84, 168, 336, 672]",[0.375048080352836],[0.12997166698539142],-0.49949817699687005,COMPLETE
289,0.6314147297942587,0.4734355320685584,2024-12-23 11:28:28.820932,2024-12-23 11:28:38.448476,0 days 00:00:09.627544,0.017462640650593338,40.0,0.2,84,100.0,2.1373579534157038e-06,968.0,0.0006127699482306038,1,4,adam,"{'neurons_per_layer_encoder': [84, 168, 336, 672], 'neurons_per_layer_decoder': [672]}",84.0,[672],"[84, 168, 336, 672]",[0.6314147297942587],[0.4734355320685584],0.03608270804775753,COMPLETE
290,0.27420417668871244,-0.023455013599700925,2024-12-23 11:28:29.715857,2024-12-23 11:28:36.539182,0 days 00:00:06.823325,0.022118306964922462,40.0,0.2,88,100.0,2.1252679061227385e-06,1128.0,0.0006558936831408561,1,4,adam,"{'neurons_per_layer_encoder': [88, 176, 352, 704], 'neurons_per_layer_decoder': [704]}",88.0,[704],"[88, 176, 352, 704]",[0.27420417668871244],[-0.023455013599700925],-0.5853466890216774,COMPLETE
291,0.6923075946117616,0.30785841242764045,2024-12-23 11:28:34.125342,2024-12-23 11:28:41.760232,0 days 00:00:07.634890,0.017616250655038704,40.0,0.2,84,100.0,2.1145996396912603e-06,968.0,0.0006509009341584254,1,4,adam,"{'neurons_per_layer_encoder': [84, 168, 336, 672], 'neurons_per_layer_decoder': [672]}",84.0,[672],"[84, 168, 336, 672]",[0.6923075946117616],[0.30785841242764045],-0.1391020427943528,COMPLETE
292,0.6123817980832917,0.3788277385299521,2024-12-23 11:28:35.799254,2024-12-23 11:28:39.266780,0 days 00:00:03.467526,0.019658948889503855,40.0,0.2,84,100.0,2.765730924349022e-06,188.0,0.0006630349356145363,1,1,adam,"{'neurons_per_layer_encoder': [84], 'neurons_per_layer_decoder': [84]}",84.0,[84],[84],[0.6123817980832917],[0.3788277385299521],-0.4305800354159693,COMPLETE
293,0.5688136456071557,0.3355487263644661,2024-12-23 11:28:36.415387,2024-12-23 11:28:39.925733,0 days 00:00:03.510346,0.019414146060798262,40.0,0.2,84,100.0,2.752858338401441e-06,188.0,0.0010544253318033557,1,1,adam,"{'neurons_per_layer_encoder': [84], 'neurons_per_layer_decoder': [84]}",84.0,[84],[84],[0.5688136456071557],[0.3355487263644661],-0.696847662682115,COMPLETE
294,0.6398923923884732,0.5126928912182876,2024-12-23 11:28:36.547990,2024-12-23 11:28:39.716107,0 days 00:00:03.168117,0.019655891096952077,40.0,0.2,72,100.0,2.778316760039252e-06,159.0,0.0010630563070280995,1,1,adam,"{'neurons_per_layer_encoder': [72], 'neurons_per_layer_decoder': [72]}",72.0,[72],[72],[0.6398923923884732],[0.5126928912182876],-0.29168756988290667,COMPLETE
295,0.6362246871155492,0.3640645603432293,2024-12-23 11:28:36.844590,2024-12-23 11:28:40.042290,0 days 00:00:03.197700,0.018067858275401385,40.0,0.2,68,100.0,2.780656731798179e-06,90.0,0.0010748332496595295,1,1,adam,"{'neurons_per_layer_encoder': [68], 'neurons_per_layer_decoder': [68]}",68.0,[68],[68],[0.6362246871155492],[0.3640645603432293],-0.5454861195501668,COMPLETE
296,0.5914902082078296,0.47525830841228145,2024-12-23 11:28:38.456342,2024-12-23 11:28:41.478132,0 days 00:00:03.021790,0.017757487325090814,40.0,0.2,68,100.0,2.7495130075875228e-06,90.0,0.0005982049862706863,1,1,adam,"{'neurons_per_layer_encoder': [68], 'neurons_per_layer_decoder': [68]}",68.0,[68],[68],[0.5914902082078296],[0.47525830841228145],-0.2163695689775344,COMPLETE
297,0.6597457712090222,0.42146041084710684,2024-12-23 11:28:39.273899,2024-12-23 11:28:42.671323,0 days 00:00:03.397424,0.017432642886911064,40.0,0.2,72,100.0,2.8392085631555962e-06,159.0,0.001031418634052844,1,1,adam,"{'neurons_per_layer_encoder': [72], 'neurons_per_layer_decoder': [72]}",72.0,[72],[72],[0.6597457712090222],[0.42146041084710684],-0.3667417966573386,COMPLETE
298,-0.09339983195589752,0.009146373339753544,2024-12-23 11:28:39.722821,2024-12-23 11:28:44.990550,0 days 00:00:05.267729,0.019870330408435156,80.0,0.2,68,100.0,2.853966730662622e-06,2024.0,0.0010560115317344505,1,5,adam,"{'neurons_per_layer_encoder': [68, 136, 272, 544, 1088], 'neurons_per_layer_decoder': [1088]}",68.0,[1088],"[68, 136, 272, 544, 1088]",[-0.09339983195589752],[0.009146373339753544],-0.5222062673406712,COMPLETE
299,0.1405563680660764,-0.005209429540435018,2024-12-23 11:28:39.933865,2024-12-23 11:28:49.104061,0 days 00:00:09.170196,0.02026180983569749,72.0,0.2,68,100.0,2.520413730446529e-06,1192.0,2.680796546914528e-05,1,5,adam,"{'neurons_per_layer_encoder': [68, 136, 272, 544, 1088], 'neurons_per_layer_decoder': [1088]}",68.0,[1088],"[68, 136, 272, 544, 1088]",[0.1405563680660764],[-0.005209429540435018],-0.13824366422188958,COMPLETE
300,0.15014180616508455,0.038560289555073624,2024-12-23 11:28:40.049060,2024-12-23 11:28:45.850411,0 days 00:00:05.801351,0.02337183646816756,72.0,0.2,72,100.0,2.450255798532811e-06,1224.0,0.0010695729831125204,1,5,adam,"{'neurons_per_layer_encoder': [72, 144, 288, 576, 1152], 'neurons_per_layer_decoder': [1152]}",72.0,[1152],"[72, 144, 288, 576, 1152]",[0.15014180616508455],[0.038560289555073624],-0.5940285258062538,COMPLETE
301,0.11681753451359622,0.04569737965411025,2024-12-23 11:28:41.485075,2024-12-23 11:28:50.979399,0 days 00:00:09.494324,0.023026102944985617,80.0,0.2,72,100.0,2.3539533582015437e-06,1208.0,2.754954994740207e-05,1,5,adam,"{'neurons_per_layer_encoder': [72, 144, 288, 576, 1152], 'neurons_per_layer_decoder': [1152]}",72.0,[1152],"[72, 144, 288, 576, 1152]",[0.11681753451359622],[0.04569737965411025],-0.004176661290703312,COMPLETE
302,0.29112720928132074,0.1694899294436355,2024-12-23 11:28:41.768865,2024-12-23 11:28:50.995835,0 days 00:00:09.226970,0.023324359142292334,88.0,0.2,72,100.0,2.3005412588466177e-06,1240.0,0.0009325948668602391,1,5,adam,"{'neurons_per_layer_encoder': [72, 144, 288, 576, 1152], 'neurons_per_layer_decoder': [1152]}",72.0,[1152],"[72, 144, 288, 576, 1152]",[0.29112720928132074],[0.1694899294436355],-0.6928751389570954,COMPLETE
303,0.44318406671109256,0.2447632472105531,2024-12-23 11:28:42.678041,2024-12-23 11:28:47.256435,0 days 00:00:04.578394,0.023291563618540304,80.0,0.2,72,100.0,2.360921265127952e-06,159.0,0.0010919567983643016,1,1,adam,"{'neurons_per_layer_encoder': [72], 'neurons_per_layer_decoder': [72]}",72.0,[72],[72],[0.44318406671109256],[0.2447632472105531],-1.148409449152172,COMPLETE
304,0.2769464940508536,-0.12852948871801062,2024-12-23 11:28:44.999869,2024-12-23 11:28:49.322629,0 days 00:00:04.322760,0.023152879883289776,88.0,0.2,72,100.0,2.1456796822408892e-06,159.0,2.566753254552456e-05,1,1,adam,"{'neurons_per_layer_encoder': [72], 'neurons_per_layer_decoder': [72]}",72.0,[72],[72],[0.2769464940508536],[-0.12852948871801062],-0.14348437031562358,COMPLETE
305,0.37125321669481337,0.12004817520065536,2024-12-23 11:28:45.858121,2024-12-23 11:28:49.975024,0 days 00:00:04.116903,0.02292426562862632,80.0,0.2,72,100.0,2.269972776503135e-06,159.0,0.0009544939338609246,1,1,adam,"{'neurons_per_layer_encoder': [72], 'neurons_per_layer_decoder': [72]}",72.0,[72],[72],[0.37125321669481337],[0.12004817520065536],-1.6036395557154586,COMPLETE
306,0.40637376099151723,0.3039900186417911,2024-12-23 11:28:47.263216,2024-12-23 11:28:51.034814,0 days 00:00:03.771598,0.09757920385462096,88.0,0.2,80,100.0,2.2498989953485063e-06,168.0,0.0005407145862303117,1,1,adam,"{'neurons_per_layer_encoder': [80], 'neurons_per_layer_decoder': [80]}",80.0,[80],[80],[0.40637376099151723],[0.3039900186417911],-0.8808354463034432,COMPLETE
307,0.41612446027559136,0.14742273669098993,2024-12-23 11:28:49.113813,2024-12-23 11:28:52.171215,0 days 00:00:03.057402,0.10033925272932101,88.0,0.2,80,100.0,2.0218271814815942e-06,120.0,0.0012912552206388356,1,1,adam,"{'neurons_per_layer_encoder': [80], 'neurons_per_layer_decoder': [80]}",80.0,[80],[80],[0.41612446027559136],[0.14742273669098993],-1.347058433992805,COMPLETE
308,0.5454330093005056,0.35117764116122985,2024-12-23 11:28:49.329522,2024-12-23 11:28:52.379318,0 days 00:00:03.049796,0.02284914504112905,56.0,0.2,80,100.0,1.2674738342363608e-06,120.0,0.0012971667006107183,1,1,adam,"{'neurons_per_layer_encoder': [80], 'neurons_per_layer_decoder': [80]}",80.0,[80],[80],[0.5454330093005056],[0.35117764116122985],-0.7874368833951451,COMPLETE
309,-1.2411712804049877,0.10752357995644202,2024-12-23 11:28:49.982649,2024-12-23 11:28:51.646295,0 days 00:00:01.663646,0.02045824639412185,56.0,0.2,80,100.0,1.3134442714715002e-06,120.0,1.8302544890741992e-05,1,1,adam,"{'neurons_per_layer_encoder': [80], 'neurons_per_layer_decoder': [80]}",80.0,[80],[80],[-1.2411712804049877],[0.10752357995644202],0.16410823639755048,COMPLETE
310,0.22302760370459418,-0.04561266940692699,2024-12-23 11:28:50.988261,2024-12-23 11:28:53.674372,0 days 00:00:02.686111,0.018869235015447915,120.0,0.2,80,100.0,1.2203092195528742e-06,120.0,3.901472809854268e-05,1,1,adam,"{'neurons_per_layer_encoder': [80], 'neurons_per_layer_decoder': [80]}",80.0,[80],[80],[0.22302760370459418],[-0.04561266940692699],0.020312014812584423,COMPLETE
311,0.3216093393367859,0.09506133409921569,2024-12-23 11:28:51.011359,2024-12-23 11:28:53.678438,0 days 00:00:02.667079,0.019997086039308557,120.0,0.2,80,100.0,0.0009144071067103665,120.0,0.0012852867965295718,1,1,adam,"{'neurons_per_layer_encoder': [80], 'neurons_per_layer_decoder': [80]}",80.0,[80],[80],[0.3216093393367859],[0.09506133409921569],0.5419243373284838,COMPLETE
312,0.4488122208336802,0.0946724908728922,2024-12-23 11:28:51.048566,2024-12-23 11:28:53.734845,0 days 00:00:02.686279,0.01875373776781053,96.0,0.2,60,100.0,1.338157307093827e-06,82.0,0.0012662032891113263,1,1,adam,"{'neurons_per_layer_encoder': [60], 'neurons_per_layer_decoder': [60]}",60.0,[60],[60],[0.4488122208336802],[0.0946724908728922],-1.4154812021859238,COMPLETE
