number,values_0,values_1,datetime_start,datetime_complete,duration,params_alpha,params_batch_size,params_drop_out_rate,params_encoder_neurons_layer_1,params_epochs,params_lambda,params_latent_dim,params_learning_rate,params_num_layers_decoder,params_num_layers_encoder,params_optimizer,user_attrs_encoder_decoder_config,user_attrs_first_layer_neurons,user_attrs_neurons_per_layer_decoder,user_attrs_neurons_per_layer_encoder,user_attrs_r2_feature_1,user_attrs_r2_feature_2,user_attrs_relative_deterioration,state
470,-0.25265567682681644,0.03485307820670047,2024-12-23 11:34:58.116090,2024-12-23 11:35:02.486884,0 days 00:00:04.370794,0.03116483669670735,80.0,0.1,88,100.0,0.00025089456853909074,648.0,0.00015718711960705637,5,3,sgd,"{'neurons_per_layer_encoder': [88, 176, 352], 'neurons_per_layer_decoder': [352, 176, 88, 44, 22]}",88.0,"[352, 176, 88, 44, 22]","[88, 176, 352]",[-0.25265567682681644],[0.03485307820670047],0.8770988453181484,COMPLETE
471,-1.124066397394102,-0.045788163145620286,2024-12-23 11:34:58.896379,2024-12-23 11:35:02.483132,0 days 00:00:03.586753,0.0247014673162258,88.0,0.1,88,100.0,0.00023689386602340247,616.0,0.00013510151408310922,5,3,adadelta,"{'neurons_per_layer_encoder': [88, 176, 352], 'neurons_per_layer_decoder': [352, 176, 88, 44, 22]}",88.0,"[352, 176, 88, 44, 22]","[88, 176, 352]",[-1.124066397394102],[-0.045788163145620286],0.8244545528681919,COMPLETE
472,-0.17604163413447638,0.16301222849628216,2024-12-23 11:34:59.224906,2024-12-23 11:35:07.003422,0 days 00:00:07.778516,0.024353978302674602,96.0,0.1,164,100.0,0.00019884580069524428,984.0,0.00014392289351317797,5,3,adadelta,"{'neurons_per_layer_encoder': [164, 328, 656], 'neurons_per_layer_decoder': [656, 328, 164, 82, 41]}",164.0,"[656, 328, 164, 82, 41]","[164, 328, 656]",[-0.17604163413447638],[0.16301222849628216],0.915561592994816,COMPLETE
473,-0.7962553031163369,-0.05599034255629154,2024-12-23 11:34:59.561735,2024-12-23 11:35:03.443734,0 days 00:00:03.881999,0.02379199944942602,80.0,0.1,180,100.0,0.00013316353114521865,1304.0,0.00014891890196330968,4,3,adadelta,"{'neurons_per_layer_encoder': [180, 360, 720], 'neurons_per_layer_decoder': [720, 360, 180, 90]}",180.0,"[720, 360, 180, 90]","[180, 360, 720]",[-0.7962553031163369],[-0.05599034255629154],0.8464673100960614,COMPLETE
474,-0.8053817509315462,-0.580661423640054,2024-12-23 11:34:59.611212,2024-12-23 11:35:03.852576,0 days 00:00:04.241364,0.024719463797289218,96.0,0.1,216,100.0,0.00012363845643055212,1288.0,0.00014170059010136968,4,3,adadelta,"{'neurons_per_layer_encoder': [216, 432, 864], 'neurons_per_layer_decoder': [864, 432, 216, 108]}",216.0,"[864, 432, 216, 108]","[216, 432, 864]",[-0.8053817509315462],[-0.580661423640054],0.8368090197348669,COMPLETE
475,-0.09685449768598398,-0.09283044121237793,2024-12-23 11:34:59.934422,2024-12-23 11:35:07.710710,0 days 00:00:07.776288,0.0240709214623376,72.0,0.1,164,100.0,0.0001831263036584804,824.0,0.0001671621674002308,4,3,adadelta,"{'neurons_per_layer_encoder': [164, 328, 656], 'neurons_per_layer_decoder': [656, 328, 164, 82]}",164.0,"[656, 328, 164, 82]","[164, 328, 656]",[-0.09685449768598398],[-0.09283044121237793],0.8974560750441878,COMPLETE
476,-0.7843420174428477,-0.13937930487349592,2024-12-23 11:35:02.493241,2024-12-23 11:35:07.565459,0 days 00:00:05.072218,0.023791287836255347,72.0,0.1,84,100.0,0.00020809583194546932,776.0,0.00012202432698308973,4,3,adadelta,"{'neurons_per_layer_encoder': [84, 168, 336], 'neurons_per_layer_decoder': [336, 168, 84, 42]}",84.0,"[336, 168, 84, 42]","[84, 168, 336]",[-0.7843420174428477],[-0.13937930487349592],0.8338888225181031,COMPLETE
477,-0.2631842579362744,-0.3375127215274545,2024-12-23 11:35:02.499000,2024-12-23 11:35:07.263618,0 days 00:00:04.764618,0.024360853334308475,40.0,0.1,48,100.0,0.0002075685357695084,376.0,0.0001643171902673061,4,3,adadelta,"{'neurons_per_layer_encoder': [48, 96, 192], 'neurons_per_layer_decoder': [192, 96, 48, 24]}",48.0,"[192, 96, 48, 24]","[48, 96, 192]",[-0.2631842579362744],[-0.3375127215274545],0.7426947374432585,COMPLETE
478,-0.31154149826627453,-0.30783555396350715,2024-12-23 11:35:03.454408,2024-12-23 11:35:08.159481,0 days 00:00:04.705073,0.023764669250952403,96.0,0.1,48,100.0,0.00019431851626107248,344.0,0.00016794352117353116,4,3,adadelta,"{'neurons_per_layer_encoder': [48, 96, 192], 'neurons_per_layer_decoder': [192, 96, 48, 24]}",48.0,"[192, 96, 48, 24]","[48, 96, 192]",[-0.31154149826627453],[-0.30783555396350715],0.7318093074687405,COMPLETE
479,0.4366042240557486,0.4373020263650046,2024-12-23 11:35:03.860435,2024-12-23 11:35:12.801520,0 days 00:00:08.941085,0.027746192583455183,40.0,0.1,148,100.0,0.00020770943080066393,808.0,0.0001709963609246692,4,3,adam,"{'neurons_per_layer_encoder': [148, 296, 592], 'neurons_per_layer_decoder': [592, 296, 148, 74]}",148.0,"[592, 296, 148, 74]","[148, 296, 592]",[0.4366042240557486],[0.4373020263650046],0.9411347667859081,COMPLETE
480,0.35152732575010015,0.11083100302224036,2024-12-23 11:35:07.012852,2024-12-23 11:35:16.126665,0 days 00:00:09.113813,0.02788873447392248,40.0,0.1,152,100.0,6.444659543585103e-05,792.0,0.00017251043401389645,4,3,adam,"{'neurons_per_layer_encoder': [152, 304, 608], 'neurons_per_layer_decoder': [608, 304, 152, 76]}",152.0,"[608, 304, 152, 76]","[152, 304, 608]",[0.35152732575010015],[0.11083100302224036],0.7681350493432006,COMPLETE
481,0.24759987793421057,0.1386529617197374,2024-12-23 11:35:07.273359,2024-12-23 11:35:15.166438,0 days 00:00:07.893079,0.028143839399657027,48.0,0.1,92,100.0,6.981749722371843e-05,712.0,0.00011913097882008314,4,3,adam,"{'neurons_per_layer_encoder': [92, 184, 368], 'neurons_per_layer_decoder': [368, 184, 92, 46]}",92.0,"[368, 184, 92, 46]","[92, 184, 368]",[0.24759987793421057],[0.1386529617197374],0.6738521222552838,COMPLETE
482,0.16113133213007935,0.42371299732677037,2024-12-23 11:35:07.573385,2024-12-23 11:35:13.416172,0 days 00:00:05.842787,0.15708959642720083,48.0,0.1,24,100.0,4.32002770560095e-05,200.0,0.00017816300488635058,4,3,adam,"{'neurons_per_layer_encoder': [24, 48, 96], 'neurons_per_layer_decoder': [96, 48, 24, 12]}",24.0,"[96, 48, 24, 12]","[24, 48, 96]",[0.16113133213007935],[0.42371299732677037],0.23938410773345262,COMPLETE
483,0.4538289739154606,0.24894150315359687,2024-12-23 11:35:07.724845,2024-12-23 11:35:17.582199,0 days 00:00:09.857354,0.02782342819330884,40.0,0.4,172,100.0,7.412255686202773e-05,952.0,0.0001786673936899791,4,3,adam,"{'neurons_per_layer_encoder': [172, 344, 688], 'neurons_per_layer_decoder': [688, 344, 172, 86]}",172.0,"[688, 344, 172, 86]","[172, 344, 688]",[0.4538289739154606],[0.24894150315359687],0.8704678513782156,COMPLETE
484,0.3810268279708182,0.23775392578056287,2024-12-23 11:35:08.166147,2024-12-23 11:35:17.168783,0 days 00:00:09.002636,0.022989314622028634,48.0,0.4,140,100.0,5.870231694707033e-05,920.0,0.00023257529121806139,5,3,adam,"{'neurons_per_layer_encoder': [140, 280, 560], 'neurons_per_layer_decoder': [560, 280, 140, 70, 35]}",140.0,"[560, 280, 140, 70, 35]","[140, 280, 560]",[0.3810268279708182],[0.23775392578056287],0.8044631140544325,COMPLETE
485,-0.014130667356980542,0.02492492525969514,2024-12-23 11:35:12.809967,2024-12-23 11:35:20.929938,0 days 00:00:08.119971,0.026752531167164206,48.0,0.4,84,100.0,4.560716855289198e-05,600.0,0.00033146137750684806,5,3,adam,"{'neurons_per_layer_encoder': [84, 168, 336], 'neurons_per_layer_decoder': [336, 168, 84, 42, 21]}",84.0,"[336, 168, 84, 42, 21]","[84, 168, 336]",[-0.014130667356980542],[0.02492492525969514],0.5384532226077279,COMPLETE
486,-0.3984597283695037,-0.1652694717860963,2024-12-23 11:35:13.423995,2024-12-23 11:35:21.701511,0 days 00:00:08.277516,0.09646466487474395,40.0,0.4,92,100.0,0.00030586458089169736,696.0,9.794804609244146e-05,5,3,adam,"{'neurons_per_layer_encoder': [92, 184, 368], 'neurons_per_layer_decoder': [368, 184, 92, 46, 23]}",92.0,"[368, 184, 92, 46, 23]","[92, 184, 368]",[-0.3984597283695037],[-0.1652694717860963],0.8815891791168267,COMPLETE
487,0.6265836957494041,0.3073400076136199,2024-12-23 11:35:15.176504,2024-12-23 11:35:26.158971,0 days 00:00:10.982467,0.17919093701129044,40.0,0.4,172,100.0,0.00030115289533544365,1560.0,0.00032091875295534814,5,3,adam,"{'neurons_per_layer_encoder': [172, 344, 688], 'neurons_per_layer_decoder': [688, 344, 172, 86, 43]}",172.0,"[688, 344, 172, 86, 43]","[172, 344, 688]",[0.6265836957494041],[0.3073400076136199],0.9682258805766297,COMPLETE
488,0.5241222073821338,0.2338574566471372,2024-12-23 11:35:16.135146,2024-12-23 11:35:28.258501,0 days 00:00:12.123355,0.02288671717211751,40.0,0.4,172,100.0,0.0001541015804007467,1560.0,0.00026003089265080117,5,3,adam,"{'neurons_per_layer_encoder': [172, 344, 688], 'neurons_per_layer_decoder': [688, 344, 172, 86, 43]}",172.0,"[688, 344, 172, 86, 43]","[172, 344, 688]",[0.5241222073821338],[0.2338574566471372],0.9361256751134788,COMPLETE
489,-0.8803446553156526,-0.04076757095771044,2024-12-23 11:35:17.177004,2024-12-23 11:35:21.837356,0 days 00:00:04.660352,0.022803237761783023,40.0,0.4,4,100.0,0.0003799829051851786,17.0,0.0001012398801065866,5,3,adam,"{'neurons_per_layer_encoder': [4, 8, 16], 'neurons_per_layer_decoder': [16, 8, 8, 8, 8]}",4.0,"[16, 8, 8, 8, 8]","[4, 8, 16]",[-0.8803446553156526],[-0.04076757095771044],0.47749586189655924,COMPLETE
490,0.7605472798719246,0.28228675649599233,2024-12-23 11:35:17.589599,2024-12-23 11:35:24.967454,0 days 00:00:07.377855,0.026003532757777125,40.0,0.30000000000000004,84,100.0,0.00012665231175901847,600.0,0.0003224019447658899,2,3,adam,"{'neurons_per_layer_encoder': [84, 168, 336], 'neurons_per_layer_decoder': [336, 168]}",84.0,"[336, 168]","[84, 168, 336]",[0.7605472798719246],[0.28228675649599233],0.8625351799466727,COMPLETE
491,-0.2849187909178672,-0.282291400275577,2024-12-23 11:35:20.939862,2024-12-23 11:35:25.665017,0 days 00:00:04.725155,0.022480682893541444,40.0,0.30000000000000004,8,100.0,0.00029608970119698294,51.0,9.343574664732943e-05,2,3,adam,"{'neurons_per_layer_encoder': [8, 16, 32], 'neurons_per_layer_decoder': [32, 16]}",8.0,"[32, 16]","[8, 16, 32]",[-0.2849187909178672],[-0.282291400275577],0.3378436727834402,COMPLETE
492,0.5451132960934859,0.23116983732326668,2024-12-23 11:35:21.710150,2024-12-23 11:35:29.165879,0 days 00:00:07.455729,0.07784012168303447,40.0,0.30000000000000004,84,100.0,0.00035430112088115085,744.0,0.00026109892840957586,2,3,adam,"{'neurons_per_layer_encoder': [84, 168, 336], 'neurons_per_layer_decoder': [336, 168]}",84.0,"[336, 168]","[84, 168, 336]",[0.5451132960934859],[0.23116983732326668],0.9245396616319197,COMPLETE
493,0.3813706317399549,0.13579158265508529,2024-12-23 11:35:21.845420,2024-12-23 11:35:36.026219,0 days 00:00:14.180799,0.1998164665204499,40.0,0.30000000000000004,248,100.0,9.093915180782219e-05,1768.0,0.00033880438830737535,5,3,adam,"{'neurons_per_layer_encoder': [248, 496, 992], 'neurons_per_layer_decoder': [992, 496, 248, 124, 62]}",248.0,"[992, 496, 248, 124, 62]","[248, 496, 992]",[0.3813706317399549],[0.13579158265508529],0.9023317759977967,COMPLETE
494,0.5967163542364344,0.38151298147232415,2024-12-23 11:35:24.976379,2024-12-23 11:35:34.044321,0 days 00:00:09.067942,0.029560631112046674,40.0,0.1,88,100.0,0.00015641659127305655,744.0,0.0003342201511522796,3,3,adam,"{'neurons_per_layer_encoder': [88, 176, 352], 'neurons_per_layer_decoder': [352, 176, 88]}",88.0,"[352, 176, 88]","[88, 176, 352]",[0.5967163542364344],[0.38151298147232415],0.8787748149519555,COMPLETE
495,0.6114299974576236,0.5689010364569853,2024-12-23 11:35:25.673545,2024-12-23 11:35:34.014144,0 days 00:00:08.340599,0.026038824706233414,40.0,0.1,92,100.0,0.0001560548992994435,744.0,0.00035522505140699154,2,3,adam,"{'neurons_per_layer_encoder': [92, 184, 368], 'neurons_per_layer_decoder': [368, 184]}",92.0,"[368, 184]","[92, 184, 368]",[0.6114299974576236],[0.5689010364569853],0.8931370115690621,COMPLETE
496,0.47080077262677,0.43372078230852573,2024-12-23 11:35:26.167167,2024-12-23 11:35:34.398287,0 days 00:00:08.231120,0.026354808400316822,40.0,0.1,92,100.0,0.00014531425079483643,744.0,0.00024466742875044466,2,3,adam,"{'neurons_per_layer_encoder': [92, 184, 368], 'neurons_per_layer_decoder': [368, 184]}",92.0,"[368, 184]","[92, 184, 368]",[0.47080077262677],[0.43372078230852573],0.8558916661392503,COMPLETE
497,0.36275213382438853,0.3461878679077778,2024-12-23 11:35:28.268583,2024-12-23 11:35:36.303401,0 days 00:00:08.034818,0.029336970945277388,40.0,0.1,92,100.0,0.00014047245197986125,744.0,0.00030816673911330665,2,3,adam,"{'neurons_per_layer_encoder': [92, 184, 368], 'neurons_per_layer_decoder': [368, 184]}",92.0,"[368, 184]","[92, 184, 368]",[0.36275213382438853],[0.3461878679077778],0.8233580716886009,COMPLETE
498,0.33006730272451057,0.34441405659062774,2024-12-23 11:35:29.176194,2024-12-23 11:35:37.322836,0 days 00:00:08.146642,0.029839011753964063,40.0,0.1,92,100.0,0.00014569558010235425,680.0,0.0002386259830000177,2,3,adam,"{'neurons_per_layer_encoder': [92, 184, 368], 'neurons_per_layer_decoder': [368, 184]}",92.0,"[368, 184]","[92, 184, 368]",[0.33006730272451057],[0.34441405659062774],0.8285261016564425,COMPLETE
499,0.5027499935964649,0.3822235770201179,2024-12-23 11:35:34.022817,2024-12-23 11:35:40.927338,0 days 00:00:06.904521,0.02616681600872162,40.0,0.1,92,100.0,0.0001277198684038146,760.0,0.0003478126980160484,2,3,adam,"{'neurons_per_layer_encoder': [92, 184, 368], 'neurons_per_layer_decoder': [368, 184]}",92.0,"[368, 184]","[92, 184, 368]",[0.5027499935964649],[0.3822235770201179],0.8335308797034936,COMPLETE
500,0.5520521127664451,0.31639137354082836,2024-12-23 11:35:34.054173,2024-12-23 11:35:41.557166,0 days 00:00:07.502993,0.02608820879381696,40.0,0.1,92,100.0,0.00013931429991482055,680.0,0.0003695957338824409,2,3,adam,"{'neurons_per_layer_encoder': [92, 184, 368], 'neurons_per_layer_decoder': [368, 184]}",92.0,"[368, 184]","[92, 184, 368]",[0.5520521127664451],[0.31639137354082836],0.8363915041348791,COMPLETE
501,0.396096974178626,0.4881595208319165,2024-12-23 11:35:34.406562,2024-12-23 11:35:41.618918,0 days 00:00:07.212356,0.04418339659297931,40.0,0.1,96,100.0,0.00012534271269921244,696.0,0.00035327470368148303,2,3,adam,"{'neurons_per_layer_encoder': [96, 192, 384], 'neurons_per_layer_decoder': [384, 192]}",96.0,"[384, 192]","[96, 192, 384]",[0.396096974178626],[0.4881595208319165],0.8311736852911309,COMPLETE
502,0.28975457146604966,0.5795440899486355,2024-12-23 11:35:36.036712,2024-12-23 11:35:43.273345,0 days 00:00:07.236633,0.026191807541492175,40.0,0.1,96,100.0,0.00012891772845473687,712.0,0.000356101392965305,2,3,adam,"{'neurons_per_layer_encoder': [96, 192, 384], 'neurons_per_layer_decoder': [384, 192]}",96.0,"[384, 192]","[96, 192, 384]",[0.28975457146604966],[0.5795440899486355],0.8342132589431638,COMPLETE
503,0.35721497063109353,0.5183133878570602,2024-12-23 11:35:36.312402,2024-12-23 11:35:43.425046,0 days 00:00:07.112644,0.02566274563943049,40.0,0.1,108,100.0,0.000121602156213731,536.0,0.0003471917659514834,2,3,adam,"{'neurons_per_layer_encoder': [108, 216, 432], 'neurons_per_layer_decoder': [432, 216]}",108.0,"[432, 216]","[108, 216, 432]",[0.35721497063109353],[0.5183133878570602],0.8359364499664432,COMPLETE
504,0.5298408307283882,0.40064918291568385,2024-12-23 11:35:37.330538,2024-12-23 11:35:43.767772,0 days 00:00:06.437234,0.0260157322748488,40.0,0.1,84,100.0,0.00012946415161793753,632.0,0.00036718962960976344,2,3,adam,"{'neurons_per_layer_encoder': [84, 168, 336], 'neurons_per_layer_decoder': [336, 168]}",84.0,"[336, 168]","[84, 168, 336]",[0.5298408307283882],[0.40064918291568385],0.824220498575249,COMPLETE
505,0.5776660174939382,0.27452609652455906,2024-12-23 11:35:40.935563,2024-12-23 11:35:47.189164,0 days 00:00:06.253601,0.04420634148740451,40.0,0.1,84,100.0,0.00012071407982959508,632.0,0.0003620986320109111,2,3,adam,"{'neurons_per_layer_encoder': [84, 168, 336], 'neurons_per_layer_decoder': [336, 168]}",84.0,"[336, 168]","[84, 168, 336]",[0.5776660174939382],[0.27452609652455906],0.798812519882041,COMPLETE
506,0.6348465123458038,0.17290052904597408,2024-12-23 11:35:41.564367,2024-12-23 11:35:47.892614,0 days 00:00:06.328247,0.025816330041284634,40.0,0.1,84,100.0,0.0001224483165789275,632.0,0.0002837999059776885,2,3,adam,"{'neurons_per_layer_encoder': [84, 168, 336], 'neurons_per_layer_decoder': [336, 168]}",84.0,"[336, 168]","[84, 168, 336]",[0.6348465123458038],[0.17290052904597408],0.7999679941833336,COMPLETE
507,0.45435335731861737,0.6001944375568593,2024-12-23 11:35:41.629437,2024-12-23 11:35:47.856821,0 days 00:00:06.227384,0.025725055381654302,40.0,0.1,84,100.0,0.00016563513981848255,552.0,0.00021883300673950862,2,3,adam,"{'neurons_per_layer_encoder': [84, 168, 336], 'neurons_per_layer_decoder': [336, 168]}",84.0,"[336, 168]","[84, 168, 336]",[0.45435335731861737],[0.6001944375568593],0.8789451527297606,COMPLETE
508,0.41464297400865313,0.39107899111108946,2024-12-23 11:35:43.281471,2024-12-23 11:35:50.131756,0 days 00:00:06.850285,0.02624333267625841,40.0,0.1,84,100.0,0.00017098825706041273,552.0,7.446695407161956e-05,3,3,adam,"{'neurons_per_layer_encoder': [84, 168, 336], 'neurons_per_layer_decoder': [336, 168, 84]}",84.0,"[336, 168, 84]","[84, 168, 336]",[0.41464297400865313],[0.39107899111108946],0.8757448183593914,COMPLETE
509,0.5682679011809917,0.29310544825014584,2024-12-23 11:35:43.433231,2024-12-23 11:35:49.704862,0 days 00:00:06.271631,0.026783741365581527,40.0,0.1,84,100.0,0.00010934349651829086,552.0,0.00028965566000010653,3,3,adam,"{'neurons_per_layer_encoder': [84, 168, 336], 'neurons_per_layer_decoder': [336, 168, 84]}",84.0,"[336, 168, 84]","[84, 168, 336]",[0.5682679011809917],[0.29310544825014584],0.8109901804371255,COMPLETE
510,0.4377182702925122,0.14007965000056877,2024-12-23 11:35:43.775446,2024-12-23 11:35:49.763740,0 days 00:00:05.988294,0.0869147211039861,48.0,0.1,84,100.0,0.0001713441986072826,664.0,0.0002052901943004078,3,3,adam,"{'neurons_per_layer_encoder': [84, 168, 336], 'neurons_per_layer_decoder': [336, 168, 84]}",84.0,"[336, 168, 84]","[84, 168, 336]",[0.4377182702925122],[0.14007965000056877],0.8358544756325288,COMPLETE
511,0.49667477429774765,0.2607594246800189,2024-12-23 11:35:47.197586,2024-12-23 11:35:53.598022,0 days 00:00:06.400436,0.024653793446153538,40.0,0.1,80,100.0,0.00016716138850787337,584.0,0.00021190575952132208,3,3,adam,"{'neurons_per_layer_encoder': [80, 160, 320], 'neurons_per_layer_decoder': [320, 160, 80]}",80.0,"[320, 160, 80]","[80, 160, 320]",[0.49667477429774765],[0.2607594246800189],0.8568777771802526,COMPLETE
512,0.2011346514511364,0.0742735944480093,2024-12-23 11:35:47.866426,2024-12-23 11:35:53.651048,0 days 00:00:05.784622,0.08674327013643521,48.0,0.1,80,100.0,0.0001736872417996952,584.0,0.0002218978423703601,2,3,adam,"{'neurons_per_layer_encoder': [80, 160, 320], 'neurons_per_layer_decoder': [320, 160]}",80.0,"[320, 160]","[80, 160, 320]",[0.2011346514511364],[0.0742735944480093],0.7702711681169345,COMPLETE
513,0.4441003981458612,0.29779872819837616,2024-12-23 11:35:47.902958,2024-12-23 11:35:53.520622,0 days 00:00:05.617664,0.02438886471131029,48.0,0.1,80,100.0,0.0001020691115468212,584.0,0.00020957296859227607,2,3,adam,"{'neurons_per_layer_encoder': [80, 160, 320], 'neurons_per_layer_decoder': [320, 160]}",80.0,"[320, 160]","[80, 160, 320]",[0.4441003981458612],[0.29779872819837616],0.7415187438417203,COMPLETE
514,0.5177609516914274,0.27808708287449435,2024-12-23 11:35:49.713728,2024-12-23 11:35:55.042500,0 days 00:00:05.328772,0.024531856576969657,56.0,0.1,80,100.0,0.00016644585634170475,584.0,0.00020645203460811881,2,3,adam,"{'neurons_per_layer_encoder': [80, 160, 320], 'neurons_per_layer_decoder': [320, 160]}",80.0,"[320, 160]","[80, 160, 320]",[0.5177609516914274],[0.27808708287449435],0.8385887928801471,COMPLETE
515,0.6787501763981968,0.5123057404039908,2024-12-23 11:35:49.772092,2024-12-23 11:35:54.341847,0 days 00:00:04.569755,0.024326626878298004,40.0,0.1,36,100.0,0.0001655991839641032,312.0,0.000229216965235741,2,3,adam,"{'neurons_per_layer_encoder': [36, 72, 144], 'neurons_per_layer_decoder': [144, 72]}",36.0,"[144, 72]","[36, 72, 144]",[0.6787501763981968],[0.5123057404039908],0.8000411010532804,COMPLETE
516,0.19308592824157733,0.03763226040644685,2024-12-23 11:35:50.139744,2024-12-23 11:35:55.014020,0 days 00:00:04.874276,0.02431926231180226,80.0,0.1,80,100.0,0.0001633132973653914,584.0,0.00021888102911670927,2,3,adam,"{'neurons_per_layer_encoder': [80, 160, 320], 'neurons_per_layer_decoder': [320, 160]}",80.0,"[320, 160]","[80, 160, 320]",[0.19308592824157733],[0.03763226040644685],0.7557674137610149,COMPLETE
517,0.5797020080656332,0.46667342416437907,2024-12-23 11:35:53.527159,2024-12-23 11:36:00.157682,0 days 00:00:06.630523,0.028432931625278327,40.0,0.1,80,100.0,0.0001539596953932866,616.0,0.00022665298799537246,2,3,adam,"{'neurons_per_layer_encoder': [80, 160, 320], 'neurons_per_layer_decoder': [320, 160]}",80.0,"[320, 160]","[80, 160, 320]",[0.5797020080656332],[0.46667342416437907],0.8672491200446056,COMPLETE
518,0.15422657042340226,0.12983550804368083,2024-12-23 11:35:53.604987,2024-12-23 11:35:58.715173,0 days 00:00:05.110186,0.028237509447988002,112.0,0.1,76,100.0,0.00015329386609478789,568.0,0.00022030476311088988,2,3,adam,"{'neurons_per_layer_encoder': [76, 152, 304], 'neurons_per_layer_decoder': [304, 152]}",76.0,"[304, 152]","[76, 152, 304]",[0.15422657042340226],[0.12983550804368083],0.7546624421965836,COMPLETE
519,-1.868845345948035,-0.11931950102022881,2024-12-23 11:35:53.659807,2024-12-23 11:35:55.106340,0 days 00:00:01.446533,0.02488142840581007,40.0,0.1,36,100.0,0.00010375129224089184,344.0,0.00018822090748367654,2,3,sgd,"{'neurons_per_layer_encoder': [36, 72, 144], 'neurons_per_layer_decoder': [144, 72]}",36.0,"[144, 72]","[36, 72, 144]",[-1.868845345948035],[-0.11931950102022881],0.3057801133953486,COMPLETE
