number,values_0,values_1,datetime_start,datetime_complete,duration,params_alpha,params_batch_size,params_drop_out_rate,params_encoder_neurons_layer_1,params_epochs,params_lambda,params_latent_dim,params_learning_rate,params_num_layers_decoder,params_num_layers_encoder,params_optimizer,user_attrs_encoder_decoder_config,user_attrs_first_layer_neurons,user_attrs_neurons_per_layer_decoder,user_attrs_neurons_per_layer_encoder,user_attrs_r2_feature_1,user_attrs_r2_feature_2,user_attrs_relative_deterioration,state
313,0.267189214662387,0.07684227557757717,2024-12-23 11:28:51.654667,2024-12-23 11:28:57.277333,0 days 00:00:05.622666,0.016874360252021672,96.0,0.2,80,100.0,1.9332202940796034e-06,1032.0,0.0011967353710510334,1,4,adam,"{'neurons_per_layer_encoder': [80, 160, 320, 640], 'neurons_per_layer_decoder': [640]}",80.0,[640],"[80, 160, 320, 640]",[0.267189214662387],[0.07684227557757717],-1.3624074294902773,COMPLETE
314,-0.053942415800340315,0.02315934461285485,2024-12-23 11:28:52.178389,2024-12-23 11:28:55.282787,0 days 00:00:03.104398,0.1615424708340748,64.0,0.2,80,100.0,1.6660891382489493e-06,968.0,0.0011978633496768222,1,4,adam,"{'neurons_per_layer_encoder': [80, 160, 320, 640], 'neurons_per_layer_decoder': [640]}",80.0,[640],"[80, 160, 320, 640]",[-0.053942415800340315],[0.02315934461285485],-1.0079489597847189,COMPLETE
315,0.0687708934507768,0.03582842113776641,2024-12-23 11:28:52.385823,2024-12-23 11:28:57.873548,0 days 00:00:05.487725,0.028199494549505252,96.0,0.2,60,100.0,1.5286783454364718e-06,808.0,0.0005792365759296014,1,4,adam,"{'neurons_per_layer_encoder': [60, 120, 240, 480], 'neurons_per_layer_decoder': [480]}",60.0,[480],"[60, 120, 240, 480]",[0.0687708934507768],[0.03582842113776641],-1.4171552194573112,COMPLETE
316,0.2939589307404876,-0.11272460625715852,2024-12-23 11:28:53.684838,2024-12-23 11:29:00.197347,0 days 00:00:06.512509,0.027936490502299877,96.0,0.2,52,100.0,1.6075407095757393e-06,824.0,0.0005253646463505543,1,4,adam,"{'neurons_per_layer_encoder': [52, 104, 208, 416], 'neurons_per_layer_decoder': [416]}",52.0,[416],"[52, 104, 208, 416]",[0.2939589307404876],[-0.11272460625715852],-0.777439650929133,COMPLETE
317,0.07314342702201426,-0.04088375195371019,2024-12-23 11:28:53.684910,2024-12-23 11:29:00.617227,0 days 00:00:06.932317,0.016384625464084732,64.0,0.2,212,100.0,1.6423737387785048e-06,1720.0,0.0007387935489549416,1,4,adam,"{'neurons_per_layer_encoder': [212, 424, 848, 1696], 'neurons_per_layer_decoder': [1696]}",212.0,[1696],"[212, 424, 848, 1696]",[0.07314342702201426],[-0.04088375195371019],-1.3897320643261546,COMPLETE
318,0.28125761697791474,-0.07686852056582971,2024-12-23 11:28:53.743332,2024-12-23 11:29:01.096730,0 days 00:00:07.353398,0.016722001212541904,64.0,0.2,92,100.0,1.5882327922035404e-06,1064.0,0.000725657259396081,1,4,adam,"{'neurons_per_layer_encoder': [92, 184, 368, 736], 'neurons_per_layer_decoder': [736]}",92.0,[736],"[92, 184, 368, 736]",[0.28125761697791474],[-0.07686852056582971],-1.6985699004441313,COMPLETE
319,0.5102421969237152,0.3596287681365441,2024-12-23 11:28:55.290669,2024-12-23 11:29:03.633475,0 days 00:00:08.342806,0.01674783832241132,32.0,0.2,60,100.0,2.9467657958450784e-06,888.0,0.005453702771271447,1,4,adam,"{'neurons_per_layer_encoder': [60, 120, 240, 480], 'neurons_per_layer_decoder': [480]}",60.0,[480],"[60, 120, 240, 480]",[0.5102421969237152],[0.3596287681365441],-0.5117092874151945,COMPLETE
320,0.1222204426147645,-0.17511511943609137,2024-12-23 11:28:57.285717,2024-12-23 11:29:03.628288,0 days 00:00:06.342571,0.02481395561723441,112.0,0.2,212,100.0,3.054718948195423e-06,1720.0,0.0007369721006664457,1,4,adam,"{'neurons_per_layer_encoder': [212, 424, 848, 1696], 'neurons_per_layer_decoder': [1696]}",212.0,[1696],"[212, 424, 848, 1696]",[0.1222204426147645],[-0.17511511943609137],-0.14191381070227935,COMPLETE
321,0.23557123236320143,0.0029661054320186953,2024-12-23 11:28:57.882898,2024-12-23 11:29:02.450658,0 days 00:00:04.567760,0.12505391288654708,64.0,0.2,176,100.0,4.367551317518161e-06,264.0,0.0007586215655586718,1,1,adam,"{'neurons_per_layer_encoder': [176], 'neurons_per_layer_decoder': [176]}",176.0,[176],[176],[0.23557123236320143],[0.0029661054320186953],-2.1177330368357525,COMPLETE
322,0.517805367419053,0.12396704835421846,2024-12-23 11:29:00.204371,2024-12-23 11:29:03.968812,0 days 00:00:03.764441,0.02437802994266668,64.0,0.2,64,100.0,4.16844995677689e-06,86.0,0.0007740314938128708,1,1,adam,"{'neurons_per_layer_encoder': [64], 'neurons_per_layer_decoder': [64]}",64.0,[64],[64],[0.517805367419053],[0.12396704835421846],-0.8967491381209864,COMPLETE
323,0.396567438210652,0.00979487452738892,2024-12-23 11:29:00.628536,2024-12-23 11:29:04.757854,0 days 00:00:04.129318,0.024795793797534854,32.0,0.2,92,100.0,0.0004986050108471841,212.0,0.0052261224511979355,1,1,adam,"{'neurons_per_layer_encoder': [92], 'neurons_per_layer_decoder': [92]}",92.0,[92],[92],[0.396567438210652],[0.00979487452738892],-1.8558604419801648,COMPLETE
324,0.5412400011315945,0.40736881790814505,2024-12-23 11:29:01.105665,2024-12-23 11:29:04.849975,0 days 00:00:03.744310,0.024591484614000125,48.0,0.2,64,100.0,2.8630112501806e-06,86.0,0.0006116928294129505,1,1,adam,"{'neurons_per_layer_encoder': [64], 'neurons_per_layer_decoder': [64]}",64.0,[64],[64],[0.5412400011315945],[0.40736881790814505],-0.47649016180790094,COMPLETE
325,0.5813740785986738,0.5748821154837145,2024-12-23 11:29:02.459646,2024-12-23 11:29:05.526524,0 days 00:00:03.066878,0.02443391880386556,32.0,0.2,64,100.0,2.881965818376879e-06,86.0,0.0052673038171702855,1,1,adam,"{'neurons_per_layer_encoder': [64], 'neurons_per_layer_decoder': [64]}",64.0,[64],[64],[0.5813740785986738],[0.5748821154837145],-1.0944548945655286,COMPLETE
326,0.6378232949240263,0.013075085959572075,2024-12-23 11:29:03.639641,2024-12-23 11:29:06.410994,0 days 00:00:02.771353,0.02054516842918351,32.0,0.2,68,100.0,1.8844530024873212e-06,90.0,0.0006293622700516277,1,1,adam,"{'neurons_per_layer_encoder': [68], 'neurons_per_layer_decoder': [68]}",68.0,[68],[68],[0.6378232949240263],[0.013075085959572075],-1.053262598990708,COMPLETE
327,0.6668902541464188,0.3723118384998666,2024-12-23 11:29:03.642213,2024-12-23 11:29:06.389422,0 days 00:00:02.747209,0.020705991756266813,32.0,0.2,68,100.0,2.61441356259521e-06,90.0,0.0004698434459882716,1,1,adam,"{'neurons_per_layer_encoder': [68], 'neurons_per_layer_decoder': [68]}",68.0,[68],[68],[0.6668902541464188],[0.3723118384998666],-0.41898039982765445,COMPLETE
328,0.3704474325701115,0.13201105006399083,2024-12-23 11:29:03.976237,2024-12-23 11:29:06.240713,0 days 00:00:02.264476,0.020901657336992372,48.0,0.2,84,100.0,2.5957344942641307e-06,108.0,0.008208333828491489,1,1,adam,"{'neurons_per_layer_encoder': [84], 'neurons_per_layer_decoder': [84]}",84.0,[84],[84],[0.3704474325701115],[0.13201105006399083],-3.0641797454171136,COMPLETE
329,0.5754288996162711,0.18226787685753532,2024-12-23 11:29:04.765278,2024-12-23 11:29:07.491976,0 days 00:00:02.726698,0.02075525977111966,48.0,0.2,72,100.0,1.88726451502052e-06,111.0,0.0009779776349025172,1,1,adam,"{'neurons_per_layer_encoder': [72], 'neurons_per_layer_decoder': [72]}",72.0,[72],[72],[0.5754288996162711],[0.18226787685753532],-1.079610707168448,COMPLETE
330,0.6868117525418191,0.4857714369689943,2024-12-23 11:29:04.857351,2024-12-23 11:29:07.694080,0 days 00:00:02.836729,0.020882784929951728,32.0,0.2,72,100.0,2.573679257509642e-06,111.0,0.0010057234101960315,1,1,adam,"{'neurons_per_layer_encoder': [72], 'neurons_per_layer_decoder': [72]}",72.0,[72],[72],[0.6868117525418191],[0.4857714369689943],-0.6277513656195276,COMPLETE
331,-0.46739472459360454,-0.3173700543769309,2024-12-23 11:29:05.534564,2024-12-23 11:29:07.440322,0 days 00:00:01.905758,0.020975023573576865,40.0,0.2,72,100.0,1.9519052080195166e-06,111.0,0.00024794749763179476,1,1,adadelta,"{'neurons_per_layer_encoder': [72], 'neurons_per_layer_decoder': [72]}",72.0,[72],[72],[-0.46739472459360454],[-0.3173700543769309],-0.23111528368196801,COMPLETE
332,-1.4400838631663135,0.20070686341307153,2024-12-23 11:29:06.248092,2024-12-23 11:29:07.732530,0 days 00:00:01.484438,0.02229243949650727,40.0,0.2,72,100.0,1.0096602385499154e-06,111.0,0.0004814291050638559,1,1,adadelta,"{'neurons_per_layer_encoder': [72], 'neurons_per_layer_decoder': [72]}",72.0,[72],[72],[-1.4400838631663135],[0.20070686341307153],0.2039238163323714,COMPLETE
333,-1.4359962555524017,-0.2166026044771281,2024-12-23 11:29:06.396748,2024-12-23 11:29:08.208627,0 days 00:00:01.811879,0.18239046840428944,40.0,0.2,72,100.0,2.0462829829388413e-06,111.0,7.257025836642196e-05,1,1,adadelta,"{'neurons_per_layer_encoder': [72], 'neurons_per_layer_decoder': [72]}",72.0,[72],[72],[-1.4359962555524017],[-0.2166026044771281],0.15864470198860905,COMPLETE
334,0.08045166533085224,0.09811309534195134,2024-12-23 11:29:06.419574,2024-12-23 11:29:09.270599,0 days 00:00:02.851025,0.022181843601188217,40.0,0.2,76,100.0,2.053260081315997e-06,99.0,0.0009669058169019707,1,1,adadelta,"{'neurons_per_layer_encoder': [76], 'neurons_per_layer_decoder': [76]}",76.0,[76],[76],[0.08045166533085224],[0.09811309534195134],0.1741612473244206,COMPLETE
335,0.60789433650261,0.3486786009669758,2024-12-23 11:29:07.447450,2024-12-23 11:29:10.950117,0 days 00:00:03.502667,0.02258693496572568,40.0,0.1,256,100.0,2.439417427287571e-06,600.0,0.0010394636712487298,1,1,adam,"{'neurons_per_layer_encoder': [256], 'neurons_per_layer_decoder': [256]}",256.0,[256],[256],[0.60789433650261],[0.3486786009669758],-1.2428276107393168,COMPLETE
336,-0.2630725433903225,0.31632768406653367,2024-12-23 11:29:07.502795,2024-12-23 11:29:09.933046,0 days 00:00:02.430251,0.1160682519216538,40.0,0.30000000000000004,84,100.0,2.3779330552042627e-06,188.0,0.0005097352045067442,1,1,sgd,"{'neurons_per_layer_encoder': [84], 'neurons_per_layer_decoder': [84]}",84.0,[84],[84],[-0.2630725433903225],[0.31632768406653367],0.3023000224666169,COMPLETE
337,0.5217649332413583,0.5524018019846246,2024-12-23 11:29:07.701587,2024-12-23 11:29:10.619861,0 days 00:00:02.918274,0.019137595142211635,32.0,0.1,76,100.0,2.2953946867621247e-06,99.0,0.000916674172560444,1,1,adam,"{'neurons_per_layer_encoder': [76], 'neurons_per_layer_decoder': [76]}",76.0,[76],[76],[0.5217649332413583],[0.5524018019846246],-1.3856489748659733,COMPLETE
338,0.6203193706150298,0.44511417494571914,2024-12-23 11:29:07.741083,2024-12-23 11:29:10.947563,0 days 00:00:03.206480,0.019233531022689446,32.0,0.1,76,100.0,2.4759150225531997e-06,99.0,0.0009264561673061833,1,1,adam,"{'neurons_per_layer_encoder': [76], 'neurons_per_layer_decoder': [76]}",76.0,[76],[76],[0.6203193706150298],[0.44511417494571914],-1.021051446610688,COMPLETE
339,0.6410415430433976,0.34991130508198975,2024-12-23 11:29:08.216420,2024-12-23 11:29:11.107890,0 days 00:00:02.891470,0.019741439550543798,32.0,0.30000000000000004,76,100.0,2.390526957954766e-06,99.0,0.0009856620951803935,1,1,adam,"{'neurons_per_layer_encoder': [76], 'neurons_per_layer_decoder': [76]}",76.0,[76],[76],[0.6410415430433976],[0.34991130508198975],-0.582064494806646,COMPLETE
340,0.6258833109969786,0.4746009160770732,2024-12-23 11:29:09.277728,2024-12-23 11:29:12.147865,0 days 00:00:02.870137,0.018971493742511846,32.0,0.30000000000000004,84,100.0,3.845758794131451e-06,188.0,0.0010919680572839595,1,1,adam,"{'neurons_per_layer_encoder': [84], 'neurons_per_layer_decoder': [84]}",84.0,[84],[84],[0.6258833109969786],[0.4746009160770732],-0.3831385752986807,COMPLETE
341,0.5804622088129584,0.37980471096537427,2024-12-23 11:29:09.940972,2024-12-23 11:29:12.837797,0 days 00:00:02.896825,0.019122287931304986,32.0,0.1,76,100.0,3.9313253188425705e-06,99.0,0.0008818433903084876,1,1,adam,"{'neurons_per_layer_encoder': [76], 'neurons_per_layer_decoder': [76]}",76.0,[76],[76],[0.5804622088129584],[0.37980471096537427],-1.3233518247958707,COMPLETE
342,0.5942821692055783,0.5153636001951376,2024-12-23 11:29:10.627424,2024-12-23 11:29:14.440165,0 days 00:00:03.812741,0.01891635271971002,32.0,0.1,28,100.0,3.048806335360647e-06,216.0,0.0011393624990801595,1,3,adam,"{'neurons_per_layer_encoder': [28, 56, 112], 'neurons_per_layer_decoder': [112]}",28.0,[112],"[28, 56, 112]",[0.5942821692055783],[0.5153636001951376],-0.626059154989219,COMPLETE
343,0.6841428321077607,0.1944047624568025,2024-12-23 11:29:10.957493,2024-12-23 11:29:15.533346,0 days 00:00:04.575853,0.13565278298196715,32.0,0.4,64,100.0,3.004116913024586e-06,328.0,0.0010982738189279295,1,3,adam,"{'neurons_per_layer_encoder': [64, 128, 256], 'neurons_per_layer_decoder': [256]}",64.0,[256],"[64, 128, 256]",[0.6841428321077607],[0.1944047624568025],-0.18400725000049828,COMPLETE
344,0.5612064291813361,0.20534023825849934,2024-12-23 11:29:10.958620,2024-12-23 11:29:17.316986,0 days 00:00:06.358366,0.019473826746486827,32.0,0.4,148,100.0,3.101318309728248e-06,1016.0,0.0014201223205184874,1,3,adam,"{'neurons_per_layer_encoder': [148, 296, 592], 'neurons_per_layer_decoder': [592]}",148.0,[592],"[148, 296, 592]",[0.5612064291813361],[0.20534023825849934],-0.4905108914316681,COMPLETE
345,0.718369882490456,0.31563215916539766,2024-12-23 11:29:11.115140,2024-12-23 11:29:15.517070,0 days 00:00:04.401930,0.018133125792382444,32.0,0.4,64,100.0,3.7585663134997045e-06,424.0,0.001136261501297301,1,3,adam,"{'neurons_per_layer_encoder': [64, 128, 256], 'neurons_per_layer_decoder': [256]}",64.0,[256],"[64, 128, 256]",[0.718369882490456],[0.31563215916539766],-0.05625743121608112,COMPLETE
346,0.7448383282008686,0.2683034283198502,2024-12-23 11:29:12.156468,2024-12-23 11:29:17.698961,0 days 00:00:05.542493,0.018274705950508462,32.0,0.4,76,100.0,3.040330419855996e-06,744.0,0.0008459974831413668,1,3,adam,"{'neurons_per_layer_encoder': [76, 152, 304], 'neurons_per_layer_decoder': [304]}",76.0,[304],"[76, 152, 304]",[0.7448383282008686],[0.2683034283198502],0.06878969193914057,COMPLETE
347,-0.8826471945337362,0.03859418664484204,2024-12-23 11:29:12.844724,2024-12-23 11:29:15.530980,0 days 00:00:02.686256,0.021973103871147814,32.0,0.4,64,100.0,3.104715420230082e-06,424.0,1.1922755944070625e-05,1,3,adam,"{'neurons_per_layer_encoder': [64, 128, 256], 'neurons_per_layer_decoder': [256]}",64.0,[256],"[64, 128, 256]",[-0.8826471945337362],[0.03859418664484204],0.4561545360441359,COMPLETE
348,0.4748654838215859,0.4710584033219024,2024-12-23 11:29:14.447681,2024-12-23 11:29:19.367960,0 days 00:00:04.920279,0.021376630224306,32.0,0.1,64,100.0,3.1317127495194387e-06,392.0,0.0011650286124471252,1,3,adam,"{'neurons_per_layer_encoder': [64, 128, 256], 'neurons_per_layer_decoder': [256]}",64.0,[256],"[64, 128, 256]",[0.4748654838215859],[0.4710584033219024],-1.2943947034847232,COMPLETE
349,-0.022925307882613488,-0.012136885476451642,2024-12-23 11:29:15.524285,2024-12-23 11:29:19.168571,0 days 00:00:03.644286,0.021761061176343768,32.0,0.4,64,100.0,2.944158130951264e-06,424.0,0.001400670455227066,1,3,sgd,"{'neurons_per_layer_encoder': [64, 128, 256], 'neurons_per_layer_decoder': [256]}",64.0,[256],"[64, 128, 256]",[-0.022925307882613488],[-0.012136885476451642],0.35263743787236,COMPLETE
350,-0.8778681588286301,-0.12034550476453054,2024-12-23 11:29:15.538524,2024-12-23 11:29:17.637174,0 days 00:00:02.098650,0.01985945734256192,32.0,0.2,148,100.0,6.466259863868387e-05,1064.0,0.0015681400100980218,1,3,sgd,"{'neurons_per_layer_encoder': [148, 296, 592], 'neurons_per_layer_decoder': [592]}",148.0,[592],"[148, 296, 592]",[-0.8778681588286301],[-0.12034550476453054],0.555506048211598,COMPLETE
351,-0.7774279923686449,-0.23702623043501703,2024-12-23 11:29:15.540480,2024-12-23 11:29:17.780906,0 days 00:00:02.240426,0.08191131269551483,32.0,0.2,28,100.0,6.944190674488085e-05,232.0,0.0014905227296101826,5,3,sgd,"{'neurons_per_layer_encoder': [28, 56, 112], 'neurons_per_layer_decoder': [112, 56, 28, 14, 8]}",28.0,"[112, 56, 28, 14, 8]","[28, 56, 112]",[-0.7774279923686449],[-0.23702623043501703],0.2554984720741168,COMPLETE
352,0.21009057239189943,0.02525690228056232,2024-12-23 11:29:17.325625,2024-12-23 11:29:21.536526,0 days 00:00:04.210901,0.03847225499968895,32.0,0.2,204,100.0,2.7152438557037935e-06,1832.0,0.0011713147438695266,1,3,adam,"{'neurons_per_layer_encoder': [204, 408, 816], 'neurons_per_layer_decoder': [816]}",204.0,[816],"[204, 408, 816]",[0.21009057239189943],[0.02525690228056232],-0.7765166023928585,COMPLETE
353,0.6059892699726939,0.16663460858879697,2024-12-23 11:29:17.643042,2024-12-23 11:29:22.610270,0 days 00:00:04.967228,0.022132696598287663,32.0,0.2,28,100.0,2.729879960854834e-06,77.0,0.0011176803648763152,5,2,adam,"{'neurons_per_layer_encoder': [28, 56], 'neurons_per_layer_decoder': [56, 28, 14, 8, 8]}",28.0,"[56, 28, 14, 8, 8]","[28, 56]",[0.6059892699726939],[0.16663460858879697],-0.06048525473882098,COMPLETE
354,0.44548855688925204,0.3740827019291635,2024-12-23 11:29:17.710272,2024-12-23 11:29:22.844534,0 days 00:00:05.134262,0.021876889547947427,32.0,0.1,188,100.0,2.728823541201676e-06,896.0,0.0008552514991180843,1,2,adam,"{'neurons_per_layer_encoder': [188, 376], 'neurons_per_layer_decoder': [376]}",188.0,[376],"[188, 376]",[0.44548855688925204],[0.3740827019291635],-1.5584686082858246,COMPLETE
355,0.5800578762121903,0.31701220666442964,2024-12-23 11:29:17.787679,2024-12-23 11:29:21.972481,0 days 00:00:04.184802,0.02201223011284486,32.0,0.1,76,100.0,2.7143240155821094e-06,304.0,0.0008070825763118793,1,2,adam,"{'neurons_per_layer_encoder': [76, 152], 'neurons_per_layer_decoder': [152]}",76.0,[152],"[76, 152]",[0.5800578762121903],[0.31701220666442964],-1.6018034721638683,COMPLETE
356,0.5529958715245904,0.4339110568820176,2024-12-23 11:29:19.177137,2024-12-23 11:29:23.174809,0 days 00:00:03.997672,0.022204723403795475,32.0,0.1,88,100.0,9.539509052270521e-05,344.0,0.0008057048662570019,1,2,adam,"{'neurons_per_layer_encoder': [88, 176], 'neurons_per_layer_decoder': [176]}",88.0,[176],"[88, 176]",[0.5529958715245904],[0.4339110568820176],0.34756030839523994,COMPLETE
357,0.6504355701193518,0.36198406639915814,2024-12-23 11:29:19.376477,2024-12-23 11:29:23.348483,0 days 00:00:03.972006,0.023250071609202536,32.0,0.30000000000000004,52,100.0,2.1925440474660295e-06,224.0,0.0008443432630541549,1,2,adam,"{'neurons_per_layer_encoder': [52, 104], 'neurons_per_layer_decoder': [104]}",52.0,[104],"[52, 104]",[0.6504355701193518],[0.36198406639915814],-0.4453617235266358,COMPLETE
358,0.43288784842661454,0.5860862962255915,2024-12-23 11:29:21.979571,2024-12-23 11:29:25.264926,0 days 00:00:03.285355,0.03212639123649316,40.0,0.1,84,100.0,2.074148269074546e-06,368.0,0.0008490008425808699,1,2,adam,"{'neurons_per_layer_encoder': [84, 168], 'neurons_per_layer_decoder': [168]}",84.0,[168],"[84, 168]",[0.43288784842661454],[0.5860862962255915],-0.9817742111486263,COMPLETE
359,0.6386729412374758,0.4437062161221965,2024-12-23 11:29:22.851667,2024-12-23 11:29:25.956088,0 days 00:00:03.104421,0.0202942310942963,40.0,0.30000000000000004,88,100.0,2.124977449193526e-06,264.0,0.0009149166919904039,1,2,adam,"{'neurons_per_layer_encoder': [88, 176], 'neurons_per_layer_decoder': [176]}",88.0,[176],"[88, 176]",[0.6386729412374758],[0.4437062161221965],-0.1353461552075032,COMPLETE
360,0.6493485635673699,0.4515876482258182,2024-12-23 11:29:23.181375,2024-12-23 11:29:26.153156,0 days 00:00:02.971781,0.020216927031701585,40.0,0.30000000000000004,72,100.0,2.1698378303362325e-06,264.0,0.0009209507435773903,1,2,adam,"{'neurons_per_layer_encoder': [72, 144], 'neurons_per_layer_decoder': [144]}",72.0,[144],"[72, 144]",[0.6493485635673699],[0.4515876482258182],-0.11591687922923503,COMPLETE
361,-0.20686830037036041,-0.06565917282847278,2024-12-23 11:29:25.271108,2024-12-23 11:29:34.988743,0 days 00:00:09.717635,0.025268431764306938,40.0,0.30000000000000004,80,100.0,2.1968971066572836e-06,2424.0,0.0006747755572136082,1,5,adam,"{'neurons_per_layer_encoder': [80, 160, 320, 640, 1280], 'neurons_per_layer_decoder': [1280]}",80.0,[1280],"[80, 160, 320, 640, 1280]",[-0.20686830037036041],[-0.06565917282847278],-0.413838986930739,COMPLETE
362,0.6441276819171045,0.438762192688385,2024-12-23 11:29:26.158155,2024-12-23 11:29:37.899605,0 days 00:00:11.741450,0.026000346771561853,40.0,0.2,80,100.0,1.7660102144495628e-06,2376.0,0.0006722027389018796,1,5,adam,"{'neurons_per_layer_encoder': [80, 160, 320, 640, 1280], 'neurons_per_layer_decoder': [1280]}",80.0,[1280],"[80, 160, 320, 640, 1280]",[0.6441276819171045],[0.438762192688385],0.16788553872671588,COMPLETE
363,0.5828418410589222,0.17405168318136122,2024-12-23 11:29:34.994144,2024-12-23 11:29:46.476759,0 days 00:00:11.482615,0.026144508881025198,40.0,0.2,76,100.0,1.7889157932526997e-06,2232.0,0.0003698139577662682,1,5,adam,"{'neurons_per_layer_encoder': [76, 152, 304, 608, 1216], 'neurons_per_layer_decoder': [1216]}",76.0,[1216],"[76, 152, 304, 608, 1216]",[0.5828418410589222],[0.17405168318136122],-0.059257203001869006,COMPLETE
364,0.6294446727810583,0.5218560353791448,2024-12-23 11:29:37.905329,2024-12-23 11:29:49.266331,0 days 00:00:11.361002,0.023770650580867223,40.0,0.2,76,100.0,1.8041395138038754e-06,2632.0,0.0005633797244580269,1,5,adam,"{'neurons_per_layer_encoder': [76, 152, 304, 608, 1216], 'neurons_per_layer_decoder': [1216]}",76.0,[1216],"[76, 152, 304, 608, 1216]",[0.6294446727810583],[0.5218560353791448],0.2948711757204513,COMPLETE
365,0.7439926913681025,0.1590624429826748,2024-12-23 11:29:46.484243,2024-12-23 11:29:50.062034,0 days 00:00:03.577791,0.02406850673978241,40.0,0.2,68,100.0,2.4351989568479164e-06,288.0,0.000560033871214251,1,2,adam,"{'neurons_per_layer_encoder': [68, 136], 'neurons_per_layer_decoder': [136]}",68.0,[136],"[68, 136]",[0.7439926913681025],[0.1590624429826748],-0.40311269083212364,COMPLETE
