number,values_0,values_1,datetime_start,datetime_complete,duration,params_alpha,params_batch_size,params_drop_out_rate,params_encoder_neurons_layer_1,params_epochs,params_lambda,params_latent_dim,params_learning_rate,params_num_layers_decoder,params_num_layers_encoder,params_optimizer,user_attrs_encoder_decoder_config,user_attrs_first_layer_neurons,user_attrs_neurons_per_layer_decoder,user_attrs_neurons_per_layer_encoder,user_attrs_r2_feature_1,user_attrs_r2_feature_2,user_attrs_relative_deterioration,state
420,0.6547095515814354,0.17681664153285637,2024-12-23 11:33:55.814250,2024-12-23 11:34:18.782991,0 days 00:00:22.968741,0.024408975257532637,40.0,0.2,76,100.0,2.6704865949845165e-06,2712.0,0.009922161264835076,1,5,adadelta,"{'neurons_per_layer_encoder': [76, 152, 304, 608, 1216], 'neurons_per_layer_decoder': [1216]}",76.0,[1216],"[76, 152, 304, 608, 1216]",[0.6547095515814354],[0.17681664153285637],0.44739413773416553,COMPLETE
421,-0.23130242490740094,0.27533929781642585,2024-12-23 11:33:55.825508,2024-12-23 11:34:17.079425,0 days 00:00:21.253917,0.03650444686438413,40.0,0.2,76,100.0,0.00021322008457090228,2696.0,0.000738357497381045,1,5,adadelta,"{'neurons_per_layer_encoder': [76, 152, 304, 608, 1216], 'neurons_per_layer_decoder': [1216]}",76.0,[1216],"[76, 152, 304, 608, 1216]",[-0.23130242490740094],[0.27533929781642585],0.94373569881962,COMPLETE
422,-0.1157902724780222,-0.5953248638323534,2024-12-23 11:33:55.927753,2024-12-23 11:33:59.617363,0 days 00:00:03.689610,0.14156930667763212,40.0,0.2,244,100.0,2.5538895206869995e-06,556.0,0.0007262194529158902,1,1,adadelta,"{'neurons_per_layer_encoder': [244], 'neurons_per_layer_decoder': [244]}",244.0,[244],[244],[-0.1157902724780222],[-0.5953248638323534],0.03996064798848359,COMPLETE
423,-0.43235374824980033,-0.5637809949349786,2024-12-23 11:33:56.502522,2024-12-23 11:34:06.801933,0 days 00:00:10.299411,0.02255659906388698,40.0,0.2,76,100.0,2.596528035285857e-06,2632.0,0.000744571041498846,1,5,adadelta,"{'neurons_per_layer_encoder': [76, 152, 304, 608, 1216], 'neurons_per_layer_decoder': [1216]}",76.0,[1216],"[76, 152, 304, 608, 1216]",[-0.43235374824980033],[-0.5637809949349786],0.13007858984263632,COMPLETE
424,0.004964704110968277,-0.12555586105029137,2024-12-23 11:33:57.438104,2024-12-23 11:34:33.434031,0 days 00:00:35.995927,0.022191492361001132,40.0,0.2,132,100.0,2.6336045375465865e-06,3448.0,0.0007237644018138628,1,5,adadelta,"{'neurons_per_layer_encoder': [132, 264, 528, 1056, 2112], 'neurons_per_layer_decoder': [2112]}",132.0,[2112],"[132, 264, 528, 1056, 2112]",[0.004964704110968277],[-0.12555586105029137],0.4162452641152999,COMPLETE
425,0.14608045988597662,0.03305957875642318,2024-12-23 11:33:59.630149,2024-12-23 11:34:13.441991,0 days 00:00:13.811842,0.022298938724636872,40.0,0.2,76,100.0,3.7665317625560383e-06,2632.0,0.0008404194388643304,1,5,adam,"{'neurons_per_layer_encoder': [76, 152, 304, 608, 1216], 'neurons_per_layer_decoder': [1216]}",76.0,[1216],"[76, 152, 304, 608, 1216]",[0.14608045988597662],[0.03305957875642318],0.0787507357311004,COMPLETE
426,-2.4695437323295826,-0.0503732163035,2024-12-23 11:34:01.003280,2024-12-23 11:34:23.673092,0 days 00:00:22.669812,0.022124291341033244,40.0,0.2,172,100.0,2.6900475934140156e-06,3816.0,0.0008186266810419611,1,5,adam,"{'neurons_per_layer_encoder': [172, 344, 688, 1376, 2752], 'neurons_per_layer_decoder': [2752]}",172.0,[2752],"[172, 344, 688, 1376, 2752]",[-2.4695437323295826],[-0.0503732163035],0.047183332519921635,COMPLETE
427,0.2872414951086709,0.5277971242194606,2024-12-23 11:34:06.818524,2024-12-23 11:34:30.199313,0 days 00:00:23.380789,0.02152877643858967,40.0,0.2,76,100.0,0.0002193509050149369,2552.0,0.0008672368257154636,1,5,adam,"{'neurons_per_layer_encoder': [76, 152, 304, 608, 1216], 'neurons_per_layer_decoder': [1216]}",76.0,[1216],"[76, 152, 304, 608, 1216]",[0.2872414951086709],[0.5277971242194606],0.9017799012980807,COMPLETE
428,0.09644202060023466,0.11196063122901145,2024-12-23 11:34:13.483236,2024-12-23 11:34:24.193048,0 days 00:00:10.709812,0.035280214698378984,120.0,0.2,80,100.0,4.718885346165209e-06,184.0,0.0006023103646649358,1,1,adam,"{'neurons_per_layer_encoder': [80], 'neurons_per_layer_decoder': [80]}",80.0,[80],[80],[0.09644202060023466],[0.11196063122901145],-0.83477821968418,COMPLETE
429,0.28815157541337244,0.49580707199837326,2024-12-23 11:34:17.089691,2024-12-23 11:34:26.104711,0 days 00:00:09.015020,0.02181818971959507,40.0,0.4,80,100.0,4.431749911132903e-06,184.0,4.318931859257623e-05,1,1,adam,"{'neurons_per_layer_encoder': [80], 'neurons_per_layer_decoder': [80]}",80.0,[80],[80],[0.28815157541337244],[0.49580707199837326],0.462829946016345,COMPLETE
430,-0.10947717646657384,0.15612361496311788,2024-12-23 11:34:18.810602,2024-12-23 11:34:26.721243,0 days 00:00:07.910641,0.021560821078380914,40.0,0.4,84,100.0,4.630631454549421e-06,188.0,4.459331027123415e-05,1,1,adam,"{'neurons_per_layer_encoder': [84], 'neurons_per_layer_decoder': [84]}",84.0,[84],[84],[-0.10947717646657384],[0.15612361496311788],0.2580410351667891,COMPLETE
431,0.6754553756266153,0.48946630775429856,2024-12-23 11:34:23.685195,2024-12-23 11:34:29.705031,0 days 00:00:06.019836,0.021130265032738967,40.0,0.4,84,100.0,4.937225844066463e-06,188.0,0.0005703325039616899,1,1,adam,"{'neurons_per_layer_encoder': [84], 'neurons_per_layer_decoder': [84]}",84.0,[84],[84],[0.6754553756266153],[0.48946630775429856],0.23613157847219005,COMPLETE
432,0.6824471107674323,0.3307624343071859,2024-12-23 11:34:24.199795,2024-12-23 11:34:30.951138,0 days 00:00:06.751343,0.02155452848179462,40.0,0.4,132,100.0,0.0002492103227046159,252.0,0.0008866726143600945,1,1,adam,"{'neurons_per_layer_encoder': [132], 'neurons_per_layer_decoder': [132]}",132.0,[132],[132],[0.6824471107674323],[0.3307624343071859],0.5556635936735174,COMPLETE
433,0.5969250293549161,0.16381481321432212,2024-12-23 11:34:26.112915,2024-12-23 11:34:31.843558,0 days 00:00:05.730643,0.046586980460665374,40.0,0.2,84,100.0,1.936162124790454e-06,108.0,0.00035387246048238896,1,1,adam,"{'neurons_per_layer_encoder': [84], 'neurons_per_layer_decoder': [84]}",84.0,[84],[84],[0.5969250293549161],[0.16381481321432212],-0.49046554334715536,COMPLETE
434,0.6348149945096064,0.5047837446678756,2024-12-23 11:34:26.733887,2024-12-23 11:34:32.312727,0 days 00:00:05.578840,0.01853966548474685,40.0,0.2,72,100.0,1.8190149648063812e-06,159.0,0.0004869911961138466,1,1,adam,"{'neurons_per_layer_encoder': [72], 'neurons_per_layer_decoder': [72]}",72.0,[72],[72],[0.6348149945096064],[0.5047837446678756],-0.190477210889448,COMPLETE
435,0.6742691187204243,0.5019486506430375,2024-12-23 11:34:29.712892,2024-12-23 11:34:34.628867,0 days 00:00:04.915975,0.018241548168563774,40.0,0.1,68,100.0,1.909551493712636e-06,288.0,0.0005575066688358289,1,2,adam,"{'neurons_per_layer_encoder': [68, 136], 'neurons_per_layer_decoder': [136]}",68.0,[136],"[68, 136]",[0.6742691187204243],[0.5019486506430375],-0.4810492367149782,COMPLETE
436,-0.7420224157076414,-0.11399418028518116,2024-12-23 11:34:30.207432,2024-12-23 11:34:32.370484,0 days 00:00:02.163052,0.018367867251259183,40.0,0.30000000000000004,68,100.0,1.877471525986081e-06,288.0,0.000576193460338006,1,2,sgd,"{'neurons_per_layer_encoder': [68, 136], 'neurons_per_layer_decoder': [136]}",68.0,[136],"[68, 136]",[-0.7420224157076414],[-0.11399418028518116],0.18928036997826658,COMPLETE
437,-1.8673060301950422,-0.31569249549678857,2024-12-23 11:34:30.960262,2024-12-23 11:34:33.139824,0 days 00:00:02.179562,0.18978097003810612,48.0,0.1,68,100.0,1.8678769725434992e-06,288.0,0.00016089281192089276,2,2,sgd,"{'neurons_per_layer_encoder': [68, 136], 'neurons_per_layer_decoder': [136, 68]}",68.0,"[136, 68]","[68, 136]",[-1.8673060301950422],[-0.31569249549678857],0.10145404441771058,COMPLETE
438,-0.7302463863017357,-0.25209962166577604,2024-12-23 11:34:31.852950,2024-12-23 11:34:33.852406,0 days 00:00:01.999456,0.026187670338023675,48.0,0.30000000000000004,68,100.0,2.2601113293204174e-06,288.0,0.0001601646938420265,2,2,sgd,"{'neurons_per_layer_encoder': [68, 136], 'neurons_per_layer_decoder': [136, 68]}",68.0,"[136, 68]","[68, 136]",[-0.7302463863017357],[-0.25209962166577604],0.2482992034257351,COMPLETE
439,-1.22312397886521,-0.26522172052814663,2024-12-23 11:34:32.321458,2024-12-23 11:34:33.992495,0 days 00:00:01.671037,0.023105636527138516,48.0,0.30000000000000004,68,100.0,2.3423065853203484e-06,288.0,0.0005734052697083975,2,2,sgd,"{'neurons_per_layer_encoder': [68, 136], 'neurons_per_layer_decoder': [136, 68]}",68.0,"[136, 68]","[68, 136]",[-1.22312397886521],[-0.26522172052814663],0.4907506157178843,COMPLETE
440,0.5026354463357521,0.26452096022597693,2024-12-23 11:34:32.381906,2024-12-23 11:34:36.156047,0 days 00:00:03.774141,0.026040810460714554,48.0,0.30000000000000004,68,100.0,1.3652076383273215e-06,272.0,0.000686558335883226,1,2,adam,"{'neurons_per_layer_encoder': [68, 136], 'neurons_per_layer_decoder': [136]}",68.0,[136],"[68, 136]",[0.5026354463357521],[0.26452096022597693],-0.41253611810296825,COMPLETE
441,0.22186037802917058,0.07690273762195987,2024-12-23 11:34:33.148042,2024-12-23 11:34:37.231701,0 days 00:00:04.083659,0.040580971921861594,72.0,0.30000000000000004,124,100.0,7.90952942739311e-05,512.0,0.0004816049717448548,1,2,adam,"{'neurons_per_layer_encoder': [124, 248], 'neurons_per_layer_decoder': [248]}",124.0,[248],"[124, 248]",[0.22186037802917058],[0.07690273762195987],0.34048718253109594,COMPLETE
442,0.5550474343579787,0.046620544366038796,2024-12-23 11:34:33.444165,2024-12-23 11:34:39.947352,0 days 00:00:06.503187,0.039601933059297996,40.0,0.30000000000000004,156,100.0,1.4040586252296742e-06,688.0,0.00019135231952225752,4,2,adam,"{'neurons_per_layer_encoder': [156, 312], 'neurons_per_layer_decoder': [312, 156, 78, 39]}",156.0,"[312, 156, 78, 39]","[156, 312]",[0.5550474343579787],[0.046620544366038796],-0.020060772085292715,COMPLETE
443,0.6490441968757328,0.46597126235929764,2024-12-23 11:34:33.859570,2024-12-23 11:34:38.006359,0 days 00:00:04.146789,0.020794132856991977,40.0,0.30000000000000004,88,100.0,1.361778657646235e-06,392.0,0.0004805522957459069,1,2,adam,"{'neurons_per_layer_encoder': [88, 176], 'neurons_per_layer_decoder': [176]}",88.0,[176],"[88, 176]",[0.6490441968757328],[0.46597126235929764],0.13734462338461145,COMPLETE
444,-1.0986861247397277,-0.14248756440392918,2024-12-23 11:34:34.000616,2024-12-23 11:34:36.227862,0 days 00:00:02.227246,0.020553447564189833,40.0,0.1,92,100.0,0.00010129132752409688,400.0,1.1422041171341757e-05,1,2,adam,"{'neurons_per_layer_encoder': [92, 184], 'neurons_per_layer_decoder': [184]}",92.0,[184],"[92, 184]",[-1.0986861247397277],[-0.14248756440392918],0.33921311281242106,COMPLETE
445,0.479481271392714,0.31593510761502375,2024-12-23 11:34:34.637265,2024-12-23 11:34:42.479986,0 days 00:00:07.842721,0.02037390706583669,40.0,0.1,80,100.0,1.2977427328303867e-06,1272.0,0.0002040187539107194,1,4,adam,"{'neurons_per_layer_encoder': [80, 160, 320, 640], 'neurons_per_layer_decoder': [640]}",80.0,[640],"[80, 160, 320, 640]",[0.479481271392714],[0.31593510761502375],-0.3596499870304014,COMPLETE
446,0.10314083569978316,0.0025977945229135324,2024-12-23 11:34:36.163970,2024-12-23 11:34:39.500403,0 days 00:00:03.336433,0.020362445717902425,40.0,0.1,88,100.0,1.185958206183135e-06,712.0,0.006438150781793276,1,3,adam,"{'neurons_per_layer_encoder': [88, 176, 352], 'neurons_per_layer_decoder': [352]}",88.0,[352],"[88, 176, 352]",[0.10314083569978316],[0.0025977945229135324],-1.3234643883585677,COMPLETE
447,0.5809616572241904,0.2657913608624851,2024-12-23 11:34:36.236056,2024-12-23 11:34:46.537569,0 days 00:00:10.301513,0.11870783311349972,40.0,0.30000000000000004,124,100.0,0.000145394516156734,872.0,0.0004867203565878414,4,3,adam,"{'neurons_per_layer_encoder': [124, 248, 496], 'neurons_per_layer_decoder': [496, 248, 124, 62]}",124.0,"[496, 248, 124, 62]","[124, 248, 496]",[0.5809616572241904],[0.2657913608624851],0.9014273774394289,COMPLETE
448,0.5316022111476553,0.27756115108278545,2024-12-23 11:34:37.240070,2024-12-23 11:34:45.358989,0 days 00:00:08.118919,0.014902476143626739,40.0,0.1,80,100.0,0.00014213596744165117,584.0,0.0006360311987767768,5,3,adam,"{'neurons_per_layer_encoder': [80, 160, 320], 'neurons_per_layer_decoder': [320, 160, 80, 40, 20]}",80.0,"[320, 160, 80, 40, 20]","[80, 160, 320]",[0.5316022111476553],[0.27756115108278545],0.8401782886220306,COMPLETE
449,0.7381123077681228,0.5128267138078795,2024-12-23 11:34:38.016750,2024-12-23 11:34:45.570640,0 days 00:00:07.553890,0.0233096794376032,40.0,0.1,80,100.0,0.00013899965445684712,712.0,0.00021235506280433935,4,3,adam,"{'neurons_per_layer_encoder': [80, 160, 320], 'neurons_per_layer_decoder': [320, 160, 80, 40]}",80.0,"[320, 160, 80, 40]","[80, 160, 320]",[0.7381123077681228],[0.5128267138078795],0.9064362389405861,COMPLETE
450,0.29583233850159096,-0.15406997833821845,2024-12-23 11:34:39.509449,2024-12-23 11:34:48.130519,0 days 00:00:08.621070,0.02312215753754016,104.0,0.1,80,100.0,1.6539839792096078e-06,1096.0,0.0006484741968569543,4,4,adam,"{'neurons_per_layer_encoder': [80, 160, 320, 640], 'neurons_per_layer_decoder': [640, 320, 160, 80]}",80.0,"[640, 320, 160, 80]","[80, 160, 320, 640]",[0.29583233850159096],[-0.15406997833821845],-1.7937874759123762,COMPLETE
451,0.33469229927732824,0.09358319220335154,2024-12-23 11:34:39.955571,2024-12-23 11:34:47.970515,0 days 00:00:08.014944,0.1156340720267269,40.0,0.1,76,100.0,1.7287301231689718e-06,856.0,0.00063864307070899,1,4,adam,"{'neurons_per_layer_encoder': [76, 152, 304, 608], 'neurons_per_layer_decoder': [608]}",76.0,[608],"[76, 152, 304, 608]",[0.33469229927732824],[0.09358319220335154],-1.2555131004661335,COMPLETE
452,0.3789785954902787,0.15697493450613587,2024-12-23 11:34:42.489484,2024-12-23 11:34:50.409630,0 days 00:00:07.920146,0.015336485346350067,112.0,0.1,60,100.0,2.0733494002414228e-06,840.0,0.0014052121012142064,5,4,adam,"{'neurons_per_layer_encoder': [60, 120, 240, 480], 'neurons_per_layer_decoder': [480, 240, 120, 60, 30]}",60.0,"[480, 240, 120, 60, 30]","[60, 120, 240, 480]",[0.3789785954902787],[0.15697493450613587],-1.0411968965904923,COMPLETE
453,-1.1716681584677553,0.14485717846482027,2024-12-23 11:34:45.366928,2024-12-23 11:34:47.553129,0 days 00:00:02.186201,0.02328120675909621,40.0,0.1,60,100.0,1.6905807146873104e-06,82.0,3.138772027295805e-05,1,1,adam,"{'neurons_per_layer_encoder': [60], 'neurons_per_layer_decoder': [60]}",60.0,[60],[60],[-1.1716681584677553],[0.14485717846482027],-0.27101311400700034,COMPLETE
454,-0.3762267730216813,-0.007214165473085288,2024-12-23 11:34:45.578104,2024-12-23 11:34:51.642910,0 days 00:00:06.064806,0.026704710890621028,128.0,0.1,96,100.0,0.0001900107040094628,728.0,0.00024344870366229597,4,3,adadelta,"{'neurons_per_layer_encoder': [96, 192, 384], 'neurons_per_layer_decoder': [384, 192, 96, 48]}",96.0,"[384, 192, 96, 48]","[96, 192, 384]",[-0.3762267730216813],[-0.007214165473085288],0.8380813443535484,COMPLETE
455,-0.2738223690093442,0.002495971493727822,2024-12-23 11:34:46.546450,2024-12-23 11:34:54.723645,0 days 00:00:08.177195,0.02734835317965687,104.0,0.1,204,100.0,0.00010942426707673237,856.0,0.0002622120426930004,4,3,adadelta,"{'neurons_per_layer_encoder': [204, 408, 816], 'neurons_per_layer_decoder': [816, 408, 204, 102]}",204.0,"[816, 408, 204, 102]","[204, 408, 816]",[-0.2738223690093442],[0.002495971493727822],0.8599588812766982,COMPLETE
456,-0.1448182383501304,-0.09215846341559564,2024-12-23 11:34:47.560101,2024-12-23 11:34:54.257235,0 days 00:00:06.697134,0.144919722241031,112.0,0.1,100,100.0,8.416275504425551e-05,728.0,0.00027919271455144275,4,3,adadelta,"{'neurons_per_layer_encoder': [100, 200, 400], 'neurons_per_layer_decoder': [400, 200, 100, 50]}",100.0,"[400, 200, 100, 50]","[100, 200, 400]",[-0.1448182383501304],[-0.09215846341559564],0.7539542834828916,COMPLETE
457,-0.8983055579255352,-0.0892004370356787,2024-12-23 11:34:47.978144,2024-12-23 11:34:51.649484,0 days 00:00:03.671340,0.02725885247430383,104.0,0.1,100,100.0,0.00012029356871965065,728.0,0.0002335786597863823,4,3,adadelta,"{'neurons_per_layer_encoder': [100, 200, 400], 'neurons_per_layer_decoder': [400, 200, 100, 50]}",100.0,"[400, 200, 100, 50]","[100, 200, 400]",[-0.8983055579255352],[-0.0892004370356787],0.7144074155317314,COMPLETE
458,-0.5841619419414454,-0.13254967172324972,2024-12-23 11:34:48.138304,2024-12-23 11:34:52.943338,0 days 00:00:04.805034,0.14945577071810037,128.0,0.1,96,100.0,0.00012922137896716592,728.0,0.00023534882758332706,4,3,adadelta,"{'neurons_per_layer_encoder': [96, 192, 384], 'neurons_per_layer_decoder': [384, 192, 96, 48]}",96.0,"[384, 192, 96, 48]","[96, 192, 384]",[-0.5841619419414454],[-0.13254967172324972],0.7737043500800705,COMPLETE
459,-0.9969349575031787,-0.0805063695104753,2024-12-23 11:34:50.425991,2024-12-23 11:34:54.708850,0 days 00:00:04.282859,0.08182584026282036,128.0,0.1,100,100.0,0.00010387062069857062,728.0,0.00024825554705920015,4,3,adadelta,"{'neurons_per_layer_encoder': [100, 200, 400], 'neurons_per_layer_decoder': [400, 200, 100, 50]}",100.0,"[400, 200, 100, 50]","[100, 200, 400]",[-0.9969349575031787],[-0.0805063695104753],0.7032625130566396,COMPLETE
460,-1.0509118265845458,-0.01598659481022935,2024-12-23 11:34:51.654482,2024-12-23 11:34:54.302017,0 days 00:00:02.647535,0.0253717774559913,72.0,0.1,188,100.0,0.00011179112977336062,1416.0,0.0001847518386335094,4,3,sgd,"{'neurons_per_layer_encoder': [188, 376, 752], 'neurons_per_layer_decoder': [752, 376, 188, 94]}",188.0,"[752, 376, 188, 94]","[188, 376, 752]",[-1.0509118265845458],[-0.01598659481022935],0.8269668673750837,COMPLETE
461,-0.873392769754459,0.01470841770470166,2024-12-23 11:34:51.656883,2024-12-23 11:34:53.935315,0 days 00:00:02.278432,0.02467344392297266,120.0,0.1,100,100.0,8.586756865841068e-05,744.0,0.00013625258455025874,4,3,sgd,"{'neurons_per_layer_encoder': [100, 200, 400], 'neurons_per_layer_decoder': [400, 200, 100, 50]}",100.0,"[400, 200, 100, 50]","[100, 200, 400]",[-0.873392769754459],[0.01470841770470166],0.6530876991615833,COMPLETE
462,-0.6776925052192566,-0.2762419898071422,2024-12-23 11:34:52.950944,2024-12-23 11:34:56.460600,0 days 00:00:03.509656,0.025101482841472005,112.0,0.1,200,100.0,8.494314571587089e-05,856.0,0.0002898646246726854,5,3,sgd,"{'neurons_per_layer_encoder': [200, 400, 800], 'neurons_per_layer_decoder': [800, 400, 200, 100, 50]}",200.0,"[800, 400, 200, 100, 50]","[200, 400, 800]",[-0.6776925052192566],[-0.2762419898071422],0.7872499812483413,COMPLETE
463,-0.3054423133211448,-0.2620530597571926,2024-12-23 11:34:53.943713,2024-12-23 11:34:59.926719,0 days 00:00:05.983006,0.025685300053997637,120.0,0.1,204,100.0,0.00010660605648610982,1288.0,0.0002925569275213784,4,3,sgd,"{'neurons_per_layer_encoder': [204, 408, 816], 'neurons_per_layer_decoder': [816, 408, 204, 102]}",204.0,"[816, 408, 204, 102]","[204, 408, 816]",[-0.3054423133211448],[-0.2620530597571926],0.846102706797985,COMPLETE
464,-0.07691161651176648,-0.24276108405261887,2024-12-23 11:34:54.266555,2024-12-23 11:34:59.215298,0 days 00:00:04.948743,0.025441168307300113,120.0,0.1,88,100.0,0.00024741254676997025,616.0,0.0001973954176777076,5,3,sgd,"{'neurons_per_layer_encoder': [88, 176, 352], 'neurons_per_layer_decoder': [352, 176, 88, 44, 22]}",88.0,"[352, 176, 88, 44, 22]","[88, 176, 352]",[-0.07691161651176648],[-0.24276108405261887],0.8734186163537828,COMPLETE
465,-1.0586293783006893,-0.1996450065062516,2024-12-23 11:34:54.312189,2024-12-23 11:34:56.834354,0 days 00:00:02.522165,0.13153001102895526,56.0,0.1,92,100.0,0.00016200831774719357,664.0,0.00029982858739201266,5,3,sgd,"{'neurons_per_layer_encoder': [92, 184, 368], 'neurons_per_layer_decoder': [368, 184, 92, 46, 23]}",92.0,"[368, 184, 92, 46, 23]","[92, 184, 368]",[-1.0586293783006893],[-0.1996450065062516],0.7528148096130308,COMPLETE
466,-0.8679345145656585,-0.061621258030178705,2024-12-23 11:34:54.715779,2024-12-23 11:34:58.108406,0 days 00:00:03.392627,0.12924369768210955,104.0,0.1,252,100.0,0.00015237966098455744,1992.0,0.00021282491688601093,5,3,sgd,"{'neurons_per_layer_encoder': [252, 504, 1008], 'neurons_per_layer_decoder': [1008, 504, 252, 126, 63]}",252.0,"[1008, 504, 252, 126, 63]","[252, 504, 1008]",[-0.8679345145656585],[-0.061621258030178705],0.9039275871193736,COMPLETE
467,-0.6890578748629739,-0.11012372617931354,2024-12-23 11:34:54.735741,2024-12-23 11:34:59.601139,0 days 00:00:04.865398,0.06991341520135605,56.0,0.1,236,100.0,0.00024235653710274961,2040.0,0.00021247509049690538,5,3,sgd,"{'neurons_per_layer_encoder': [236, 472, 944], 'neurons_per_layer_decoder': [944, 472, 236, 118, 59]}",236.0,"[944, 472, 236, 118, 59]","[236, 472, 944]",[-0.6890578748629739],[-0.11012372617931354],0.9330235469338223,COMPLETE
468,-0.8775131926315816,-0.01273277070962564,2024-12-23 11:34:56.469386,2024-12-23 11:34:58.889679,0 days 00:00:02.420293,0.030921140235777987,48.0,0.1,84,100.0,5.91112807162795e-05,680.0,0.00019720811191244287,4,3,sgd,"{'neurons_per_layer_encoder': [84, 168, 336], 'neurons_per_layer_decoder': [336, 168, 84, 42]}",84.0,"[336, 168, 84, 42]","[84, 168, 336]",[-0.8775131926315816],[-0.01273277070962564],0.5696903429195904,COMPLETE
469,-0.7883036891475317,-0.03248239170764666,2024-12-23 11:34:56.843603,2024-12-23 11:34:59.553184,0 days 00:00:02.709581,0.013892757107317608,88.0,0.1,88,100.0,0.0002640573346583781,648.0,0.0002092253840530194,5,3,sgd,"{'neurons_per_layer_encoder': [88, 176, 352], 'neurons_per_layer_decoder': [352, 176, 88, 44, 22]}",88.0,"[352, 176, 88, 44, 22]","[88, 176, 352]",[-0.7883036891475317],[-0.03248239170764666],0.8577755628547794,COMPLETE
