number,value,datetime_start,datetime_complete,duration,params_batch_size,params_drop_out_rate,params_epochs,params_kernel_size,params_latent_dim,params_learning_rate,params_optimizer,user_attrs_relative_deterioration,user_attrs_test_r2,state
0,0.07453222272864889,2024-10-05 08:30:37.614278,2024-10-05 08:31:22.211583,0 days 00:00:44.597305,64,0.2,10,3,128,0.0009436606126764151,sgd,0.6689877096532579,0.09649730815203517,COMPLETE
1,0.2480914042679359,2024-10-05 08:31:22.218442,2024-10-05 08:32:12.590443,0 days 00:00:50.372001,128,0.3,10,4,192,0.00020736688106663372,sgd,0.7946599694217845,-2.0074408540919837,COMPLETE
2,0.36882824159908456,2024-10-05 08:32:12.595647,2024-10-05 08:32:45.330071,0 days 00:00:32.734424,80,0.2,10,2,64,0.00014085976384194706,sgd,0.5677786298938858,-3.4710501970073917,COMPLETE
3,0.09113232030454138,2024-10-05 08:32:45.335284,2024-10-05 08:34:29.601940,0 days 00:01:44.266656,128,0.3,50,4,128,0.00027943107111059166,sgd,0.8515278913155471,-0.10473421689401285,COMPLETE
4,0.0721242182203819,2024-10-05 08:34:29.607554,2024-10-05 08:36:41.676601,0 days 00:02:12.069047,96,0.3,30,3,96,0.0002273597636006416,adam,0.44634949831715404,0.12568788473153902,COMPLETE
5,0.11945008143714791,2024-10-05 08:36:41.682172,2024-10-05 08:37:16.371269,0 days 00:00:34.689097,112,0.2,50,2,64,0.00030155254708558947,sgd,0.8183804061465754,-0.44801088936849665,COMPLETE
6,0.03846645432061358,2024-10-05 08:37:16.376475,2024-10-05 08:39:38.009704,0 days 00:02:21.633229,64,0.1,30,3,192,0.00023026401190142583,adam,0.5058492041165317,0.5336977249282799,COMPLETE
7,0.04974350500870216,2024-10-05 08:39:38.015223,2024-10-05 08:41:55.357500,0 days 00:02:17.342277,80,0.1,30,3,128,0.000149509621324859,adam,0.5926299770705644,0.3969938231824708,COMPLETE
8,0.025120124199120967,2024-10-05 08:41:55.363383,2024-10-05 08:46:04.360254,0 days 00:04:08.996871,128,0.3,50,4,160,0.0004257115563001086,adam,0.40446311018659276,0.6954860729688528,COMPLETE
9,0.09495892349494936,2024-10-05 08:46:04.365842,2024-10-05 08:50:09.745313,0 days 00:04:05.379471,96,0.2,50,4,96,0.00020299745562221195,sgd,0.6583904462318352,-0.15112148613935483,COMPLETE
10,0.2927037750830835,2024-10-05 08:50:09.750848,2024-10-05 08:51:14.446756,0 days 00:01:04.695908,112,0.3,50,4,160,0.0005592132276025884,adadelta,0.8960427268908572,-2.548245832737978,COMPLETE
11,0.01582273360463462,2024-10-05 08:51:14.452024,2024-10-05 08:53:31.421466,0 days 00:02:16.969442,64,0.1,30,3,192,0.0005005944351746857,adam,0.3718785925245621,0.8081919218184601,COMPLETE
12,0.03147671525236082,2024-10-05 08:53:31.426982,2024-10-05 08:54:57.884141,0 days 00:01:26.457159,112,0.1,30,2,160,0.00047569400459047793,adam,0.47423227544366975,0.6184295071330494,COMPLETE
13,0.028544404799123537,2024-10-05 08:54:57.889609,2024-10-05 08:57:09.273279,0 days 00:02:11.383670,80,0.1,30,3,160,0.00046266557593474034,adam,0.41254534092703316,0.6539758827923312,COMPLETE
14,0.31994069060215297,2024-10-05 08:57:09.279143,2024-10-05 08:58:17.534393,0 days 00:01:08.255250,64,0.2,50,4,192,0.000712048099955967,adadelta,0.8539348564441265,-2.8784201598703922,COMPLETE
15,0.0520956356438009,2024-10-05 08:58:17.541014,2024-10-05 09:00:16.808615,0 days 00:01:59.267601,128,0.3,30,3,160,0.00039144279033185344,adam,0.49856005254481667,0.36848056700162557,COMPLETE
16,0.010125061275817719,2024-10-05 09:00:16.814851,2024-10-05 09:04:34.208344,0 days 00:04:17.393493,96,0.1,50,4,192,0.0006914814233341137,adam,0.37882556630251746,0.8772608707628069,COMPLETE
17,0.04248189403580147,2024-10-05 09:04:34.214241,2024-10-05 09:05:04.355584,0 days 00:00:30.141343,80,0.1,10,2,192,0.0007846912352227954,adam,0.5320057958042368,0.4850213208334512,COMPLETE
18,0.3837237816378354,2024-10-05 09:05:04.361165,2024-10-05 09:06:18.670705,0 days 00:01:14.309540,96,0.1,30,3,192,0.0006593579317468139,adadelta,0.7095601651703733,-3.6516185475654845,COMPLETE
19,0.025071025414496316,2024-10-05 09:06:18.676531,2024-10-05 09:08:19.475319,0 days 00:02:00.798788,96,0.1,30,3,192,0.000953473771077518,adam,0.2461684936818381,0.6960812636454592,COMPLETE
20,0.004833316048031134,2024-10-05 09:08:19.481709,2024-10-05 09:12:44.801716,0 days 00:04:25.320007,64,0.1,50,4,96,0.0005734877682080475,adam,0.5394681756278643,0.9414090456439651,COMPLETE
21,0.005557676604039417,2024-10-05 09:12:44.806853,2024-10-05 09:17:10.421710,0 days 00:04:25.614857,64,0.1,50,4,96,0.0005666921993981622,adam,0.5470529561189413,0.9326281225980405,COMPLETE
22,0.015591904388270395,2024-10-05 09:17:10.426865,2024-10-05 09:21:37.016518,0 days 00:04:26.589653,64,0.1,50,4,96,0.0005921371429367286,adam,0.3644148154734711,0.8109901050834558,COMPLETE
23,0.009903659906728663,2024-10-05 09:21:37.021855,2024-10-05 09:25:57.585129,0 days 00:04:20.563274,80,0.1,50,4,96,0.0003714035793588867,adam,0.5141434739344916,0.879944766742658,COMPLETE
24,0.025505712844871107,2024-10-05 09:25:57.591297,2024-10-05 09:30:20.567670,0 days 00:04:22.976373,80,0.2,50,4,96,0.00035890089758363984,adam,0.34430377856750777,0.6908118479608369,COMPLETE
25,0.5494424831833646,2024-10-05 09:30:20.572893,2024-10-05 09:31:23.037870,0 days 00:01:02.464977,64,0.1,50,4,64,0.00035149878218712686,adadelta,0.6472965638688016,-5.660511982570779,COMPLETE
26,0.011546734365276317,2024-10-05 09:31:23.043765,2024-10-05 09:35:42.816215,0 days 00:04:19.772450,80,0.1,50,4,96,0.0005443897488629136,adam,0.4126364659541389,0.8600269091791022,COMPLETE
27,0.011964508894399838,2024-10-05 09:35:42.822473,2024-10-05 09:40:13.907407,0 days 00:04:31.084934,64,0.1,50,4,128,0.0002669018002421773,adam,0.5711439859200939,0.8549625169225765,COMPLETE
28,0.03807584878512804,2024-10-05 09:40:13.912636,2024-10-05 09:44:35.547120,0 days 00:04:21.634484,80,0.2,50,4,96,0.00011216595678560943,adam,0.6332929047323297,0.5384327662277559,COMPLETE
29,0.4046940324032888,2024-10-05 09:44:35.552506,2024-10-05 09:45:43.492940,0 days 00:01:07.940434,64,0.2,50,4,64,0.0008455465747580061,adadelta,0.8215355342542507,-3.905826423322707,COMPLETE
30,0.006201771005853754,2024-10-05 21:17:29.514470,2024-10-05 21:22:43.295162,0 days 00:05:13.780692,64,0.1,50,4,128,0.00041559652446374165,adam,0.6146734505723784,0.9248202107373927,COMPLETE
31,0.00903042467249767,2024-10-05 21:22:43.302888,2024-10-05 21:27:42.839087,0 days 00:04:59.536199,64,0.1,50,4,128,0.00040348470098278415,adam,0.5425459311085143,0.8905303947550763,COMPLETE
32,0.016023932767666726,2024-10-05 21:27:42.844631,2024-10-05 22:06:30.777194,0 days 00:38:47.932563,64,0.1,50,4,128,0.00044706777340053003,adam,0.26967329228211073,0.8057529232384917,COMPLETE
33,0.00723640915997191,2024-10-05 22:06:30.782613,2024-10-05 22:11:10.923242,0 days 00:04:40.140629,64,0.1,50,4,128,0.000594963183258024,adam,0.5133670227147255,0.9122780065321364,COMPLETE
34,0.044284899325263624,2024-10-05 22:11:10.928276,2024-10-05 22:15:31.372059,0 days 00:04:20.443783,64,0.1,50,4,128,0.0006187898363851703,sgd,0.5299159744911829,0.46316473219559473,COMPLETE
35,0.006115988128458004,2024-10-05 22:15:31.377850,2024-10-05 22:20:10.115276,0 days 00:04:38.737426,64,0.1,50,4,128,0.0008052129069179867,adam,0.5590533038097555,0.9258600973502434,COMPLETE
36,0.0935445859329706,2024-10-05 22:20:10.120434,2024-10-05 22:21:01.556834,0 days 00:00:51.436400,64,0.2,10,4,96,0.0008210391872403464,sgd,0.6139014514319676,-0.1339764480920953,COMPLETE
37,0.013264442591374267,2024-10-05 22:21:01.562411,2024-10-05 22:25:27.888223,0 days 00:04:26.325812,80,0.1,50,4,64,0.0009821979147961095,adam,0.3825967969006833,0.8392043179659148,COMPLETE
38,0.006960848258761942,2024-10-05 22:25:27.893698,2024-10-05 22:29:12.501535,0 days 00:03:44.607837,64,0.1,50,3,128,0.0007528120921804625,adam,0.4946622923502837,0.915618441137417,COMPLETE
39,0.012538527003167722,2024-10-05 22:29:12.506904,2024-10-05 22:33:52.830360,0 days 00:04:40.323456,64,0.2,50,4,96,0.0003026746207854546,adam,0.48190520605146847,0.8480040915938507,COMPLETE
40,0.04597345505280992,2024-10-05 22:33:52.836642,2024-10-05 22:38:01.282915,0 days 00:04:08.446273,80,0.1,50,4,96,0.0005084328457499604,sgd,0.6579770753089057,0.442695536600453,COMPLETE
41,0.006819677461473509,2024-10-05 22:38:01.288364,2024-10-05 22:41:39.877118,0 days 00:03:38.588754,64,0.1,50,3,128,0.0007588291416968769,adam,0.46034717577935075,0.9173297572727855,COMPLETE
42,0.010172349292883237,2024-10-05 22:41:39.882443,2024-10-05 22:45:24.430148,0 days 00:03:44.547705,64,0.1,50,3,128,0.0006627083226088537,adam,0.44323453034353727,0.8766876307714759,COMPLETE
43,0.010616829654210841,2024-10-05 22:45:24.435318,2024-10-05 23:05:56.714583,0 days 00:20:32.279265,64,0.1,50,3,128,0.0008906267363006333,adam,0.2901279313957626,0.8712995021442763,COMPLETE
44,0.01401473248132947,2024-10-05 23:05:56.720049,2024-10-05 23:30:32.594610,0 days 00:24:35.874561,64,0.1,50,2,128,0.0005342706562884421,adam,0.37852001320194417,0.8301090715017265,COMPLETE
45,0.007517620507383123,2024-10-05 23:30:32.600399,2024-10-05 23:40:21.714325,0 days 00:09:49.113926,80,0.1,50,3,160,0.0007327027720786379,adam,0.45738759317851996,0.9088690754676593,COMPLETE
46,0.016588909491171724,2024-10-05 23:40:21.719679,2024-10-05 23:58:48.537284,0 days 00:18:26.817605,64,0.1,30,3,128,0.0008741484303177574,adam,0.358943877098681,0.7989041003826828,COMPLETE
47,0.009525550184142537,2024-10-05 23:58:48.543307,2024-10-06 00:55:23.974143,0 days 00:56:35.430836,112,0.1,50,4,160,0.0006406232365022945,adam,0.46311667788282695,0.8845283299273252,COMPLETE
48,0.07950129662051171,2024-10-06 00:55:23.979894,2024-10-06 00:57:24.214981,0 days 00:02:00.235087,64,0.1,30,3,96,0.00042768752755148454,sgd,0.4453959394500032,0.03626065515921095,COMPLETE
49,0.44232167135479417,2024-10-06 00:57:24.220706,2024-10-06 01:14:08.690305,0 days 00:16:44.469599,80,0.2,50,4,64,0.0004903250607119975,adadelta,0.7895104231583044,-4.361960318649308,COMPLETE
50,0.04515322700472597,2024-10-06 01:14:08.695561,2024-10-06 01:14:38.524152,0 days 00:00:29.828591,64,0.1,10,2,128,0.0007801366394134608,adam,0.45490313189351567,0.45263859508230075,COMPLETE
51,0.011805879185741063,2024-10-06 01:14:38.529517,2024-10-06 01:19:09.416157,0 days 00:04:30.886640,64,0.1,50,3,128,0.0007571758168799989,adam,0.2732904120272753,0.8568854753898432,COMPLETE
52,0.010159570039501119,2024-10-06 01:19:09.421925,2024-10-06 01:38:55.501527,0 days 00:19:46.079602,64,0.1,50,3,160,0.0005665174108934691,adam,0.4237715258427717,0.8768425448396178,COMPLETE
53,0.011275375782927146,2024-10-06 01:38:55.507167,2024-10-06 02:15:50.578993,0 days 00:36:55.071826,64,0.1,50,3,128,0.0006792105150231372,adam,0.33238641518850187,0.8633164019733951,COMPLETE
54,0.006514902839731205,2024-10-06 02:15:50.584503,2024-10-06 02:19:27.015399,0 days 00:03:36.430896,64,0.1,50,3,96,0.0007370693749512262,adam,0.4800256074004235,0.9210243296479265,COMPLETE
55,0.00654006784339566,2024-10-06 02:19:27.022281,2024-10-06 02:56:25.018799,0 days 00:36:57.996518,64,0.1,50,3,96,0.0009001708001103473,adam,0.5114851448365495,0.9207192716781142,COMPLETE
56,0.02706696290255086,2024-10-06 02:56:25.024083,2024-10-06 02:58:30.636438,0 days 00:02:05.612355,80,0.3,30,3,96,0.000999002424876692,adam,0.34684455431320294,0.6718858911314394,COMPLETE
57,0.004880644133858048,2024-10-06 02:58:30.642575,2024-10-06 03:20:07.327178,0 days 00:21:36.684603,64,0.1,50,4,96,0.0008936233984150212,adam,0.5517287177956647,0.9408353199266963,COMPLETE
58,0.006485719063024244,2024-10-06 03:20:07.332848,2024-10-06 03:41:18.350428,0 days 00:21:11.017580,80,0.1,50,4,64,0.0006140197176010394,adam,0.5659328889757842,0.92137810442946,COMPLETE
59,0.20511862710032622,2024-10-06 03:41:18.355669,2024-10-06 03:42:32.276750,0 days 00:01:13.921081,80,0.1,50,4,64,0.00017309237387642146,adadelta,0.8906435854487923,-1.4865115375402302,COMPLETE
60,0.008453506938027178,2024-10-09 22:02:40.094931,2024-10-09 22:07:54.699450,0 days 00:05:14.604519,48,0.1,50,4,64,0.0005207176929242996,adam,0.45684404350198327,0.8975239702447895,COMPLETE
61,0.014516344857905056,2024-10-09 22:07:54.706059,2024-10-09 22:12:50.757242,0 days 00:04:56.051183,48,0.1,50,4,96,0.0006974038939058063,adam,0.32032165333994533,0.8240283708878416,COMPLETE
62,0.017291046378369746,2024-10-09 22:12:50.762656,2024-10-09 22:16:33.198123,0 days 00:03:42.435467,32,0.1,50,4,64,0.000608262814077408,adam,0.3485076908940053,0.7903925795343274,COMPLETE
63,0.006377560951837073,2024-10-09 22:16:33.203503,2024-10-09 22:21:21.255741,0 days 00:04:48.052238,48,0.1,50,4,96,0.0003356218735684701,adam,0.5359432791662472,0.9226892305575318,COMPLETE
64,0.005851947172250172,2024-10-09 22:21:21.260995,2024-10-09 22:26:10.578528,0 days 00:04:49.317533,48,0.1,50,4,96,0.000322348181981209,adam,0.5938218300755239,0.9290608836136617,COMPLETE
65,0.008315520605131754,2024-10-09 22:26:10.583903,2024-10-09 22:31:00.029265,0 days 00:04:49.445362,48,0.1,50,4,96,0.00025541459486742727,adam,0.5904594747267816,0.8991966833163308,COMPLETE
66,0.01173687719327989,2024-10-09 22:31:00.035260,2024-10-09 22:35:43.883648,0 days 00:04:43.848388,48,0.1,50,4,96,0.0003257986971340295,adam,0.4556938920338133,0.8577219389172831,COMPLETE
67,0.011578862657385853,2024-10-09 22:35:43.889142,2024-10-09 22:40:21.206107,0 days 00:04:37.316965,48,0.1,50,4,96,0.0003420501202225947,adam,0.5075495216988283,0.8596374400697329,COMPLETE
68,0.08845365776575285,2024-10-09 22:40:21.211665,2024-10-09 22:41:22.875700,0 days 00:01:01.664035,48,0.2,30,4,96,0.00038889548594801994,sgd,0.743228857440417,-0.07226263982648162,COMPLETE
69,0.005245801260034475,2024-10-09 22:41:22.880887,2024-10-09 22:46:18.508778,0 days 00:04:55.627891,32,0.1,50,4,96,0.0002904401367277286,adam,0.5705497978418512,0.936408772128048,COMPLETE
70,0.44871687741028327,2024-10-10 11:01:13.305647,2024-10-10 11:02:51.064470,0 days 00:01:37.758823,32,0.1,50,4,96,0.00023884100069860589,adadelta,0.7725320684709881,-4.43948498750419,COMPLETE
71,0.004381398411389396,2024-10-10 11:02:51.073377,2024-10-10 11:10:22.429920,0 days 00:07:31.356543,32,0.1,50,4,96,0.00028354514631230354,adam,0.659728642954651,0.9468873312263758,COMPLETE
72,0.005530839303286871,2024-10-10 11:10:22.437466,2024-10-10 11:16:41.133639,0 days 00:06:18.696173,32,0.1,50,4,96,0.00028856006735879567,adam,0.5961748473125451,0.932953452671184,COMPLETE
73,0.008280785891942328,2024-10-10 11:16:41.140023,2024-10-10 11:23:02.595745,0 days 00:06:21.455722,32,0.1,50,4,96,0.00028087472523353454,adam,0.5671802677265225,0.8996177482694246,COMPLETE
74,0.00707045621465219,2024-10-10 11:23:02.602119,2024-10-10 11:29:14.857405,0 days 00:06:12.255286,32,0.1,50,4,96,0.00021155062894832516,adam,0.5683451467097766,0.9142897395427344,COMPLETE
75,0.008851965566931462,2024-10-10 11:29:14.864603,2024-10-10 11:35:14.586437,0 days 00:05:59.721834,32,0.1,50,4,96,0.00028870338217573823,adam,0.5085460820337472,0.8926937313142297,COMPLETE
76,0.007413163970742822,2024-10-10 11:35:14.592348,2024-10-10 11:41:01.528873,0 days 00:05:46.936525,32,0.1,50,4,96,0.0003065257637517874,adam,0.5800228605804191,0.910135329962433,COMPLETE
77,0.0050153961717479744,2024-10-10 11:41:01.534962,2024-10-10 11:46:30.784878,0 days 00:05:29.249916,32,0.1,50,4,96,0.0002560354873404338,adam,0.6000647120939715,0.9392018139811028,COMPLETE
78,0.00524801986561183,2024-10-10 11:46:30.791089,2024-10-10 11:51:52.171658,0 days 00:05:21.380569,32,0.1,50,4,96,0.0002507169857787991,adam,0.6317336932316873,0.9363818775039793,COMPLETE
79,0.00899092874869213,2024-10-10 11:51:52.178268,2024-10-10 11:57:23.870835,0 days 00:05:31.692567,32,0.1,50,4,96,0.00023968546776796193,adam,0.5092416480767257,0.8910091765781443,COMPLETE
80,0.00509818852475328,2024-10-10 11:57:23.877054,2024-10-10 12:02:57.737237,0 days 00:05:33.860183,32,0.1,50,4,96,0.000263040978698539,adam,0.624106959286507,0.9381981794312912,COMPLETE
81,0.007506484027684934,2024-10-10 12:02:57.743544,2024-10-10 12:08:22.913360,0 days 00:05:25.169816,32,0.1,50,4,96,0.0002637671446038509,adam,0.5652528628107872,0.9090040753243207,COMPLETE
82,0.00590058801046369,2024-10-10 12:08:22.919212,2024-10-10 12:13:56.046799,0 days 00:05:33.127587,32,0.1,50,4,96,0.00020697742507223317,adam,0.6235592347545569,0.9284712443053097,COMPLETE
83,0.007912744389193762,2024-10-10 12:13:56.053603,2024-10-10 12:20:08.755959,0 days 00:06:12.702356,32,0.1,50,4,96,0.0002267747967587674,adam,0.5746544721122006,0.9040792613743771,COMPLETE
84,0.006058572486362048,2024-10-10 12:20:08.763022,2024-10-10 12:26:16.420343,0 days 00:06:07.657321,32,0.1,50,4,96,0.00018448363502479115,adam,0.6236556349672433,0.9265561075494393,COMPLETE
85,0.010918671074185616,2024-10-10 12:26:16.426184,2024-10-10 12:31:58.081014,0 days 00:05:41.654830,32,0.1,50,4,96,0.00025483685711402123,adam,0.4020318050320572,0.8676404869495826,COMPLETE
86,0.05631841390253839,2024-10-10 12:31:58.086907,2024-10-10 12:36:56.206028,0 days 00:04:58.119121,32,0.1,50,4,96,0.0002896812107829867,sgd,0.47036963705286816,0.3172907408543926,COMPLETE
87,0.010467442509290433,2024-10-10 12:36:56.211673,2024-10-10 12:42:26.830820,0 days 00:05:30.619147,32,0.1,50,4,96,0.0003616001107554854,adam,0.334911406431278,0.8731104193908271,COMPLETE
88,0.013501673778935986,2024-10-10 12:42:26.836547,2024-10-10 12:47:59.239631,0 days 00:05:32.403084,32,0.1,50,4,96,0.0002701645710996763,adam,0.5076761465598724,0.8363285280229172,COMPLETE
89,0.3805647029532196,2024-10-10 12:47:59.245425,2024-10-10 12:49:19.170245,0 days 00:01:19.924820,32,0.1,50,4,96,0.00021789503228134222,adadelta,0.8180560548407088,-3.61332321715918,COMPLETE
90,0.008873164537579742,2024-10-16 09:01:25.754641,2024-10-16 09:07:24.617965,0 days 00:05:58.863324,32,0.2,50,4,96,0.0001975128868422467,adam,0.5646874227729609,0.892436750825202,COMPLETE
91,0.018778914393115135,2024-10-16 09:07:24.624828,2024-10-16 09:13:12.587595,0 days 00:05:47.962767,32,0.1,50,4,96,0.0003019910943192738,adam,0.31076030860766773,0.772356182561019,COMPLETE
92,0.007728428717769878,2024-10-16 09:13:12.593114,2024-10-16 09:19:16.206166,0 days 00:06:03.613052,32,0.1,50,4,96,0.0002501696776091802,adam,0.5196867111619157,0.9063135930390522,COMPLETE
93,0.011338602580719318,2024-10-16 09:19:16.211679,2024-10-16 09:25:03.555062,0 days 00:05:47.343383,32,0.1,50,4,96,0.00032409459206504557,adam,0.48306922861221696,0.8625499471447214,COMPLETE
94,0.011265361792599083,2024-10-16 09:25:03.560285,2024-10-16 09:30:34.832154,0 days 00:05:31.271869,32,0.1,50,4,96,0.0002733044084416149,adam,0.37847874767662176,0.8634377946661971,COMPLETE
95,0.02100879353799726,2024-10-16 09:30:34.837633,2024-10-16 09:36:01.884375,0 days 00:05:27.046742,32,0.1,50,4,96,0.00023823878475386895,adam,0.3538738065085343,0.7453248968145627,COMPLETE
96,0.0037963372397444373,2024-10-16 09:36:01.889874,2024-10-16 09:41:26.468473,0 days 00:05:24.578599,32,0.1,50,4,64,0.00037699780478077095,adam,0.6639200845250663,0.9539796239841196,COMPLETE
97,0.005788823243987668,2024-10-16 09:41:26.474436,2024-10-16 09:46:48.599577,0 days 00:05:22.125141,32,0.1,50,4,64,0.0002874451862015984,adam,0.5298711683199556,0.9298260914260307,COMPLETE
98,0.012675813129277555,2024-10-16 09:46:48.604906,2024-10-16 09:51:57.969451,0 days 00:05:09.364545,32,0.1,50,4,64,0.00045301324542917584,adam,0.42096339496085683,0.8463398666458681,COMPLETE
99,0.005061723795766634,2024-10-16 09:51:57.975025,2024-10-16 09:57:08.728988,0 days 00:05:10.753963,32,0.1,50,4,64,0.0003747782018473624,adam,0.5788723540226275,0.9386402161717879,COMPLETE
100,0.004852968039908017,2024-10-16 22:32:44.263650,2024-10-16 22:42:10.992545,0 days 00:09:26.728895,32,0.1,50,4,64,0.0003797761739888817,adam,0.5828086781281263,0.9411708181108136,COMPLETE
101,0.005220171478910272,2024-10-16 22:32:44.263693,2024-10-16 22:42:01.172622,0 days 00:09:16.908929,32,0.1,50,4,64,0.00038138973611345864,adam,0.5531911180418322,0.9367194642742019,COMPLETE
102,0.005902577109620581,2024-10-16 22:32:44.263675,2024-10-16 22:41:54.467025,0 days 00:09:10.203350,32,0.1,50,4,64,0.0003820418803835938,adam,0.529533667751385,0.9284471318291644,COMPLETE
103,0.01054441362652655,2024-10-16 22:32:44.263712,2024-10-16 22:42:08.454968,0 days 00:09:24.191256,32,0.1,50,4,64,0.00037825562315411043,adam,0.4426807766354967,0.8721773516642605,COMPLETE
104,0.013762207678775434,2024-10-16 22:32:44.263763,2024-10-16 22:41:52.398574,0 days 00:09:08.134811,32,0.1,50,4,64,0.0003707930169542931,adam,0.37496778094531213,0.8331702553831815,COMPLETE
105,0.007176516790732481,2024-10-16 22:41:52.413822,2024-10-16 22:51:17.188585,0 days 00:09:24.774763,32,0.1,50,4,64,0.0004355073281907132,adam,0.5710491516954727,0.9130040403849841,COMPLETE
106,0.0054464686694485984,2024-10-16 22:41:54.480103,2024-10-16 22:51:10.085224,0 days 00:09:15.605121,32,0.1,50,4,64,0.0003138942723485603,adam,0.547831515142388,0.9339762196301586,COMPLETE
107,0.008592834242387291,2024-10-16 22:42:01.186011,2024-10-16 22:51:17.452282,0 days 00:09:16.266271,32,0.1,50,4,64,0.00031114441306160083,adam,0.5144386376225845,0.8958350015017589,COMPLETE
108,0.009752077674031164,2024-10-16 22:42:08.472486,2024-10-16 22:51:41.035420,0 days 00:09:32.562934,32,0.1,50,4,64,0.00040991365412874073,adam,0.4698908248735505,0.8817822935232175,COMPLETE
109,0.0070776723504626105,2024-10-16 22:42:11.009700,2024-10-16 22:51:57.203948,0 days 00:09:46.194248,32,0.1,50,4,64,0.00035557428695651123,adam,0.593264134975245,0.9142022633090899,COMPLETE
110,0.04288468411073435,2024-10-16 22:51:10.094283,2024-10-16 22:58:59.455782,0 days 00:07:49.361499,32,0.1,50,4,64,0.0004123659839430168,sgd,0.44428697847974064,0.48013857477237587,COMPLETE
111,0.035116766291247464,2024-10-16 22:51:17.201236,2024-10-16 22:59:12.264676,0 days 00:07:55.063440,32,0.1,50,4,64,0.00041697578703104454,sgd,0.47853449227445627,0.5743036808569211,COMPLETE
