number,value,datetime_start,datetime_complete,duration,params_batch_size,params_drop_out_rate,params_epochs,params_kernel_size,params_latent_dim,params_learning_rate,params_optimizer,user_attrs_relative_deterioration,user_attrs_test_r2,state
112,0.0850898781851853,2024-10-16 22:51:17.465511,2024-10-16 22:52:49.646507,0 days 00:01:32.180996,32,0.3,10,4,64,0.0004090719359537712,sgd,0.5796757951050377,-0.031485861749020794,COMPLETE
113,0.05412364142727353,2024-10-16 22:51:41.044540,2024-10-16 22:59:51.286752,0 days 00:08:10.242212,32,0.3,50,4,64,0.000468109351539501,sgd,0.15018080787924235,0.34389645267671565,COMPLETE
114,0.07578899730420571,2024-10-16 22:51:57.213482,2024-10-16 22:53:29.655360,0 days 00:01:32.441878,32,0.3,10,4,64,0.000340807863848634,sgd,0.7047379324462719,0.08126229743464763,COMPLETE
115,0.007369684636510878,2024-10-16 22:52:49.655908,2024-10-16 23:01:16.705203,0 days 00:08:27.049295,32,0.1,50,4,64,0.00034209705287395606,adam,0.554127930873631,0.9106623999206354,COMPLETE
116,0.008475724729572373,2024-10-16 22:53:29.666363,2024-10-16 23:01:52.736951,0 days 00:08:23.070588,32,0.1,50,4,64,0.00026380607337954593,adam,0.5383979038044207,0.8972546392932481,COMPLETE
117,0.0052183711129577415,2024-10-16 22:58:59.466380,2024-10-16 23:06:31.877971,0 days 00:07:32.411591,32,0.1,50,4,64,0.00025956484993722666,adam,0.5953144305346575,0.9367412888679799,COMPLETE
118,0.005639249975216851,2024-10-16 22:59:12.277074,2024-10-16 23:06:41.927767,0 days 00:07:29.650693,32,0.1,50,4,64,0.0002639883638233476,adam,0.5692720207869072,0.9316392649235519,COMPLETE
119,0.006031366814726041,2024-10-16 22:59:51.298240,2024-10-16 23:07:03.885382,0 days 00:07:12.587142,32,0.1,50,4,64,0.00022550546240190776,adam,0.6035544455269339,0.9268859031285428,COMPLETE
